reviewId,content,topic_id,topic_name,main_topic_prob,alt_topic_1,alt_topic_1_name,alt_topic_1_prob,alt_topic_2,alt_topic_2_name,alt_topic_2_prob
f124c4e3-690e-48cf-854d-150f80889ba1,biasa aja.,10,Lambat Instagram Lebih,0.7648441791534424,7,Bagus Lumayan Mantap,0.7786535024642944,27,Jaya Selalu Bermasalah,0.7076100707054138
90711a08-1632-41b1-b19e-730f216fa302,apk nya kenapa siii.. masuk gabisaaaaaaa🥲,3,Banget Lambat Susah,0.823452353477478,1,Tolong Aplikasi Tidak,0.7427724599838257,9,Bisa Tidak Dibuka,0.742617666721344
e1a39402-972a-4910-babf-7fd7ad4c34ff,lumayan,7,Bagus Lumayan Mantap,0.8734153509140015,10,Lambat Instagram Lebih,0.7908612489700317,27,Jaya Selalu Bermasalah,0.6916674375534058
19adaf84-ac83-4345-a067-656e4ac2355f,tidak bisa login,14,Rokok Bisa Enggak,0.7887251377105713,9,Bisa Tidak Dibuka,0.7072609066963196,8,Lama Loading Versi,0.7003960609436035
d04aa42b-6a7a-44c3-91e2-09715aeb978b,"Sebelumnya aman aja waktu digunakan, terus diminta update versi terbaru malah nggak bisa. Akhirnya di uninstall buat download ulang, sekarang malah nggak bisa di download😩 Tolong diperbaiki lagi🙏🏻",9,Bisa Tidak Dibuka,0.8312894105911255,1,Tolong Aplikasi Tidak,0.8359934091567993,17,Login Nomor Akun,0.8157151937484741
147a4c49-d44c-406e-ab05-be1fc101de38,"uang saya ditahan disini sebenernya bukan soal nominalnya tapi pertanggung jawabannya saya sudah mencoba untuk mengambil kembali hak saya tp mereka mengabaikan, kalian adalah pemegang sistemnya jika kalian rubah saja pesanan saya menjadi dibatalkan maka dngn otomatis uang akan langsung kembali saat itu juga, biasanya jg seperti itu tp kenyataannya kalian mempermainkan saya dengan menahan uang saya uang tdk seberapa tp akan kalian pertanggung jawabkan diakhirat nanti saya sudah mencoba mengingat",0,Di Ada Toko,0.731364369392395,17,Login Nomor Akun,0.6633793115615845,4,Jam Sampai Pengiriman,0.6483186483383179
8b07aefc-e027-4910-a158-a2be0f5b5cba,pengiriman lama beda sama toko sebelah,5,Barang Stok Toko,0.7637252807617188,16,Harga Toko Sama,0.7435939908027649,15,Ongkir Gratis Ongkirnya,0.7267448306083679
c179a357-b863-4acd-8182-a963dedda727,"aga kecewa si pake aplikasi klik indomaret,gak ada menu chat sama toko,jadi gak bisa nanya,kalo emang stok barang kosong seharusnya pas masukin barang ke produk ada notifnya kaya alfagift,terus kenapa tiba tiba produk yang kosong di batalin?,seharusnya pihak toko konfirmasi sama pelanggan,mau di ganti sama produk lain yang sesuai dengan harganya,apa gimana,ini gak ada konfirmasinya tiba tiba stok yang kosong langsung di batalin",0,Di Ada Toko,0.9194625020027161,4,Jam Sampai Pengiriman,0.8340237140655518,2,Tebus Murah Aplikasi,0.8151211738586426
9b878422-9b7a-4f81-812c-1f0dd68b9087,"kalo bisa jangan pakai jasa ketiga untuk ngirim barang, waktu itu sya pernah beli dari idm jalan sadar, Ama kurirnya langsung ditaroh aja dirumah orang, bukannya konfirmasi dulu, telfon dulu seperti biasanya, sya dtangin idm nya malah lepas tangan aja nyalahin kurir gojek , kurir gojek nyalahin yang ngasih titik😌, sampai sya cari sendiri tuh paket dimana, apl sebelah gaperna tuh pakai jasa pihak ketiga untuk delivery nya.. jdi kalo ada apa apa mereka langsung tanggung jawab,",0,Di Ada Toko,0.8438735604286194,4,Jam Sampai Pengiriman,0.8048051595687866,2,Tebus Murah Aplikasi,0.7656844854354858
8972f617-109c-4eb7-b3b3-eba0cbac71e4,setelah di update malah ga bisa pilih waktu pengiriman 😅,1,Tolong Aplikasi Tidak,0.8059261441230774,6,Pembayaran Bisa Tidak,0.805748462677002,4,Jam Sampai Pengiriman,0.7985519766807556
670a7072-3ffb-4a64-9a06-341ffa8effc8,emang verivikasi muusti bnnget y lwt whatsapp???klo llwt sms mang knp?? gw khilangan akun gegara veriv musti whatsapp di satu perangkat,1,Tolong Aplikasi Tidak,0.6955167055130005,17,Login Nomor Akun,0.7200780510902405,6,Pembayaran Bisa Tidak,0.6969279050827026
36368468-53b1-4fc7-af55-f5a6c7bf902c,mayan,7,Bagus Lumayan Mantap,0.8734153509140015,10,Lambat Instagram Lebih,0.7908612489700317,27,Jaya Selalu Bermasalah,0.6916674375534058
d7d3b23c-47e8-4f4d-870b-d11eb2bc84ee,ga konsisten waktu pengantarannya.,26,Pengantaran Lama Terlambat,0.8630201816558838,23,Batalkan Pengiriman Melebihi,0.6828105449676514,8,Lama Loading Versi,0.6810076236724854
fcf31b94-a6f9-4c4d-b9aa-9005833dec82,"selalu kalah satu langkah sama si merah,si merah gratis ongkir tanpa minimal belanja,disini harus belanja minimal 30.000 untuk menikmati gratis ongkir.",15,Ongkir Gratis Ongkirnya,0.8650264739990234,2,Tebus Murah Aplikasi,0.7384601831436157,0,Di Ada Toko,0.7166739702224731
db0c4fb1-b426-4d1a-ab0a-5d3b1621d901,Aplikasi sekarang ini sangat lambat. Susah untuk transaksi. Kalau sudah betul nanti bintang diperbaharui. update: sudah lumayan,1,Tolong Aplikasi Tidak,0.8177813291549683,2,Tebus Murah Aplikasi,0.8068633079528809,21,Keranjang Muncul Super,0.7947477102279663
f269bc2c-bc07-4a75-b8f7-d8d905118827,tiba tiba error ga jelas padahal udh lama pake aplikasi ini,9,Bisa Tidak Dibuka,0.8268123865127563,1,Tolong Aplikasi Tidak,0.8096983432769775,3,Banget Lambat Susah,0.7657332420349121
f9ce393b-d49f-4a81-ad1f-331258ae5522,masi banyak kekurangan sekarang dimana2 justru butuh dianter masa kopi ga bisa dianter harus ambil di toko,9,Bisa Tidak Dibuka,0.6381133198738098,5,Barang Stok Toko,0.7898193597793579,0,Di Ada Toko,0.756552517414093
a8f78b70-fbc3-4348-b945-2b8753d0d590,kenapa ga jadi satu saja dengan poinnya... kenapa harus terpisah aplikasi...? ribet amat ini...,2,Tebus Murah Aplikasi,0.7710760235786438,18,Lebih Tampilan Ribet,0.7397298812866211,24,Poinku Indomaret Klik,0.7279964089393616
5464b1b5-c4ff-4fe9-a68d-407bbd5cde97,"tolong ya utk pembelian air isi ulang galon di aplikasi max 4 tp toko beberapa kali hanya bsa bawa galonnya 2 saja, lbh baik max order di apk taro 2 saja dr pada sdh order 4 malah ga keangkut 2 kasian jg karyawan yg tokonya ga difasilitasi kendaraan yg bisa bawa galon 4... perbanyakan toko2 yg lebih dekat dgn konsumen.. indomaret banyak dekat area rmh tp klo beli di apk ini yg nganter indomaret yg areanya jauh kasian karyawannya!",0,Di Ada Toko,0.8268207907676697,2,Tebus Murah Aplikasi,0.7824918627738953,4,Jam Sampai Pengiriman,0.7619149088859558
b16b8878-142a-4714-a323-682d498bec02,"beda banget sma apk sebelah, apk ny sebelah tertera barang ada/ kosong , kasirnya indo juga ga pernah nanyain ada member / ngga",0,Di Ada Toko,0.8109614849090576,2,Tebus Murah Aplikasi,0.8027368187904358,5,Barang Stok Toko,0.7866803407669067
5b5538fc-eb10-4a6d-95bd-e78530e760d7,"rubah metode pembayaran aja ga bisa, ribet",6,Pembayaran Bisa Tidak,0.765353798866272,25,Pembayaran Kupon Pembatalan,0.7412461042404175,14,Rokok Bisa Enggak,0.7239208817481995
d31e39e8-b712-4cd2-af2c-feeaca6f6746,"Dari awal instal sampai sekarang tidak pernah bisa digunakan belanja,,,,sering gagal muat informasi,,,hadeuh,,,bikin aplikasi kok setengah2.",4,Jam Sampai Pengiriman,0.677696168422699,1,Tolong Aplikasi Tidak,0.8324713706970215,9,Bisa Tidak Dibuka,0.8317813873291016
1b5f2365-902c-428c-a6de-909dfc113a2c,ribet ngasi kartu expired,8,Lama Loading Versi,0.7610888481140137,14,Rokok Bisa Enggak,0.7473498582839966,11,Eror Sering Terlalu,0.7309549450874329
4e65f754-66d4-4c09-b570-33c3d35785ed,"kalau pas lgi harbolnas pasti sering eror dan delay, kalau pas ga harbolnas lancar lancar bae",2,Tebus Murah Aplikasi,0.6216800212860107,1,Tolong Aplikasi Tidak,0.6249204874038696,5,Barang Stok Toko,0.6145628690719604
5c8c74d8-a1b7-4c07-b1f3-573a2ab3b867,"harusnya tiap pesanan dibuat bisa kasih ulasan sih supaya kinerja deliveryman nya bisa di upgrade, sumpah delivman di daerah sini parah banget, mentang2 gada fitur kasih rating seenaknya sendiri kalau kerja. kadang kurir gamau nganter sampai rumah padahal letak rumah strategis depan jalan, kadang gamau turun dari motor, bahkan kadang orderan dibatalkan pakai alasan stok expired lah. mencoba komplen langsung ke aplikasi klik juga lama banget respon dari customer service",0,Di Ada Toko,0.8503877520561218,4,Jam Sampai Pengiriman,0.8231499195098877,2,Tebus Murah Aplikasi,0.8052624464035034
08308ca6-00f5-4e9f-958d-ee8d05070133,"Ya ampun, kenapa apk nya update² mulu dah. ga usah tiap bentar² update lah. bikin makin berat aja apk nya.",13,Update Dikit Mulu,0.8498255014419556,3,Banget Lambat Susah,0.7855350971221924,1,Tolong Aplikasi Tidak,0.7752742171287537
c0e53012-4534-4af5-94bf-5dd683c7c6d1,"saran donk untuk input data member bisa pakai nomor hp, seperti aplikasi nya Alfa, TDK harus menunjukkan qrcode",17,Login Nomor Akun,0.7949658632278442,6,Pembayaran Bisa Tidak,0.7522808313369751,24,Poinku Indomaret Klik,0.737845242023468
28412655-09d0-46a9-b489-ca6b4395b98c,aplikasinya tidak bisa login knapa ya,9,Bisa Tidak Dibuka,0.8799866437911987,17,Login Nomor Akun,0.7962086796760559,1,Tolong Aplikasi Tidak,0.7903837561607361
626f9e47-5c38-4479-9113-0209da223d63,Lading,10,Lambat Instagram Lebih,0.7509278059005737,7,Bagus Lumayan Mantap,0.6730208992958069,27,Jaya Selalu Bermasalah,0.6233382225036621
eedae97d-0169-40b0-8a9d-bdefa5bb66ae,ada gangguan terus. mau belanja susah terhalang notif gangguan tolong diperbaiki,1,Tolong Aplikasi Tidak,0.7879778146743774,9,Bisa Tidak Dibuka,0.7560327053070068,3,Banget Lambat Susah,0.7401900291442871
a945cdab-f552-469d-a6f3-ddae7cc6f4fa,gua sebel kalo mau bayar di klik tu susaaaaaaaah bgt .ga keluar² kode VA nya .terus Seharusnya ada keterangan nama toko dan kode toko saat transaksi di aplikasi .untuk memudahkan kami agar tau toko mana dan lokasinya dimana saat terjadi lambat pengiriman . dan seharusnya ada fitur chat staf toko minimal chat kurir toko di aplikasi.,0,Di Ada Toko,0.8697379231452942,4,Jam Sampai Pengiriman,0.8084510564804077,2,Tebus Murah Aplikasi,0.8002141714096069
7b141dd3-e02e-4671-8d95-41e797b27aa8,aplikasinya error mulu,8,Lama Loading Versi,0.8609299659729004,11,Eror Sering Terlalu,0.8238728046417236,12,Lelet Banget Lambat,0.8030109405517578
7db83b71-8537-4f6c-92e4-743d851ce937,kenapa sering gak bisa d buka ya. tolong d perbaiki sistemnya dengan benar agar semua berjalan dgn lancar,1,Tolong Aplikasi Tidak,0.7843805551528931,9,Bisa Tidak Dibuka,0.7859935760498047,17,Login Nomor Akun,0.7474361658096313
cd2d80ee-f4a3-4a53-a3ec-571523eb6dc7,kenapa skrg suka ngadet sih mo pembayaran aja susah bgt asli lemot stres sendiri,3,Banget Lambat Susah,0.818668007850647,2,Tebus Murah Aplikasi,0.7631993889808655,13,Update Dikit Mulu,0.7500065565109253
9a42b604-706d-45be-8e60-b1050978d9bf,harga di aplikasi dan di toko kadang beda,16,Harga Toko Sama,0.8219832181930542,5,Barang Stok Toko,0.6725113987922668,15,Ongkir Gratis Ongkirnya,0.6169040203094482
a356a887-c965-489a-bb09-f640992a9acb,"produk2 yg beli bnyk lbh murah tu gimanan sih, selalu keterangan sedang di restok, pdhl klo satuan bisa",5,Barang Stok Toko,0.7820441722869873,2,Tebus Murah Aplikasi,0.7653040885925293,16,Harga Toko Sama,0.7426459789276123
549e5935-71bd-45d3-ae22-86789101623c,"Warbiasaa order jam 8, ud atur pengiriman buat jam 9.00-9.59.. Di antarnya jam 19.11 luar biasaa lolanya pengantarannya. kalau memang g bisa deliv, g usah adain jasa deliv segala.. Jadi menyesal uda order buat deliv🤦‍♀️",4,Jam Sampai Pengiriman,0.8460592031478882,0,Di Ada Toko,0.791810929775238,23,Batalkan Pengiriman Melebihi,0.7258304953575134
975241ce-f1ff-40fc-b3b7-fe2651cd95ae,"aplikasinya error. saat mau nyari produk, gambarnya gak muncul muncul. muter terus padahal sinyal normal.",21,Keranjang Muncul Super,0.7857909798622131,9,Bisa Tidak Dibuka,0.8247013092041016,1,Tolong Aplikasi Tidak,0.8071175217628479
8af08390-2cb2-4a1f-83d7-20d1b6d09701,Stok aplikasi sering ga sama dengan stok toko. Pengantaran kerap kali terlambat.,26,Pengantaran Lama Terlambat,0.726378858089447,21,Keranjang Muncul Super,0.6915740966796875,5,Barang Stok Toko,0.6828412413597107
83b90cb1-1d0c-4ed0-be21-9ba7d5275b6e,"aplikasi nya gangguan terus, padahal jaringan bagus tolong diperbaiki dong",1,Tolong Aplikasi Tidak,0.8159263134002686,9,Bisa Tidak Dibuka,0.7825208902359009,3,Banget Lambat Susah,0.7824689149856567
ab5ae75d-0a5a-4c1d-b486-b3a2a811564f,mahal ongkirnya.harga tidak terjangkau.,15,Ongkir Gratis Ongkirnya,0.8105982542037964,16,Harga Toko Sama,0.7124271392822266,5,Barang Stok Toko,0.7112331390380859
ccda6e12-be94-4bae-8e2c-9d9ac993e0a3,kenapa sering eror ya??,3,Banget Lambat Susah,0.7567569613456726,11,Eror Sering Terlalu,0.8029879927635193,9,Bisa Tidak Dibuka,0.7725770473480225
7de2372b-83d9-4844-82cf-ce16e25d97c3,lemot,10,Lambat Instagram Lebih,0.9364454746246338,7,Bagus Lumayan Mantap,0.7841779589653015,12,Lelet Banget Lambat,0.7464078664779663
fd31759c-4498-447e-8fea-6eedefa41dbc,"aplikasi eror terus kenapa ini? baru saja order menggunakan layanan express, namun 7 jam saya menanti. Setelah komplain sana-sini pesanan baru di antar. untung aja masih amanah sih dellivery man nya. Tolong aplikasi tingkatkan lagi",3,Banget Lambat Susah,0.7467679977416992,0,Di Ada Toko,0.8679847717285156,4,Jam Sampai Pengiriman,0.8537549376487732
d362662b-3652-474b-9fa8-b930a8a44e61,"Setiap pesan online dari apk. ada aja alasannya gak bisa antar sampai dibatalin 6x pesanan, Prov. Jambi kab. Tebo Tebo Tengah",22,Online Belanja Untuk,0.6751545667648315,4,Jam Sampai Pengiriman,0.7566202282905579,0,Di Ada Toko,0.7561432719230652
16715b73-25be-4e31-9f5a-938aaa361690,setelah update sistem malah nge lag parah,1,Tolong Aplikasi Tidak,0.7738052606582642,3,Banget Lambat Susah,0.7859945297241211,13,Update Dikit Mulu,0.7842961549758911
65805714-e30c-45f3-aa71-6478e6c6b259,lemot banget aplikasinya banyak gangguan 😭😭,3,Banget Lambat Susah,0.8703517913818359,11,Eror Sering Terlalu,0.8258875608444214,8,Lama Loading Versi,0.819815456867218
2dfee0f7-bcc4-48eb-98be-d75abc31abcb,"semakin lemot saja kalau pas ada voucher, bikin kesel di tungguin beberapa menit g bisa terus🙉 tolong di perbaiki sistem nya ya biar lebih enak transaksinya",1,Tolong Aplikasi Tidak,0.8581915497779846,0,Di Ada Toko,0.8414671421051025,17,Login Nomor Akun,0.8180191516876221
aef38c22-5458-4159-9d35-8811fc97a2b7,semakin ndk jelas promonya buang buang waktu promonya belum ada satu jam dah hilang,2,Tebus Murah Aplikasi,0.7544113993644714,5,Barang Stok Toko,0.7363083362579346,13,Update Dikit Mulu,0.7087979316711426
02d0d209-9d61-49cc-91a5-d8acef1878a8,gk cepet sampe jam 1,4,Jam Sampai Pengiriman,0.6959221363067627,26,Pengantaran Lama Terlambat,0.710283637046814,23,Batalkan Pengiriman Melebihi,0.6511240005493164
37bfe1d5-8ab1-4b43-b847-d181b09f4f0b,harus diperbaiki lagi,1,Tolong Aplikasi Tidak,0.550726056098938,7,Bagus Lumayan Mantap,0.7394437789916992,8,Lama Loading Versi,0.7260978817939758
ead1de79-28a5-4f47-bf9e-9452c1f90b72,tolong dong untuk pesan galon masa gx ada trus besi rangka di motornya,5,Barang Stok Toko,0.6963375806808472,9,Bisa Tidak Dibuka,0.6961697340011597,1,Tolong Aplikasi Tidak,0.6916020512580872
deef2b6d-b1da-4ea7-a614-00baad0cecec,"saran , kasih produk beras , gas 3kg itu haruz tetep ready, bukannya makan aja di jual min ... masak iya itu-itu aja di beli",14,Rokok Bisa Enggak,0.663902997970581,0,Di Ada Toko,0.7485812902450562,5,Barang Stok Toko,0.7407153248786926
3d1416bc-27cb-4109-9b58-5a98750f28af,utuk buka aplikasi lngsung tdk bisa harus masuk PlayStore dlu bru mau kebuka,1,Tolong Aplikasi Tidak,0.7172964811325073,9,Bisa Tidak Dibuka,0.7288849353790283,17,Login Nomor Akun,0.7274589538574219
e101797e-d73c-49e5-9ac9-e76dc7cce1cf,pembaruan tp sistem sering lemot,10,Lambat Instagram Lebih,0.6442434191703796,19,Terlalu Berat Loading,0.785309910774231,11,Eror Sering Terlalu,0.7744677066802979
d2666104-ff94-43cd-8dc5-548c54c18cc2,payah ga bisa batal pesanan. salah alamat itu lumrah terjadi. pengiriman paling ga 1 jam setelah ada pesanan. bisalah waktu segitu buat batalin,0,Di Ada Toko,0.7873253226280212,4,Jam Sampai Pengiriman,0.8207324743270874,23,Batalkan Pengiriman Melebihi,0.8040343523025513
5b959e2b-47be-45fb-856d-a6d7d68b0404,"tidak sesuai jargonnya. 1 jam sampai. aktualnya bisa 1,5-2jam malah",4,Jam Sampai Pengiriman,0.6708294153213501,5,Barang Stok Toko,0.6384591460227966,2,Tebus Murah Aplikasi,0.6203930974006653
29e5c3c0-b51f-4f23-b414-822157c6330b,Tolong harga promonya disesuaikan. harga promo di aplikasi dengan yang ada ditoko sangat berbeda jauh,16,Harga Toko Sama,0.8565937280654907,25,Pembayaran Kupon Pembatalan,0.705986738204956,2,Tebus Murah Aplikasi,0.7058159112930298
d6ea2eb8-e7db-4625-b4e4-71ab08174c8c,fitur chat kurirnya harusnya di tambahkan. sukit sekali menghubungi kurir. paket kadang lama sekali sampai,0,Di Ada Toko,0.7925033569335938,4,Jam Sampai Pengiriman,0.8063912391662598,5,Barang Stok Toko,0.7768104076385498
a5fef2fd-50a0-4717-ac83-1c8646a67de3,"yang bikin males, lambat sekali. tapi memang Indomaret kutim stafnya cuma sedikit, makanya pasti nunggu ganti shif sekalian mereka pulang. coba tolong, kalau dirasa kurang tambahin lah, saya liat rata² 1 shif cuma berdua kadang bertiga, pantesan pelayanan jadi lambat, 1 sibuk kasir. 1 sibuk nata barang, 1 sibuk digudang. segitunya mau untung banyak, SDM dibuat sedikit banget?? bikin lambat coba kek toko sebelah, saya tiap mampir staffnya banyak, bisa sekitar 5 orang atau lebih.",0,Di Ada Toko,0.7758198976516724,4,Jam Sampai Pengiriman,0.7454001903533936,2,Tebus Murah Aplikasi,0.7306509017944336
dfdf033c-50fd-4fd0-829e-d931f46a3eaa,"kenapa Indomart pengirimannya sangat lambat,tidak seperti Alfa mart yg slalu cepet,g recomen blanja online di indomaret",5,Barang Stok Toko,0.7787024974822998,0,Di Ada Toko,0.7703034281730652,4,Jam Sampai Pengiriman,0.756779670715332
ac1385dc-4ef3-4fb0-a161-4d6ea06a4f5e,pengiriman suka di batalkan tiba2.. saat jam pengiriman sudah hampir habis. tanpa konfirmasi. tolong perbaiki lagi.,23,Batalkan Pengiriman Melebihi,0.8912203907966614,4,Jam Sampai Pengiriman,0.797416090965271,0,Di Ada Toko,0.7685562372207642
fce34493-d04b-4df6-816f-cf772f355684,"saya sudah lama selalu order menggunakan laptop, tetapi akhir2 ini login selalu tampil 'network error' dan tidak bisa login.harap diperbaiki.terima kasih.",9,Bisa Tidak Dibuka,0.7919091582298279,1,Tolong Aplikasi Tidak,0.7961130738258362,17,Login Nomor Akun,0.7893425822257996
4bd1a419-ddb7-4063-b871-638a6c43b309,"Dear developer team. Sebagai pengguna aktif saya minta tolong ya dibuat info dong klo ditoko yang terpilih sebagai pengirim tuh tidak tersedia menu nya. Sering bgt klo beli point, pasti ada aja yang ga ready menu nya. Udh gitu dri pihak toko pengirim nginfo nya telat. Kan jadi nunggu lebih lama. Sering bgt loh aku order lewat klik Indomaret karena hemat ongkir dibanding lewat online delivery lain. Cuma ya itu kelemahan nya. Next Update tolong di perbaiki yaaa. Terimakasih.",0,Di Ada Toko,0.8970144391059875,4,Jam Sampai Pengiriman,0.8345890045166016,2,Tebus Murah Aplikasi,0.8197168111801147
825d81fa-f975-417f-bd1f-5e553e821d91,muncul notif terus menerus.,8,Lama Loading Versi,0.6760643720626831,11,Eror Sering Terlalu,0.6705000996589661,27,Jaya Selalu Bermasalah,0.6683065891265869
ae9b4ea7-affc-4825-884e-f815cb86a397,tolong diperbaiki kalau saya mengetik di kolom pencarian sering tidak keluar tulisannnya,1,Tolong Aplikasi Tidak,0.763825535774231,9,Bisa Tidak Dibuka,0.7631575465202332,17,Login Nomor Akun,0.7284566164016724
5ed8b481-39c5-4140-8c10-7eb9ab2b950b,"tolonglah untuk aplikasi ini, fitur keranjang knp muncul teruusss..? ini sangat mengganggu ketika aku lgi scroll nyari² barang!! risih tau, krn sebagian jdi ketutup sm fitur keranjang yg nongol² dibawah itu.",0,Di Ada Toko,0.7535032033920288,1,Tolong Aplikasi Tidak,0.7880469560623169,2,Tebus Murah Aplikasi,0.7802574038505554
8a2bc3fe-5897-4af2-8238-4843cecf00f1,"sudah instal, belanja pertama aman, belanja ke-2 wahh parah etika karyawan toko nya, saran saya harus selalu update di aplikasi dgn ketersediaan barang di toko, karena akan mengakibatkan perlakuan tidak menyenangkan dari karyawan toko..mohon maaf saya uninstall kembali, saya kapok sama perlakuan karyawan toko nya..",0,Di Ada Toko,0.8207588195800781,1,Tolong Aplikasi Tidak,0.7780332565307617,2,Tebus Murah Aplikasi,0.7543589472770691
1b168409-9ac1-4dce-9690-72b7f22a7181,aneh banget area belum terjangkau. padahal disini ada Indomaret,2,Tebus Murah Aplikasi,0.7065104246139526,5,Barang Stok Toko,0.6951642036437988,15,Ongkir Gratis Ongkirnya,0.6944338083267212
7ab787ec-61ef-41ce-b12d-f5f68f36f039,Mau masukin info rekening bank gak bisa krn otp di kirim melalui WhatsApp Mesengger sedang kan yg saya pakai WhatsApp Business yg terinstall di hp Mohon untuk di perbaiki lagi dgn menambah option otp di kirim melalui sms atau email 🙏,1,Tolong Aplikasi Tidak,0.7827558517456055,17,Login Nomor Akun,0.8184880018234253,0,Di Ada Toko,0.791588544845581
93d59c5e-f7eb-49b4-a0b5-c61a4d585365,kok ga bisa pesan antar ya kak.. dari 3 hari kemarin. pdhal hari jumat tgl 8 Agustus masih bisa.. tgl 9 Agustus sudah ga bisa sampe skrng tgl 11 Agustus.. whyyy???,4,Jam Sampai Pengiriman,0.7422000169754028,0,Di Ada Toko,0.7158209085464478,9,Bisa Tidak Dibuka,0.6996785402297974
d0ae1cc6-7c80-4694-8f47-b7b8a334795f,cukup,7,Bagus Lumayan Mantap,0.8314027786254883,10,Lambat Instagram Lebih,0.780783474445343,27,Jaya Selalu Bermasalah,0.6954357624053955
0937f33d-1830-46c6-aa94-6fbb0c07c6e6,thanks atas handle komplainnya. barang barusan sya terima ditgl 8 jam 4 sore setelah pengajuan komplain sya ditindak lanjuti. ini review saya sebelumnya: parah. pembayaran lewat VA. kemudian distatus : pesanan tiba padahal pesanannya gak nyampe. pdahal yg dibeli untuk yg lagi gak fit. gak bisa pengembalian dana (gak ada) komplain ke CS diaplikasi dilayani dihari berikutnya apabila Sdh leat jam 18.00. tidak ada menu chat ke TOKO untuk konfirmasi barang yang tidak sampai.,0,Di Ada Toko,0.8492958545684814,4,Jam Sampai Pengiriman,0.8351510167121887,23,Batalkan Pengiriman Melebihi,0.7908768653869629
ff33b6b2-a07c-4b3e-b2bd-8446dfa4a86e,"susah kali mau melakukan pembayaran, tidak ada fitur komunikasi ataupun ngirim pesan langsung dengan staff Indomaret nya",6,Pembayaran Bisa Tidak,0.7673068642616272,0,Di Ada Toko,0.761441707611084,4,Jam Sampai Pengiriman,0.7300819158554077
19488633-4cab-442a-935c-37339f395e3c,susah bgt klo mau aktifasi saldo klik n paling ribet klo mau ganti no hp,3,Banget Lambat Susah,0.7553225159645081,17,Login Nomor Akun,0.757556676864624,2,Tebus Murah Aplikasi,0.7487313151359558
d6cd7139-88b8-499c-adf3-4e01d4c783bb,"Lebih mudah aplikasi yg dulu bisa memilih toko indomaretnya didaerah terdekat rumah. Yg ini gk bisa pilih toko. Udah 2x pesan antar ke rumah, ditunggu kirimannya seharian malah dicancel seenaknya, pdhl lagi butuh barang itu. Alasan cancel, barangnya Habis, tp kenapa gk dari awal aja di cancelnya? ini udah seharian nunggu baru di cancel. Kl stok habis, harusnya barang tidak bisa dipesan dong?",1,Tolong Aplikasi Tidak,0.7845364212989807,0,Di Ada Toko,0.8982086181640625,4,Jam Sampai Pengiriman,0.8514485359191895
75e24e8a-15dd-4f9d-ae90-2a5693ae7a60,"apknya kurang worth it masak 1bln sekali disuruh update apk, kalok nggak diupdate nggak bisa dibuka jujur buat yg memory internalnya terbatas apknya merepotkan bgt sih, tp selebihnya utk promo & barangnya ok bgt, tolong deh jgn sering2 suruh update, dijam2 rawan juga jgn sering bug susah dibuka, hari ini mau dipake dari jam 12 siang td bug terus nggak bisa buka apknya",2,Tebus Murah Aplikasi,0.834230363368988,1,Tolong Aplikasi Tidak,0.8395934104919434,0,Di Ada Toko,0.818515419960022
d15c774c-5655-44da-80bd-c20010998db5,sering banget upgrade nya,8,Lama Loading Versi,0.8279403448104858,11,Eror Sering Terlalu,0.8023381233215332,12,Lelet Banget Lambat,0.7654942274093628
7b02e11b-7408-4c79-bc17-d9a6ff95f41b,"ini apk klik knp eror terus udh 3 hari ini tidak bisa terus belanja, setiap mau pembayaran selalu ngelag. tolong diperbaiki lagi sestemnya",1,Tolong Aplikasi Tidak,0.8765411376953125,9,Bisa Tidak Dibuka,0.8571354150772095,17,Login Nomor Akun,0.8342639207839966
2e17a80b-2b6d-4aaf-9c00-87a0226df1eb,tambahkan menu promo dan menu pengambilan / pic up,1,Tolong Aplikasi Tidak,0.4923228323459625,25,Pembayaran Kupon Pembatalan,0.6301386952400208,6,Pembayaran Bisa Tidak,0.6175248622894287
5a0319b4-a351-4261-b826-221837ae3b0a,"bbrp x pesanan kurang, terutama es krim,seringnya diantar lamaa sampe bbrapa jam bahkan pernah BSK nya astaghfirullah fungsinya delevery apa ya, perlu evaluasi lah klik Indomaret kalau mau bertahan lama pelanggan setia, zona merah kan di Jabodetabek",0,Di Ada Toko,0.8400195240974426,4,Jam Sampai Pengiriman,0.8297412395477295,5,Barang Stok Toko,0.8012829422950745
2bd685d6-477f-449a-886a-6bf82862657b,tolong ya Indomaret kalau misalkan ngirim barang apapun itu besar atau kecil jangan ada cacat satupun kita tidak tau bisa layak di pakai atau tidak layak,0,Di Ada Toko,0.7369247078895569,5,Barang Stok Toko,0.7000900506973267,4,Jam Sampai Pengiriman,0.6813442707061768
a24aac0a-7c6d-41c5-bb7a-2da1317aa661,suka eror klo tgl 25 atau tgl kmbar,2,Tebus Murah Aplikasi,0.6441749334335327,13,Update Dikit Mulu,0.6412950754165649,5,Barang Stok Toko,0.6401790380477905
2fcfb61b-9796-449b-b768-f8ca6ec9960c,"toko lebih sering cancel pesanan apalagi kalau pesan gas LPG, dengan alasan ban pecah, kurir banyak orderan, selain itu instan tidak datang dengan instan tapi butuh waktu Berjam jam untuk sampai",4,Jam Sampai Pengiriman,0.8378056287765503,0,Di Ada Toko,0.8109898567199707,5,Barang Stok Toko,0.7843235731124878
792c9624-524c-4cc7-9aab-daadc7ad22ec,"eror terus, setiap mau pembayaran selalu gak bisa di klik.",1,Tolong Aplikasi Tidak,0.8118479251861572,9,Bisa Tidak Dibuka,0.839109480381012,6,Pembayaran Bisa Tidak,0.8112362027168274
35f8557e-a4bb-42ab-b702-515c2bb42ddc,"sudah 3hari tidak bisa belanja di aplikasi klik Indomaret, tertulis gangguan sistem terus saat membuka keranjang",21,Keranjang Muncul Super,0.7822929620742798,6,Pembayaran Bisa Tidak,0.8229925632476807,22,Online Belanja Untuk,0.7693032026290894
