reviewId,content,topic_id,topic_name,main_topic_prob,alt_topic_1,alt_topic_1_name,alt_topic_1_prob,alt_topic_2,alt_topic_2_name,alt_topic_2_prob
3b7d15d6-afbd-4103-8f33-9e45a9de05c7,setelah di update apknyaa sering eror lemot apknya,1,Tolong Aplikasi Tidak,0.8481439352035522,9,Bisa Tidak Dibuka,0.8121196031570435,3,Banget Lambat Susah,0.8066956996917725
f9119365-56e6-46f8-9628-906e53d3191e,"Tolong diperbaiki kembali apk nya, soalnya apk yang sekarang sering lemot, padahal jaringan internet aman aman aja. Terimakasih 🙏",1,Tolong Aplikasi Tidak,0.8165233135223389,17,Login Nomor Akun,0.7748284935951233,9,Bisa Tidak Dibuka,0.7575118541717529
728fe68c-bc7e-4556-b41c-5094192b4815,loading suiiiiii,8,Lama Loading Versi,0.6853773593902588,12,Lelet Banget Lambat,0.7445241808891296,7,Bagus Lumayan Mantap,0.7154538631439209
a5763272-57e2-4f7d-b389-ac53e1c72fbd,Saya pemula pake aplikasi ini.. Semoga bermanfaat buat saya,20,Semoga Lagi Dikembangkan,0.767585277557373,19,Terlalu Berat Loading,0.6572074890136719,1,Tolong Aplikasi Tidak,0.6434475779533386
ee8222f2-1bd5-4c76-831d-79235b0b34f1,"Maaf lebih suka tampilan yg sebelumnya, yg terbaru malah lebih ribet. Sering update juga",18,Lebih Tampilan Ribet,0.852206826210022,13,Update Dikit Mulu,0.7737876176834106,1,Tolong Aplikasi Tidak,0.768899142742157
6d1335cd-13ea-4d42-8aba-4fd85c5fca01,"Sejak diperbaharui, tiap transaksi pembayaran virtual. Tidak ada lagi informasi yang dikirim lewat email atau gmail bahwa pembayaran itu sukses atau gagal. Pdhl dulu bisa. Tolong diperbaiki. Ini sangat diperlukan.ini udah diupdate 1feb aplikasi admin. Tolong dibaca dan diperbaiki. Agar jadi manfaat kita bersama",1,Tolong Aplikasi Tidak,0.7861705422401428,0,Di Ada Toko,0.7917989492416382,17,Login Nomor Akun,0.7738195657730103
48ca4eba-d3a0-40bd-96d4-796ebbe53b63,Setelah di update jadi new klik indomaret kenapa jadi ga bs tebus murah yaa🥲biasanya ada opsen tebus murah. Tp skr hilang setelah di. Update,2,Tebus Murah Aplikasi,0.8706402778625488,1,Tolong Aplikasi Tidak,0.8426888585090637,24,Poinku Indomaret Klik,0.8367748856544495
9aa29f6b-8825-45d6-8ea2-7cdbab997586,Aplikasi skrng ribet Bagus yg aplikasi 2024,18,Lebih Tampilan Ribet,0.7887440323829651,19,Terlalu Berat Loading,0.7342017292976379,2,Tebus Murah Aplikasi,0.7254919409751892
e2942194-47c9-42f0-914d-f184f7902ae2,"Yg versi baru kok bingung ya, kalo yg lama belanja lgsg muncul tebus murah di bawah nya, yg skrg malah ga muncul tebus murahnya. Tolong di perbaiki lg 🙏",2,Tebus Murah Aplikasi,0.8445306420326233,1,Tolong Aplikasi Tidak,0.8505430221557617,9,Bisa Tidak Dibuka,0.8145108819007874
94d09731-17c9-46b5-a6f7-bcdf3bd6e604,Kenapa semenjak d instal malah gk bsa login,9,Bisa Tidak Dibuka,0.8929970264434814,1,Tolong Aplikasi Tidak,0.7989370822906494,17,Login Nomor Akun,0.7811758518218994
9da9d915-a7c6-4661-bf54-996ef86758cc,Kenapa tebus murahnya dihilangkan ya? Jadi malas belanja sekarang,2,Tebus Murah Aplikasi,0.7696151733398438,5,Barang Stok Toko,0.728641152381897,15,Ongkir Gratis Ongkirnya,0.7249327898025513
7338b7f3-83bc-4bc8-bec9-32219d495e27,kenapa harga promo di aplikasi klik indomart ini sama harga yang ada di toko indomartnya langsung kok beda ya.. bbrp kali selalu gag sama harganya..tapi klo pas lagi gak promo harga selalu sama di aplikasi dan store langsung.. jadi bikin kecewa.. 😤😤,16,Harga Toko Sama,0.826546311378479,2,Tebus Murah Aplikasi,0.8051350712776184,0,Di Ada Toko,0.798649787902832
b3661555-09b4-4e3c-a37c-09fb0c2b75f3,Bagus,7,Bagus Lumayan Mantap,0.870817244052887,10,Lambat Instagram Lebih,0.8053917288780212,27,Jaya Selalu Bermasalah,0.6888571381568909
6cf535a1-b8a1-4817-ba64-8200e934e866,Lebih bagus aplikasi klikindomaret yang lama karena ada opsi tebus murahnya kalo yg terbaru gak ada. Sayang banget fitur tsb dihilangkan.,2,Tebus Murah Aplikasi,0.7929619550704956,18,Lebih Tampilan Ribet,0.7944056987762451,1,Tolong Aplikasi Tidak,0.745917022228241
ad671e0b-102f-4ca6-aded-9f09d2dc476c,"tebus murah hilang. sekarang malah tambah masalah untuk ""banyak lebih hemat"", membingungkan, karena pas mau pesan disuruh memilih paket, ketika sudah pesan datang barang harga normal+harga diskon dan ternyata membayar sebanyak itu. new error klik indomaret kalau begini.",2,Tebus Murah Aplikasi,0.8211351037025452,0,Di Ada Toko,0.8447529077529907,4,Jam Sampai Pengiriman,0.7968466877937317
d9210ea1-f0fe-429c-af9c-b5ad908fd938,Kok sudah tidak bisa bayar pake Akulaku ya,6,Pembayaran Bisa Tidak,0.788304328918457,9,Bisa Tidak Dibuka,0.774545431137085,2,Tebus Murah Aplikasi,0.7565296292304993
a8cf9de3-c90d-45f9-9d8c-b53b2014cadd,Skrg udah GK bisa tebus murah lagi di apknya.,2,Tebus Murah Aplikasi,0.7201780080795288,14,Rokok Bisa Enggak,0.7306269407272339,6,Pembayaran Bisa Tidak,0.7030312418937683
5fe560bc-5106-4c5d-93e1-58db3aaeee4e,Kok sekarang pakai promo pembayaran akulaku kok ga bisa ya semenjak diperbarui,6,Pembayaran Bisa Tidak,0.8396950364112854,2,Tebus Murah Aplikasi,0.7948318719863892,9,Bisa Tidak Dibuka,0.791087806224823
74a6fee8-7de7-4e4e-835c-9669d98849ab,"Tampilan baru emang aga berat, terus sekarang metode pembayaran indodana sudah hilang, kecewa banget. Padahal metode itu cukup membantu loh dikala kepepet",6,Pembayaran Bisa Tidak,0.7508161067962646,2,Tebus Murah Aplikasi,0.7775493860244751,1,Tolong Aplikasi Tidak,0.7596991062164307
acce932c-77ce-4b69-862f-7460b8c42385,Semenjak d upgrade saya kesulitan pesan online. Karena dibatalkan dari toko alasannya karena kejauhan. Ga ngerti deh sama klik indomaret yg skrg 👎,22,Online Belanja Untuk,0.7514422535896301,2,Tebus Murah Aplikasi,0.8315980434417725,0,Di Ada Toko,0.8133230209350586
de301a8b-c904-4edb-8340-fa965076bac0,"Indomaret kenapa gak bikin aplikasi yg all in one aja sih. Mesti beda², aplikasi poinku, klik indomaret, klik indomaret xtra. Mau liat struk mesti di poinku. Ribet",2,Tebus Murah Aplikasi,0.7718130350112915,24,Poinku Indomaret Klik,0.8399186134338379,6,Pembayaran Bisa Tidak,0.7565982341766357
3a113559-ecf8-499e-a8fe-8f06ea48c8f3,"Aplikasi barunya sudah bagus sekali ,tapi sayang banget fitur input voucher nya di hapus. Jadi kalau dapat voucher indomaret harus input langsung ke toko,gak bisa lewat aplikasi lagi.",14,Rokok Bisa Enggak,0.7234716415405273,2,Tebus Murah Aplikasi,0.8758059740066528,24,Poinku Indomaret Klik,0.8598806858062744
e713bdb1-36d4-4226-a940-c249dc7c2717,Kenapa sekarang tidak bisa tebus murah lewat klik indomaret 😔,6,Pembayaran Bisa Tidak,0.7653833627700806,14,Rokok Bisa Enggak,0.7234227657318115,22,Online Belanja Untuk,0.7155205607414246
ca4618a4-3236-4b04-8fa9-be18828738f4,"Semenjak diperbaharui ganti alamat pengiriman susah, lebih mudak aplikasi trdahulu",3,Banget Lambat Susah,0.6883741021156311,2,Tebus Murah Aplikasi,0.6915952563285828,6,Pembayaran Bisa Tidak,0.6881487369537354
445ec8b6-b2a8-4510-bc9e-7189d52cde7b,Aplikasinya lelet sama tebus murah nya gak ada lagi mending seperti dulu,2,Tebus Murah Aplikasi,0.8064600229263306,18,Lebih Tampilan Ribet,0.8028424382209778,1,Tolong Aplikasi Tidak,0.7610876560211182
a658660a-f894-42aa-8dd3-6abf38c81e74,"Belum ada seminggu udah suruh update Mulu🗣️, kalo ga update gabisa pake hhhh kzl",13,Update Dikit Mulu,0.8395036458969116,3,Banget Lambat Susah,0.7714402675628662,1,Tolong Aplikasi Tidak,0.7645529508590698
e71c7200-a0fd-4606-88ca-8a7f4b2143f0,"Semenjak update kok pilihan pembayaran Akulaku dan Indodana menghilang, biasanya ada dan sering pake, apa sudah ga kerjasama lagi?",6,Pembayaran Bisa Tidak,0.8273287415504456,2,Tebus Murah Aplikasi,0.7968989014625549,1,Tolong Aplikasi Tidak,0.7821536064147949
7668284a-e017-4479-a004-31b8655c1444,Semoga setelah di upgrade gak lola lagi yaaaaa,20,Semoga Lagi Dikembangkan,0.8299760818481445,1,Tolong Aplikasi Tidak,0.7273870706558228,8,Lama Loading Versi,0.706462025642395
9eb0a306-19ef-4239-9298-825b28569af1,Apk ny sering gangguan susah untuk belanja . Perbaiki dl tuh system,21,Keranjang Muncul Super,0.8150016069412231,1,Tolong Aplikasi Tidak,0.8495200276374817,3,Banget Lambat Susah,0.8413747549057007
c43357ef-f19c-49df-a051-42e69ac94e2d,Enak versi lama,8,Lama Loading Versi,0.7807585000991821,7,Bagus Lumayan Mantap,0.7624849081039429,10,Lambat Instagram Lebih,0.7248332500457764
f9b5b359-6809-47b0-b8f1-0dd68628fd9e,Aplikaai baru lebih mahal dan lebih ribet Systemnya juga lebih lama buka😭,18,Lebih Tampilan Ribet,0.8116946816444397,19,Terlalu Berat Loading,0.739112138748169,2,Tebus Murah Aplikasi,0.698022723197937
08fd9c17-fccb-44c4-b4f9-14f14d16da02,"Setelah aplikasi diperbaharui new klik indomaret sistem pembayaran pakai akulaku jadi hilangkan, kenapa ya?",2,Tebus Murah Aplikasi,0.7943147420883179,24,Poinku Indomaret Klik,0.8278883695602417,6,Pembayaran Bisa Tidak,0.8214495182037354
c0d63599-06b7-403c-8108-35d1bb4ff9e2,"Aplikasinya lemot, penggunaan kupon discount jadi susah.",19,Terlalu Berat Loading,0.8079383969306946,21,Keranjang Muncul Super,0.7767165303230286,2,Tebus Murah Aplikasi,0.7413226366043091
1b6bc640-036d-46e7-b460-597d0cc6f9ac,Lebih Bagus Versi yg sblmnya ya... Setelah ke New Klik yg ini Pencarian barang tdk smua bisa Kluar. Mohon di perbaiki lg sprti yg sblmnya,2,Tebus Murah Aplikasi,0.7664633989334106,1,Tolong Aplikasi Tidak,0.8015527725219727,18,Lebih Tampilan Ribet,0.7791634798049927
bfc45ea1-e857-4f16-9e52-a99a75bd0f27,Fitur tebus murahnya tolong diaktifkan kembali.,2,Tebus Murah Aplikasi,0.6515842080116272,25,Pembayaran Kupon Pembatalan,0.722052812576294,14,Rokok Bisa Enggak,0.7138720750808716
3d83f2b1-b8f4-4d4b-90bf-fea4b69c0050,"Saya udah nyoba berkali kali buat coba bikin akun, tapi ko gabisa terus ya? Udah coba pake email atau no hp tapi tetep gabisa, katanya passwoardnya salah, kira kira kenapa ya?",17,Login Nomor Akun,0.8672490119934082,9,Bisa Tidak Dibuka,0.8128397464752197,1,Tolong Aplikasi Tidak,0.7807577848434448
5825538a-3e07-47e4-b507-2e54cb77ede8,"Saya pengguna setia klik indomaret, setelah diupdate menjadi new klik indomaret, isaku terputus dan tidak bisa dihubungkan kembali. Sepertinya aplikasi yang kali ini belum siap, tolong segera diperbaiki, terima kasih Saya juga 2x email ke customer care tapi tidak ada balasan apa pun. Sepertinya hanya pajangan saja emailnya. Ada penurunan pelayanan di indomaret, harap segera ditingkatkan kembali karena saya pengguna setia indomaret daripada toko sebelah. Terima kasih",24,Poinku Indomaret Klik,0.8002027273178101,0,Di Ada Toko,0.8063787221908569,1,Tolong Aplikasi Tidak,0.7821574211120605
2b013a97-2ad7-4f0a-9536-860cb2ed9310,"Untuk aplikasi yg baru bikin bingung, nyari tombol tebus murah gak nemu. Di bagian mana sih tombol tebus murah",2,Tebus Murah Aplikasi,0.7370749115943909,1,Tolong Aplikasi Tidak,0.7093793153762817,3,Banget Lambat Susah,0.6929416656494141
20c4b292-2ff3-4ed4-83fc-52d5fb378aad,Tebus murah nya sekarang dmna min.?? Ko ga ada lw blnja lebih dari 200,2,Tebus Murah Aplikasi,0.7679011821746826,5,Barang Stok Toko,0.7576218843460083,15,Ongkir Gratis Ongkirnya,0.7532738447189331
ff171835-1bf4-4077-b2c1-68f2357a9e6c,"Koq aplikasi baru nya malah bikin bingung ya??? Tebus murahnya ga muncul, cara dapat diskon utk promo minimal beli 2 nya aneh??",2,Tebus Murah Aplikasi,0.8554012775421143,1,Tolong Aplikasi Tidak,0.8177391290664673,9,Bisa Tidak Dibuka,0.8123849034309387
9895fd14-2daa-4869-81ea-4e602495e8c4,"Kq aneh ya aplikasi yang baru, promonya gak jelas, tebus murah jadi gak keluar, beli 2 gratis 1 nya jadi gak ada di keranjang",2,Tebus Murah Aplikasi,0.8802928924560547,1,Tolong Aplikasi Tidak,0.835460901260376,9,Bisa Tidak Dibuka,0.8266772031784058
b4786be1-7242-457d-8d2d-5eb835efee8c,"Lebih better yang sebelumnya, stelah update tampilan ribet dan juga gak lebih baik.. mending balikin lagi dah gak usah ada tambahan pake driver dari vendor lain.. pesenan saya dicancel sama drivernya tanpa konfirmasi.. nunggu berjam2 barang gak dikirim, akhirnya keluar beli lgsung ke toko.. dan uang yg udah dibayar jadi ketahan lama smpai harus ngajuin komplain.. jatohnya bukan ekspress malah lelet, ribet dan lama.",18,Lebih Tampilan Ribet,0.7866542935371399,0,Di Ada Toko,0.8744616508483887,4,Jam Sampai Pengiriman,0.8619857430458069
2044dca1-d2a2-476b-8db4-ab11dc3b1641,udah ga ada fitur pesen tiket kereta lagi,6,Pembayaran Bisa Tidak,0.7285826206207275,14,Rokok Bisa Enggak,0.7157382369041443,22,Online Belanja Untuk,0.6845279335975647
7c12c1df-d234-4d6d-a821-86cc78764191,"Kenapa ini aplikasinya?? Jd ribet berubah gini, trus jd gabisa tau bisa tebus murah apaan. Rugi jadinya",2,Tebus Murah Aplikasi,0.7813410758972168,3,Banget Lambat Susah,0.75648033618927,1,Tolong Aplikasi Tidak,0.729572594165802
0d26e2d4-820d-4852-8a33-7675bc1141ea,Update tampilan baru malah makin lelet.,1,Tolong Aplikasi Tidak,0.6746142506599426,13,Update Dikit Mulu,0.7349867224693298,19,Terlalu Berat Loading,0.7272376418113708
18affe2d-a668-4848-ac3a-2808d422b310,"Kakakkk plissss bgt ini mau check out lemot bgtttt, mau sambungin shopepay jg gagal trs, pokoknya lemot bgttttt. Males kakak mesti lapor duluuuuu, mau bayar aja susah sekaliiiii ini kakak, dari jam 9 sampe skrg gak kelar2 mau bayar gak bisa2",3,Banget Lambat Susah,0.7600746154785156,4,Jam Sampai Pengiriman,0.7466787099838257,0,Di Ada Toko,0.7434982061386108
dad7d7c7-6e6a-4817-9d84-d3dcebee2c83,Di aplikasi yg baru tidak muncul tombol klik tebus murah ya..seperti sebelumnya,2,Tebus Murah Aplikasi,0.774430513381958,6,Pembayaran Bisa Tidak,0.7849377393722534,1,Tolong Aplikasi Tidak,0.784622073173523
54fc47d2-40cd-4126-ad03-4f5adb75f628,"Kenapa sekarang semenjak di upgrade gak bisa bayar pakai Akulaku, padahal ngebantu banget kalo lagi butuh perlengkapan sehari2 lagi gak ada uang cash",1,Tolong Aplikasi Tidak,0.8327019214630127,2,Tebus Murah Aplikasi,0.8461551666259766,6,Pembayaran Bisa Tidak,0.8110539317131042
dc86dccf-e4c2-4c74-9836-2199bdb61b0f,KECEWA sih pas di update malah semua barang harganya makin mahal. Dan yang paling bikin kecewa tuh pesan popok di klik Indomaret selalu dikasi yg sudah KADALUARSA !! . Berani kasi yg kadaluarsa karena nggak beli ditempat langsung? Gitu maksudnya?. Kalau anak saya ruam mau tanggung jawab nggak?,0,Di Ada Toko,0.8448355197906494,2,Tebus Murah Aplikasi,0.8187750577926636,5,Barang Stok Toko,0.8051797151565552
34c4d291-112b-49f5-883f-387facfd6da4,"Untuk versi baru kenapa fitur pembayaran dengan menggunakan akulaku dan indodana hilang.. kebanyakan pake VA , jd sedih deh",6,Pembayaran Bisa Tidak,0.8152031898498535,2,Tebus Murah Aplikasi,0.7911468148231506,24,Poinku Indomaret Klik,0.760826826095581
abf1d5ca-1b27-4f3a-b627-25cd5f0341ad,diperbarui malah makin gaada diskonnya,2,Tebus Murah Aplikasi,0.719377338886261,5,Barang Stok Toko,0.6998209953308105,13,Update Dikit Mulu,0.6967322826385498
cbd425c8-7866-4805-8635-e6e271e9e1fd,Lemott,3,Banget Lambat Susah,0.5565897226333618,12,Lelet Banget Lambat,0.8399336338043213,10,Lambat Instagram Lebih,0.7703026533126831
7279f9a6-c187-4fdb-9d08-043e33a44426,Aplikasinya kaya siput kurang enak utk belanja lebih bagus apk alfagift satset😄,2,Tebus Murah Aplikasi,0.7841569185256958,22,Online Belanja Untuk,0.7785471081733704,19,Terlalu Berat Loading,0.7463526725769043
219c6383-940f-4b6d-b280-ecd303c3b95f,Emng ini lemot bgt yaa ? Mau blnja ko susah ..,3,Banget Lambat Susah,0.7975348830223083,2,Tebus Murah Aplikasi,0.7438436150550842,5,Barang Stok Toko,0.7279127240180969
f21b6888-597d-411b-a6ee-bb845e0ee944,lemot,10,Lambat Instagram Lebih,0.9364454746246338,7,Bagus Lumayan Mantap,0.7841779589653015,12,Lelet Banget Lambat,0.7464078664779663
a5a12ce4-b843-4b81-9c72-06429979808f,habis di update tambah lemot dan makin ribet menunya. pick up gk ada kah sekarang,5,Barang Stok Toko,0.8010871410369873,1,Tolong Aplikasi Tidak,0.8691675662994385,3,Banget Lambat Susah,0.8328510522842407
4009a950-1d7d-4a38-bc6c-6324063a90f0,"KLIK INDOMARET VERSI TERBARU MALAH SEMAKIN BURUK, LEBIH NGELAG LOADING NYA LAMA SEKALI",1,Tolong Aplikasi Tidak,0.7929606437683105,18,Lebih Tampilan Ribet,0.8469598293304443,3,Banget Lambat Susah,0.7935134172439575
b0fd4353-0bc6-4a04-9f50-77eaac35d8ca,Aplikasinya di perbaharui malah lemot banget,3,Banget Lambat Susah,0.7955636978149414,19,Terlalu Berat Loading,0.7805384397506714,1,Tolong Aplikasi Tidak,0.7802177667617798
1a6be7f8-d9a7-4f21-a05d-2b16edb670d6,Update terbaru berat dan lemot. Padahal sinyal dan kondisi hp tidak lemot SM sekali. Klo sudah di perbaiki saya update lagi bintangnya,1,Tolong Aplikasi Tidak,0.8371987342834473,17,Login Nomor Akun,0.7936038970947266,9,Bisa Tidak Dibuka,0.773664653301239
33a01b47-9de3-4231-9018-96acf42e6b54,"Tolong, abis update jadi lemot banget. Muter muter doank",3,Banget Lambat Susah,0.84743332862854,13,Update Dikit Mulu,0.8284429311752319,1,Tolong Aplikasi Tidak,0.7921726107597351
76d3a3d0-9305-45f0-8f41-ac700cedb31c,"Aplikasi versi terbaru berat, buka halaman lama lelet. Banyak promo yang tidak sinkron dengan aplikasi Indomaret poinku.",24,Poinku Indomaret Klik,0.8237878084182739,21,Keranjang Muncul Super,0.7718415260314941,6,Pembayaran Bisa Tidak,0.7690776586532593
f7f5aab3-66a7-447b-9ccb-06fd9571bccd,Kenpa lemot bngtya kalu buka aplikasi ini,10,Lambat Instagram Lebih,0.4982755780220032,3,Banget Lambat Susah,0.7805108428001404,1,Tolong Aplikasi Tidak,0.7301396727561951
7af6f6c1-af89-48f2-87de-5d4bce2d4bfc,"Yg baru kq lemottt bgd,, msk keranjang susah bgd",3,Banget Lambat Susah,0.8624895811080933,13,Update Dikit Mulu,0.7533106803894043,1,Tolong Aplikasi Tidak,0.7504953145980835
f2ea260d-7687-42d2-a388-651a3a3f0ea1,Sistem terlalu sering mengalami gangguan,11,Eror Sering Terlalu,0.6668825149536133,19,Terlalu Berat Loading,0.6173239350318909,26,Pengantaran Lama Terlambat,0.607345461845398
9cecb0f4-7af8-4305-b873-29ae47379660,Masih cepat loading apk klik indomaret yg kuning dibanding yg ini.tolong la diperbaiki,1,Tolong Aplikasi Tidak,0.8366602659225464,18,Lebih Tampilan Ribet,0.8159903287887573,3,Banget Lambat Susah,0.8023325800895691
bc708410-ed14-404e-a4be-886ba74b847d,"Tambah jelek setelah diupdate/upgrade tampilan menu lama muncul koneksi bermasalah selalu ket,dll.balik lagi tampilan awal saja lancar jaya",27,Jaya Selalu Bermasalah,0.5318435430526733,1,Tolong Aplikasi Tidak,0.801252007484436,9,Bisa Tidak Dibuka,0.7797682881355286
064b0784-35bd-4072-b046-b84816395671,Lebih Suka dengan tampilan yang lama.di update malah jdi lama loading nya,18,Lebih Tampilan Ribet,0.8465044498443604,13,Update Dikit Mulu,0.7887848615646362,1,Tolong Aplikasi Tidak,0.7758285999298096
30850e2e-8e47-4b40-9f9f-c4870f01694d,"Ini promonya tidak sama sama yang di toko, tebus murah pun tak ada.",16,Harga Toko Sama,0.8519513607025146,15,Ongkir Gratis Ongkirnya,0.7771233320236206,5,Barang Stok Toko,0.767194926738739
974adcce-0f75-43f5-865e-da944ef101da,updet terbaru apknya sangat jelek..bagusan yang lama lagi,1,Tolong Aplikasi Tidak,0.7553309202194214,18,Lebih Tampilan Ribet,0.7848955988883972,13,Update Dikit Mulu,0.7607192993164062
20cc3bfc-8a92-4f26-9cde-6fa6e322d38a,Kembalikam versi yg lama donggggg,8,Lama Loading Versi,0.6941008567810059,13,Update Dikit Mulu,0.6657071113586426,18,Lebih Tampilan Ribet,0.6445190906524658
41df3590-2bb0-4454-a470-7463bff26d91,Harga diaplikasi berbeda dengan ditoko,16,Harga Toko Sama,0.7464756369590759,15,Ongkir Gratis Ongkirnya,0.5834107995033264,5,Barang Stok Toko,0.5595338344573975
2bb94d0d-7888-41e9-a647-65a8eacb2b0b,"Aplikasinya lemot banget, bikin kesel. Kalau mau update itu dipermudah, ini malah makin berat loading terus.",13,Update Dikit Mulu,0.850949764251709,3,Banget Lambat Susah,0.8485089540481567,1,Tolong Aplikasi Tidak,0.817746639251709
d40ffb08-7fe0-426d-8ccd-ef1e816be443,Update Mulu bosen,8,Lama Loading Versi,0.8159318566322327,13,Update Dikit Mulu,0.7664889097213745,12,Lelet Banget Lambat,0.7549499869346619
6253a10a-2dc9-4d46-b1a1-4be547676348,"Ribet banget udah login berapa kali, udah atur ingat saya pun masih aja setiap masuk aplikasi harus login dari awal. Ribet setiap mau dipake jd nunggu lama, belom banyak kendala setiap login",17,Login Nomor Akun,0.8198381662368774,1,Tolong Aplikasi Tidak,0.8030523061752319,2,Tebus Murah Aplikasi,0.7818576097488403
130b44be-0835-43ad-9bfe-dfe529b2b06d,"Tolong min, katanya seperti belanja ditoko, otomatis terhubung jadi member poinku, tetapi tidak ada tebus murah, hargapun lebih murah belanja ditoko semisal harga member. Aplikasi dulu harga sudah auto harga member yg dipromosikan dan ada tebus murah nya",2,Tebus Murah Aplikasi,0.8036407232284546,0,Di Ada Toko,0.7832475900650024,24,Poinku Indomaret Klik,0.7671523690223694
c61ee6b6-7111-46df-9e61-f845eafcf945,tolong diperbaikin dong aplikasi nya. masa abis di update malah jadi lemot app nya. Buat tampilan tebus murah nya loading terus ga muncul-muncul.,2,Tebus Murah Aplikasi,0.7817785739898682,1,Tolong Aplikasi Tidak,0.8884851932525635,9,Bisa Tidak Dibuka,0.8652613759040833
67ca0800-78d3-4c4b-a1fa-3918596de9a5,semenjak diperbarui jd bingung huhu,6,Pembayaran Bisa Tidak,0.5804489850997925,3,Banget Lambat Susah,0.7100925445556641,8,Lama Loading Versi,0.6964426636695862
2869fe60-f1b8-4035-8504-6b014e19f31a,"Tolong banget per Januari 2025, aplikasi ngak banget deh, sering error trus Ndak bisa scan member di Indomaret. Balik ke aplikasi dulu aja",1,Tolong Aplikasi Tidak,0.8554954528808594,2,Tebus Murah Aplikasi,0.8486645817756653,3,Banget Lambat Susah,0.8273165822029114
7e1f8126-34c7-4b34-8c92-d383b801fc09,"Aplikasinya lemot, dan ongkirnya ga free ga kaya aplikasi tetangga",15,Ongkir Gratis Ongkirnya,0.7454696893692017,21,Keranjang Muncul Super,0.7620912194252014,6,Pembayaran Bisa Tidak,0.7614956498146057
a3086b49-4f3c-41ba-97bf-d9c0163503e9,Setelah update malah banyak bug,1,Tolong Aplikasi Tidak,0.7836463451385498,11,Eror Sering Terlalu,0.8105252981185913,8,Lama Loading Versi,0.7975618839263916
a6181a5f-60da-49d1-8e2d-ded6a81ef1f5,Skrg blnja agak ribet.. gak ada fitur tebus murah kayak aplikasi lama..,2,Tebus Murah Aplikasi,0.8418089151382446,18,Lebih Tampilan Ribet,0.8136192560195923,22,Online Belanja Untuk,0.7919055223464966
4f80a8ed-8464-4bda-a083-c4de338bf8d6,"Bagus klik yg lama... promo ny jg lebih banyak, bisa masukan voucer dr live....",7,Bagus Lumayan Mantap,0.5771193504333496,2,Tebus Murah Aplikasi,0.7482658624649048,5,Barang Stok Toko,0.7158628702163696
801d814c-2100-4930-8869-ebd33bba4b89,Aplikasi gampang eror,11,Eror Sering Terlalu,0.8560183048248291,8,Lama Loading Versi,0.7973904013633728,19,Terlalu Berat Loading,0.736553430557251
f21eb7a3-1269-4c66-aacc-562ab57f9b0a,Semenjak update pencarian produk yang muncul sangat lambat dari sebelumnya & sering gangguan sistem muncul terus. Mohon perlu ditingkatkan lagi 🙏.,21,Keranjang Muncul Super,0.8271220922470093,1,Tolong Aplikasi Tidak,0.7760485410690308,5,Barang Stok Toko,0.7203619480133057
4f503509-13ff-4a3f-b3bf-a6f139f1ab0a,"Di update malah gangguan terusss, enakan aplikasi sblmnya",1,Tolong Aplikasi Tidak,0.8266734480857849,13,Update Dikit Mulu,0.820136308670044,18,Lebih Tampilan Ribet,0.8090032339096069
77c13e40-5d4c-4933-9e8d-a44a494688af,"Lebih senang di dengan versi lama mudah dipahami,,,kalo yg sekarang ribet amat",18,Lebih Tampilan Ribet,0.844694972038269,19,Terlalu Berat Loading,0.7414728999137878,2,Tebus Murah Aplikasi,0.7160649299621582
71c80c8b-d554-4605-9272-1bbfb08239cc,Kenapa tidak bisa pilih pencarian selalu tidak ada. Kok diperbarui malah jelek,1,Tolong Aplikasi Tidak,0.7604580521583557,9,Bisa Tidak Dibuka,0.7631813287734985,2,Tebus Murah Aplikasi,0.7453489303588867
be35e08e-f882-421a-bfdd-c1ff49d0cc3a,"Setelah pembaruan aplikasi bulan ini tampilan nya muter² mulu ga muncul² klo d kata kendala sinyal ga mungkin masuk apk lain lancar² aja, tolong di betulin lg enakan sblm pembaruan apk lbh lancar",1,Tolong Aplikasi Tidak,0.8414057493209839,17,Login Nomor Akun,0.7980378270149231,9,Bisa Tidak Dibuka,0.7744930982589722
961b82a1-deae-4965-9fed-2a50c896fe7d,Terlalu ribet pakai yang baru tebus murah tidak ada. Pengambilan pin harus buka pesanan satu persatu tidak bisa di screenshoot.harga member juga tidak motong . Kalau memang aplikasi blum siap jangan di luncurkan dulu,2,Tebus Murah Aplikasi,0.8307315707206726,0,Di Ada Toko,0.8585425615310669,1,Tolong Aplikasi Tidak,0.8036308884620667
b9825535-50ec-4a55-8b34-d56a50afad10,Kenapa setelah pembaruan saya tidak bisa masuk ke akun saya ya?,1,Tolong Aplikasi Tidak,0.7796774506568909,9,Bisa Tidak Dibuka,0.8571398258209229,17,Login Nomor Akun,0.8276567459106445
7ae6a1ae-a839-40a1-8547-1d612b160e39,"Order di klik Indomaret pengirimannya kadang suka lama gak 1 jam sampai, gak kaya aya di sebelah cepet. apa di tokonya ga punya kurir khusus ya?krn sy pernah dikirim pake grab.",4,Jam Sampai Pengiriman,0.8656570911407471,0,Di Ada Toko,0.8382881283760071,5,Barang Stok Toko,0.7967393398284912
8a8abb20-62a5-49da-8793-9cb99df27b54,"Lebih suka aplikasi yg dulu, semenjak di perbaharui susah, jadi gaada pesan lagi",18,Lebih Tampilan Ribet,0.8346481323242188,1,Tolong Aplikasi Tidak,0.8045551776885986,2,Tebus Murah Aplikasi,0.7821679711341858
21f0587d-d807-42f1-b9b6-59e2922db947,"Better yang lama daripada yang sekarang, lemot banget terus ngebingung in",3,Banget Lambat Susah,0.7345317602157593,13,Update Dikit Mulu,0.7381722927093506,18,Lebih Tampilan Ribet,0.6907922625541687
0748ea1d-acbf-4223-9541-373c5e45ae1b,"Hadehhh udah beberapa kali belanja disini,pasti keambil nya toko nya jauh jauh padahal kan kita gabisa milih ya mau toko yg mana,padahal udah bayar instan (7000) tetep aja lambat dikirimnya karna tokonya kejauhan",0,Di Ada Toko,0.7946394681930542,4,Jam Sampai Pengiriman,0.8053265810012817,2,Tebus Murah Aplikasi,0.7602340579032898
cb7d3db7-a8f9-429b-a2c7-5f6547a2cb39,"versi lama lebih mudah,klik yg baru sistem sering error",18,Lebih Tampilan Ribet,0.8528047800064087,19,Terlalu Berat Loading,0.7705538272857666,11,Eror Sering Terlalu,0.7550280094146729
7287a3a7-b4d1-41b5-a02a-5f0f2940c900,Riwayat pesanan mu kok ilang semua ya,9,Bisa Tidak Dibuka,0.7529298067092896,3,Banget Lambat Susah,0.7258715629577637,1,Tolong Aplikasi Tidak,0.7185251116752625
