reviewId,content,topic_id,topic_name,main_topic_prob,alt_topic_1,alt_topic_1_name,alt_topic_1_prob,alt_topic_2,alt_topic_2_name,alt_topic_2_prob
72c9411e-3290-4fb7-88a7-84a0a08c2fca,Lemot banget,12,Lelet Banget Lambat,0.9095657467842102,10,Lambat Instagram Lebih,0.8611176013946533,8,Lama Loading Versi,0.7838836908340454
29451568-c4e8-4bbe-8a92-78afbff03e16,"Aplikasi nya lemot banget, mau ganti nomor susah, pembayaran ewallet nya susah karena no.hp nya harus sm dengan no.hp member diaplikasi nya",17,Login Nomor Akun,0.8621211051940918,1,Tolong Aplikasi Tidak,0.8304972648620605,3,Banget Lambat Susah,0.8029723167419434
85ac8062-0902-4630-9342-0b50532d1fbe,"Aplikasimu lemot bos, kebanyakan animasi jadi lemot Coba berbenah kaya punya nya toko sebelah lebih enteng penggunaannya Sama satu lagi Kalo stok kosong langsung aja di status barangnya kosong Bukan di klik keranjang baru ada keterangan kosong Kelamaan bos Kalo stok kosong kan langsung cari toko lain ga harus ngeklik keranjang dulu",0,Di Ada Toko,0.8526235818862915,2,Tebus Murah Aplikasi,0.8019769191741943,4,Jam Sampai Pengiriman,0.7782704830169678
56d70050-777f-486d-a534-993933ce9ff6,Tolong satukan saja aplikasi poinku dan klik indomaret,24,Poinku Indomaret Klik,0.7803673148155212,6,Pembayaran Bisa Tidak,0.6682804226875305,25,Pembayaran Kupon Pembatalan,0.6633340716362
0829b372-7c60-4b51-b7c3-b145fe2b73f4,"Aplikasi nya lola banget,mohon ditingkatkan min",1,Tolong Aplikasi Tidak,0.8117865324020386,3,Banget Lambat Susah,0.7920914888381958,20,Semoga Lagi Dikembangkan,0.7854400277137756
311e7001-d2a2-460a-a455-a3fd551b17a7,loading lama,8,Lama Loading Versi,0.8545287847518921,10,Lambat Instagram Lebih,0.8178259134292603,12,Lelet Banget Lambat,0.8062162399291992
5f8a786b-41db-46b0-8a4d-b078d3d79b70,"pengiriman nya ga sesuai aplikasi, mending lebih cepet, ini lebih lama masa pesen jam 11, estimasi tiba diapk jam 2 paling lama lah ini sampe jam setengah 4 belum nyampe juga,, hadehhh😒😒",4,Jam Sampai Pengiriman,0.8975306749343872,0,Di Ada Toko,0.8116534352302551,23,Batalkan Pengiriman Melebihi,0.7582420706748962
a4240175-b257-430a-930f-86b42e1a7738,Aplikasinya berat banget min. Loadingnya lamaaaa,3,Banget Lambat Susah,0.8480066061019897,8,Lama Loading Versi,0.784731924533844,1,Tolong Aplikasi Tidak,0.7526204586029053
e82650f9-7f5a-49ba-94f8-40aa90d05f66,"Harusnya Indomaret itu kaya minimarket sebelah, pake kurir dari toko. Ngehubungin customer gampang. Kalo driver dari apk lain ribet. Bukannya chat ke wa malah chat lewat apk lain itu, yang belum tentu customer pake apk tersebut. Jadi kalau ada chat yaa customer gatau. Seenggaknya chat wa atau tanya orang. Jadi ga saling nunggu.",0,Di Ada Toko,0.8192211985588074,2,Tebus Murah Aplikasi,0.7727014422416687,4,Jam Sampai Pengiriman,0.7557886838912964
d49d3f3d-6c31-4093-be40-9fd44f2c5833,plisss knp sistemnya lemott bangttt,1,Tolong Aplikasi Tidak,0.6309826374053955,3,Banget Lambat Susah,0.7417288422584534,12,Lelet Banget Lambat,0.7169084548950195
e3a7c732-3ad8-43d6-aeb5-0ffffa8210fa,Lama banget Kalo buka apliksi ya sangat kecewa engga kaya aplksi toko sebelah . jelek bangetttttt,3,Banget Lambat Susah,0.7948353886604309,2,Tebus Murah Aplikasi,0.7822436690330505,1,Tolong Aplikasi Tidak,0.7806509733200073
d4a6d928-e1ba-48a9-a393-fd1c2a00cc04,Aplikasinya berat loading nya lama dibandingkan toko sebelah,5,Barang Stok Toko,0.7499622106552124,19,Terlalu Berat Loading,0.789524495601654,18,Lebih Tampilan Ribet,0.77839195728302
288383cd-2c8d-4a71-a19f-184c033a403a,suka ngelag ngelag,28,Suka Ngelag Masih,0.8504782915115356,12,Lelet Banget Lambat,0.5942994952201843,8,Lama Loading Versi,0.587188720703125
ed5eba4c-01bf-4be1-8882-8f9a6b817779,Lama loading nya suka kesel sendiri..coba di tingkat kan lagi,8,Lama Loading Versi,0.7702118754386902,13,Update Dikit Mulu,0.8048025965690613,3,Banget Lambat Susah,0.8003279566764832
399401b1-b36e-4791-8f2e-fe5786093865,"Indomaret klik, kasih fitur pembatalan pesanan apabila waktu pengiriman sudah lewat Waktu pengiriman di pilih 2 jam setelah pesanan dibuat, tpi tetap lewat waktunya Dan lewat nya hampir 1 jam Baik pihak toko maupun kurir tdk memberitahukan kendala Kalau kustomer sudah tdk ada ditempat atau punya jadwal keluar gimana? Kustomer rugi waktu, pastinya ngasih rating jelek Dua² nya rugi kan?",0,Di Ada Toko,0.8600888848304749,4,Jam Sampai Pengiriman,0.8430490493774414,23,Batalkan Pengiriman Melebihi,0.8260548710823059
d8e79797-fa10-4946-a935-0ccec3959af7,Aplikasinya lambat ya... padahal sangat membantu utk memudahkan belanja,1,Tolong Aplikasi Tidak,0.7841945886611938,19,Terlalu Berat Loading,0.806045413017273,21,Keranjang Muncul Super,0.7962300777435303
f084f6a0-f162-49d0-980a-7f927a6e44b2,Aplikasinya super lemot & lelet.,21,Keranjang Muncul Super,0.7298495769500732,12,Lelet Banget Lambat,0.8071905374526978,19,Terlalu Berat Loading,0.7865877151489258
2c214eff-344e-4c33-9c28-f279d6cb681d,"Aplikasi lemot,lebih di tingkatkan lagi pembaruan aplikasinya,untuk pelayanan pesan antarnya sangat baik👍💯",1,Tolong Aplikasi Tidak,0.7483319044113159,21,Keranjang Muncul Super,0.7629067897796631,18,Lebih Tampilan Ribet,0.7345043420791626
27ee61dd-148d-4016-9dfd-4d8dd51c202a,Tolong pihak Indomart barang sudah banyak stok kosong.,0,Di Ada Toko,0.7237788438796997,5,Barang Stok Toko,0.7912344336509705,25,Pembayaran Kupon Pembatalan,0.7460313439369202
8720de81-8b02-4737-b8ce-5fb47cf30dc7,Agak lemot,10,Lambat Instagram Lebih,0.9150277376174927,7,Bagus Lumayan Mantap,0.8062934279441833,12,Lelet Banget Lambat,0.7820004224777222
3ede5ae2-8728-42f9-978e-eb91bcc505e0,"Sekarang aplikasinya kok makin lemot yaa,, mau pilih2 barang jadi lama. Beda sama aplikasi toko sebelah yg satsetsatset.",2,Tebus Murah Aplikasi,0.8465441465377808,3,Banget Lambat Susah,0.8233051896095276,18,Lebih Tampilan Ribet,0.8211110830307007
90c0a8aa-8b0b-4ced-9fa9-69bbd1eced69,"udh 3x pesen barang nominal 15k ga dianter hihi, dibatalin gitu aja, gajelas",0,Di Ada Toko,0.7811041474342346,4,Jam Sampai Pengiriman,0.7896862030029297,5,Barang Stok Toko,0.7737639546394348
581ea4c6-b29a-4693-95ca-c579d98d0527,"Aplikasi benar-benar harus diperbaiki, sangat lemot sekali, sementara buka Aplikasi sebelah ngga selemot ini. Tolong benar-benar di upgrade..",5,Barang Stok Toko,0.679252028465271,1,Tolong Aplikasi Tidak,0.8013149499893188,9,Bisa Tidak Dibuka,0.7581946849822998
b8ece0d2-6886-43eb-9cbf-0d50a2be5606,Lemot bgt ya Allah,12,Lelet Banget Lambat,0.805466890335083,8,Lama Loading Versi,0.671033501625061,3,Banget Lambat Susah,0.6683468818664551
b84bdc7d-0df0-44a7-b8d4-9cea3c274084,"kenapa sekarang aplikasinya lemot banget kadang bug yaa, , , discroll2 gk langsung muncul, kadang bolak.balik keluar aplikasi. ditambah sekarang kalau barang kosong tidak langsung muncul notif kosong tp malah muncul alternatif barang lain, menurut ku semakin diupdate bukannya tambah bagus malah jelek aplikasinya. aku kira kalau diupdate untuk poin bisa dipakai pembayaran melalui klik ternyata tidak. bukanya semakin mempermudah ini malah sulit.",1,Tolong Aplikasi Tidak,0.8276593685150146,0,Di Ada Toko,0.829993724822998,2,Tebus Murah Aplikasi,0.819564163684845
7e77f5ca-875c-4e4a-83ff-0517c623d143,klo belanja di toko ga pernah tanyain member .. mending belanja via klik aja,16,Harga Toko Sama,0.7854610085487366,15,Ongkir Gratis Ongkirnya,0.7624337673187256,5,Barang Stok Toko,0.7527756690979004
79bef87b-94c2-4cd1-9cb4-0fdbef47d9b8,"Aku sering belanja di klik Indomaret , pengiriman oke , produk promosi juga oke . Tapi nth knp tiap saya belanja slalu ad produk yg rijek/ancur/gepeng . Sekali 2kali it's oke gpp TPI ini setiap saya belanja slalu ad yg rijek gmna dong min tolong . Jngn mentang"" belnja online jdi dikasi barang yg jelek/rijek 🤦🏼‍♀️ Kecewa di barang rijek aja sih knp diberikan ke costumer yg beli online .",0,Di Ada Toko,0.8419045209884644,2,Tebus Murah Aplikasi,0.7763895392417908,5,Barang Stok Toko,0.776052713394165
36f10a2a-a08c-4c92-8eee-2daa5697b6ae,Susah setting alamatnya.,8,Lama Loading Versi,0.8022485375404358,12,Lelet Banget Lambat,0.7385591268539429,11,Eror Sering Terlalu,0.7259708642959595
49792bd8-20d3-4aa4-88ba-7b4bab8cfe39,Barang tidak lengkap seperti di toko,5,Barang Stok Toko,0.7356683611869812,16,Harga Toko Sama,0.7324604988098145,14,Rokok Bisa Enggak,0.6662773489952087
d4b199d2-8f97-45b2-8658-c580946c4daf,pengiriman dan pengemasan nya sangat baik cuma daftar aplikasinya agak ribet,4,Jam Sampai Pengiriman,0.7626254558563232,5,Barang Stok Toko,0.7523255944252014,2,Tebus Murah Aplikasi,0.7134750485420227
001ee815-6ff0-4a1e-b5a2-029bf9cfed9e,Indomaret nih perlu perbarui aplikasj sih menurutku lelet bgt sumpah jdi males belanja sangking leletnya,2,Tebus Murah Aplikasi,0.7971137166023254,3,Banget Lambat Susah,0.8191165924072266,1,Tolong Aplikasi Tidak,0.7635361552238464
25abb2a4-6f7c-4a61-857c-57f8c00400d5,"Sangat membantu aplikasinya tanpa harus keluar bisa belanja di rumah aja,tapi sayang akhir2 ini aplikasinya sering eror semakin lemot juga,mohon di perbaiki ya biar tetep nyaman belanja di klik .",1,Tolong Aplikasi Tidak,0.8322872519493103,0,Di Ada Toko,0.8137094378471375,2,Tebus Murah Aplikasi,0.8069576025009155
eef0bc89-0285-46ae-816f-ac22913d4c5e,Dah ngelag trs mau ngurangi jumlah keranjang malah balik lagi. Tolonglah diperbaiki aplikasinya biar kayak sebelah,1,Tolong Aplikasi Tidak,0.7900352478027344,3,Banget Lambat Susah,0.7888036966323853,13,Update Dikit Mulu,0.776345431804657
a2956e3b-bb73-4e3b-b759-260f6b891b66,"loading lambat dan tulisan stok cuma gimmik, ujung-ujungnya harus ngecek satu-satu lokasi ada yg jual atau enggak",5,Barang Stok Toko,0.7955046892166138,2,Tebus Murah Aplikasi,0.729658305644989,3,Banget Lambat Susah,0.729403555393219
e38ca0c2-1f21-4047-bda8-0bc3c3bc32fd,"Lemot paraaaah, padahal aplikasi laen lancar"" aja..",3,Banget Lambat Susah,0.8420372009277344,1,Tolong Aplikasi Tidak,0.7829723358154297,8,Lama Loading Versi,0.771221935749054
89b4c4be-c701-4687-9c54-2c436544f70a,Tingkatkan lagi agar tidak lemot pas milih barang nya,1,Tolong Aplikasi Tidak,0.639844536781311,21,Keranjang Muncul Super,0.717409610748291,5,Barang Stok Toko,0.6982474327087402
44ad89d3-960b-412f-9a09-fa932e8a07d1,"Lemot banget applikasinya. Enakan applikasi sebelah sat set langsung kebuka, ini lemot banget.",3,Banget Lambat Susah,0.8627275228500366,1,Tolong Aplikasi Tidak,0.8171812295913696,18,Lebih Tampilan Ribet,0.7882986068725586
9ffa8e08-984d-4916-b57b-b36a7a4d9ba9,Aplikasi lemot.,10,Lambat Instagram Lebih,0.9192749857902527,7,Bagus Lumayan Mantap,0.7589170932769775,12,Lelet Banget Lambat,0.7458631992340088
be38c8e3-e6e0-43f7-bdf4-d44d4dd51fde,"Lemot banget woiii, benerin ga aplikasi nya, padahal udh ngebantu bgt buat belanja online, tp aplikasi nya lemot sekali 🥹",3,Banget Lambat Susah,0.8386049270629883,1,Tolong Aplikasi Tidak,0.7986069917678833,2,Tebus Murah Aplikasi,0.7809944748878479
e2dd5246-0bf5-473c-897a-b4fc8fbe3e81,Lemot banget aplikasinya bufer mulu ihh.... mau payment aja susah.,3,Banget Lambat Susah,0.877410352230072,1,Tolong Aplikasi Tidak,0.7872781157493591,2,Tebus Murah Aplikasi,0.7801132202148438
6d4fb313-2daa-48f6-9e28-6fe365004143,"Aplikasi bagus dan sangat membantu, tapi tolong di bantu pemaian ram,nya untuk hp menengah k bawah sangat susah berbepanja karna terlalu berat aplikasinya, trimakasi",19,Terlalu Berat Loading,0.7033166885375977,1,Tolong Aplikasi Tidak,0.7379544377326965,20,Semoga Lagi Dikembangkan,0.7075892090797424
3abc0e63-67a1-4dc4-a347-8a516eb37537,Mau masukin ke keranjang aja susah bgt... Hadeuh,3,Banget Lambat Susah,0.6997027397155762,12,Lelet Banget Lambat,0.6216580271720886,8,Lama Loading Versi,0.6114068627357483
9c77cd65-e622-46d6-9f8c-1d271a659893,Lama kalii dtgnya,8,Lama Loading Versi,0.7267723083496094,12,Lelet Banget Lambat,0.710182249546051,27,Jaya Selalu Bermasalah,0.6405671834945679
2a6423e1-24fb-499d-ab5d-a984dd3573c7,Saya kasih bintang 3 dlu aplikasi berat bgt . Tlg diperbarui lagi. Mksh,1,Tolong Aplikasi Tidak,0.8050438761711121,20,Semoga Lagi Dikembangkan,0.7761863470077515,3,Banget Lambat Susah,0.7592171430587769
ae60f632-5ca6-47d4-9cfa-93c9634b3a81,"Jauh lebih bagus dan simple punya alfa. Pengiriman pesanan berbayar, kalau alfa gratis.",2,Tebus Murah Aplikasi,0.7460553050041199,15,Ongkir Gratis Ongkirnya,0.770370602607727,18,Lebih Tampilan Ribet,0.7362242341041565
8f34163a-c029-4fc0-b71c-6cb97eeba820,lemot,10,Lambat Instagram Lebih,0.9364454746246338,7,Bagus Lumayan Mantap,0.7841779589653015,12,Lelet Banget Lambat,0.7464078664779663
b1dc9f47-2110-464a-a71c-ac2d5fe26fda,"Maap ada 2 hal urgent yg minus di app ini: 1. Gk ada tombol BAYAR untuk pesanan yg kena ""back"" lalu terbaca pesanan sudah terbuat. 2. Stok suka plus-minus, terutama barang tebus murah. Ini ada hubungannya gk sih sama kasir yg ngebolehin beli barang tebusan tanpa nota? Karna boleh ambil lbh dari 1. Giliran orang yg udah order di app mau ambil barangnya kosong, pdhl udah berhasil di aplikasi. Jadinya diganti barang lain. Kan gk banget klo ordernya ambil di tempat, capek2 datang barangnya gk ada.",0,Di Ada Toko,0.8970128893852234,4,Jam Sampai Pengiriman,0.8299587965011597,2,Tebus Murah Aplikasi,0.8169031143188477
9d77d4b9-f795-43dc-b031-b3b142d8d607,"tolong perbaiki aplikasinya, respon aplikasi terlalu lambat",1,Tolong Aplikasi Tidak,0.7719425559043884,11,Eror Sering Terlalu,0.7496241331100464,21,Keranjang Muncul Super,0.7453850507736206
8513b05c-d0ff-4269-a945-1552cab8c6f1,"Kenapa apknya lemot bgt ya,padahal sinyal udh bagus",1,Tolong Aplikasi Tidak,0.8170226812362671,3,Banget Lambat Susah,0.8357585668563843,9,Bisa Tidak Dibuka,0.8094220161437988
cc2ec159-cfd4-405b-8337-fa8da6fbb303,Tolong diperbaikin lagi masalah pengirimannya..lama banget. Pdahal adanya apk ini biar praktis kalo ada kebutuhan mendesak tpi kita gk bisa kluar rumah..ampun deh,1,Tolong Aplikasi Tidak,0.831794261932373,0,Di Ada Toko,0.8209775686264038,2,Tebus Murah Aplikasi,0.809498131275177
3263d90a-3e4b-4538-80b1-6ee06d42bed2,Lemot,10,Lambat Instagram Lebih,0.9364454746246338,7,Bagus Lumayan Mantap,0.7841779589653015,12,Lelet Banget Lambat,0.7464078664779663
3b305a11-cda0-41f7-a7ee-b36fa04c323c,"kok aku ga bisa buka klik ya,, pas buka malah dibilang penyalahgunaan ketentuan berlaku 😒 pdhl baru aja loh aku mau buka malah di blg gitu ,, mana mau mesan barang digituin",9,Bisa Tidak Dibuka,0.7934004068374634,0,Di Ada Toko,0.8065681457519531,2,Tebus Murah Aplikasi,0.7814470529556274
d82e9f58-4006-40bb-8c11-36df4bb912d8,gabisa cari melalui qr min,14,Rokok Bisa Enggak,0.7717478275299072,6,Pembayaran Bisa Tidak,0.7052119970321655,25,Pembayaran Kupon Pembatalan,0.6995972394943237
b19a5b4b-be49-41ff-ad5b-668bec49efe7,"Kasir indomaret jarang atau bahkan tidak pernah menanyakan mengenai indomaret poin yang ada di aplikasi. Sehingga pelanggan sering tidak dapat poin setelah berbelanja di indomaret. Tolong seluruh kasir indomaret diberi pengarahan yang benar, agar tidak merugikan konsumen. Sehingga konsumen tidak lari ke toko lain.",0,Di Ada Toko,0.7346172332763672,24,Poinku Indomaret Klik,0.7158191800117493,22,Online Belanja Untuk,0.6752570271492004
d2b75180-70b2-4f49-9d1c-38cce6820089,"Aplikasi nya cukup membantu buat belanja, tapi loading nya lama bgtttt gabisa dipake cepet walau jaringan bagus😭",19,Terlalu Berat Loading,0.7776044607162476,3,Banget Lambat Susah,0.8458592891693115,1,Tolong Aplikasi Tidak,0.8272015452384949
9f4320ff-9f33-4842-b933-941da5adaa31,Aga ribet interfacenya mau liat semua produk sekali Gus ga bisa harus per kategori,2,Tebus Murah Aplikasi,0.7750469446182251,18,Lebih Tampilan Ribet,0.7611095905303955,5,Barang Stok Toko,0.7591612339019775
df1eaa83-efed-4f0e-8907-065af9ba3ffc,"Untuk keranjang nya butuh di perbaharui lagi karena sangat lelet sekali padahal jaringan 4G. Dan ketika produknya di tambahkan ke keranjang malah muncul keterangan keranjang kosong saat mau di periksa di menu keranjang nya. Sangat kecewa, padahal sering sekali muncul notifikasi promo tapi percuma kalau menu keranjang nya tidak bisa di akses. Demikian.",21,Keranjang Muncul Super,0.7693623900413513,0,Di Ada Toko,0.8315877914428711,17,Login Nomor Akun,0.8004547357559204
00638478-57ee-4c48-af9b-307306875dd2,Bagus sesuai manfaat,7,Bagus Lumayan Mantap,0.7984697222709656,10,Lambat Instagram Lebih,0.6819984912872314,27,Jaya Selalu Bermasalah,0.659937858581543
1455ac29-4f30-42ab-b049-cea491b208f2,"tolong diperbaiki lagi, sering nge bug padahal jaringan internet kenceng",1,Tolong Aplikasi Tidak,0.7751562595367432,3,Banget Lambat Susah,0.7481905221939087,9,Bisa Tidak Dibuka,0.7334164977073669
01848a62-8fed-4903-ac7b-1c2dcd7c91dc,"Pasca di update semakin lemot, padahal baru di update & sinyal bagus",1,Tolong Aplikasi Tidak,0.7843161821365356,13,Update Dikit Mulu,0.7601735591888428,21,Keranjang Muncul Super,0.7507685422897339
0535d2fa-512a-4936-b0f7-6fb6f43d2341,"Saya kasih 3 star dl..klo bisa dikasih input tambahan note pada apk biar bisa titip pesan pada indomaret yg bersangkutan sewaktu belanja..dan tolong buat agar e-receipt bisa di download..dan buat agar aplikasi tidak berat loadingnya,masih kurang sempurna dan tambahkan kategori dalam kolom produk favorit, agar mudah sewaktu mencari",0,Di Ada Toko,0.8148372173309326,24,Poinku Indomaret Klik,0.7998759746551514,2,Tebus Murah Aplikasi,0.7878249883651733
9ff14fec-1f1a-47b3-a00c-e1f2f57b5070,Lelet sekali...aplikas tidak berfungsi dengan baik loading lama,8,Lama Loading Versi,0.6878796815872192,3,Banget Lambat Susah,0.7482836246490479,21,Keranjang Muncul Super,0.7449543476104736
47f387fb-92f7-4a7e-ac8e-3bcb112dba0c,"Tolong diperbaiki aplikasinya, untuk shopee pay tidak bisa terhubung, kode verifikasi yang dikirim via wa tidak bisa diinput di aplikasi, untuk gopay, ovo, tidak ada masalah kode verifikasi bisa diinput",1,Tolong Aplikasi Tidak,0.7687735557556152,17,Login Nomor Akun,0.8087942004203796,6,Pembayaran Bisa Tidak,0.8001428842544556
7f4557ca-d487-417e-a9c5-6782d8e5a03e,"Kenapa buat scan barcode jadi gabisa yaa,biasanya gampang,mohon di perbaiki",1,Tolong Aplikasi Tidak,0.8138958215713501,9,Bisa Tidak Dibuka,0.7938235402107239,17,Login Nomor Akun,0.7756383419036865
1fb40d82-41d4-4d7c-8ddd-d46721afee00,Aplikasinya lemot banget. Tolong diperbaiki. Saya juga pake aplikasi alfagift lancar aja tuh. Jangan sampe kalah dong.,1,Tolong Aplikasi Tidak,0.8206580877304077,3,Banget Lambat Susah,0.7891436815261841,17,Login Nomor Akun,0.7731525897979736
c15d0fb8-394f-4722-bb70-bc8b6b518564,Scan barcode lama sekarang ga kaya dulu,1,Tolong Aplikasi Tidak,0.664685070514679,18,Lebih Tampilan Ribet,0.7235188484191895,19,Terlalu Berat Loading,0.686671257019043
b1f0be97-f36b-4b72-99d0-993f55ab7320,Barcode scan barang gk di gunakan sekarang. Gak kaya duluuu,1,Tolong Aplikasi Tidak,0.6914626359939575,6,Pembayaran Bisa Tidak,0.7270826697349548,5,Barang Stok Toko,0.7169029116630554
9400283b-f3cb-4693-ae30-39cefa14c3c5,"Apk nya sangat bagus fitur""nya, tapi kenapa sangat lalot, kayak saya harus nunggu 10 menit agar bisa cekout, kinerja apknya kayak berat bgtu gitu",1,Tolong Aplikasi Tidak,0.8237597942352295,3,Banget Lambat Susah,0.809924304485321,2,Tebus Murah Aplikasi,0.7776309251785278
b4fbae36-89f4-4854-b781-5e9c4e7f945b,Aplikasinya Lemoooot...loading nya lamaaa beeeng..padahal.jaringan internet fuuuul kenceeng bangett......trusnya pesanan minta dikirim jam 3 datangnya jam 6,3,Banget Lambat Susah,0.8011909127235413,4,Jam Sampai Pengiriman,0.7454473376274109,1,Tolong Aplikasi Tidak,0.7145955562591553
4ed0bb7b-e302-4528-aed9-dc069aa4e77a,Andalan klu mager keluar tinggal klik indomaret. Pengiriman ga pernah ngaret. Tapi aplikasinya masyaallah loading terus. Klik search aja ga responsif. Pegel juga lama2. Tolong aplikasinya dibenahi. Sblm customer pindah ke aplikasi lain. Makasih. 🙏,8,Lama Loading Versi,0.71474689245224,1,Tolong Aplikasi Tidak,0.8775521516799927,0,Di Ada Toko,0.8500922918319702
a44a91d9-6e5a-4217-a211-f9d5a7494dd6,Mengapa pembayaran gopay coin dihapus?,6,Pembayaran Bisa Tidak,0.6678009033203125,14,Rokok Bisa Enggak,0.6492446660995483,25,Pembayaran Kupon Pembatalan,0.6234047412872314
b5c49a46-1083-4a7e-b851-61684f9a1d61,Aplikasi sangat lemot...mau belanja susah sekali,3,Banget Lambat Susah,0.8130571842193604,21,Keranjang Muncul Super,0.8172620534896851,19,Terlalu Berat Loading,0.7784774303436279
a4909c06-2b5c-4430-b468-c44a5a226717,"Kinerja aplikasi sangat lambat, padahal sinyal saya bagus, wifi lancar , nyoba aplkasi lain juga lancar, tapi dari dulu tiap buka aplkasi klik indomaret suka lambat mulu aplkasi nya heran..",1,Tolong Aplikasi Tidak,0.836193323135376,3,Banget Lambat Susah,0.8146201968193054,17,Login Nomor Akun,0.7891814708709717
4cad27f5-44b0-4578-8e18-614bb4ca365e,"Pengalaman saya ketika ada barang ngga di kiri m ngga di kembalikan dalam bentuk apapun dan tidak ada komunikasi dari pihak Indomaret, mohon di arahkan ketika ada kejadian seperti ini",0,Di Ada Toko,0.7899022102355957,23,Batalkan Pengiriman Melebihi,0.7321106195449829,4,Jam Sampai Pengiriman,0.7191068530082703
52ac23db-0278-49d4-9d0b-e15237a5ffd1,"lemot bangetttt,,tolong diperbaiki yaa",1,Tolong Aplikasi Tidak,0.7345385551452637,3,Banget Lambat Susah,0.7712900638580322,20,Semoga Lagi Dikembangkan,0.7395212650299072
4a2e829f-48fa-47b6-8aaa-e075492e6382,Aplikasi lemot,10,Lambat Instagram Lebih,0.9192749857902527,7,Bagus Lumayan Mantap,0.7589170932769775,12,Lelet Banget Lambat,0.7458631992340088
1db80d42-1404-4cc1-929d-44c0d18da2d3,"Nge bug parah, nge lag jg. Pdhal sinyal bagus, udh d restart ulang msh jg, bersihkan ruang jg. Tlg perbaiki lg sistem nya Dan jg tlg, jgn terlalu lama dlm pengntaran orderan. Kdang sejam stngah baru dtg. Terima kasih",1,Tolong Aplikasi Tidak,0.8236778974533081,0,Di Ada Toko,0.7868651151657104,17,Login Nomor Akun,0.7755789756774902
36fc3991-69e1-4029-bf4a-fcc1b428a8df,"Akhir akhir ini kenapa aplikasi nya sangat lemot sekali,, menguras emosi, tolong di tingkatkan lagi donk",1,Tolong Aplikasi Tidak,0.7902047634124756,3,Banget Lambat Susah,0.7676030397415161,9,Bisa Tidak Dibuka,0.7331615686416626
d2ada4b8-47a7-444f-944d-bba41c651b4c,Aplikasinya sulit digunakan mohon developer di perbaiki,1,Tolong Aplikasi Tidak,0.7385826706886292,20,Semoga Lagi Dikembangkan,0.7641938328742981,21,Keranjang Muncul Super,0.7150874137878418
d1584874-bf62-4b28-95a0-90afd051ed6f,pesanan tak kunjung diantarkan padahal sdh lewat jam yg ditentukan,23,Batalkan Pengiriman Melebihi,0.7980495691299438,4,Jam Sampai Pengiriman,0.65274578332901,26,Pengantaran Lama Terlambat,0.5910207033157349
c7378725-79ba-4ef5-845e-30d45d867501,Aplikasinya berat banget. Buka aplikasi selain klik Indomaret lancar2 aja tpi wktu buka klik Indomaret berat banget lelet,1,Tolong Aplikasi Tidak,0.7865355014801025,3,Banget Lambat Susah,0.823222815990448,2,Tebus Murah Aplikasi,0.8073662519454956
bea8e154-11e4-4198-b56c-9013b6a440b1,Aplikasi nya loading pake banget.tolong segera dibenahi.mau masukkan barang d keranjang sangat lah lama,3,Banget Lambat Susah,0.811964750289917,1,Tolong Aplikasi Tidak,0.8016088008880615,5,Barang Stok Toko,0.7960014343261719
8e198fa1-ca8d-4f88-befc-91e8a0317d38,LEMOT PARAHHHHHH !!!!!,12,Lelet Banget Lambat,0.8649578094482422,10,Lambat Instagram Lebih,0.7380074262619019,8,Lama Loading Versi,0.706569254398346
9f225efd-eb66-4a8d-9a59-bb895bf387b4,hilakk lemot parahhh,12,Lelet Banget Lambat,0.7849005460739136,8,Lama Loading Versi,0.6659697890281677,28,Suka Ngelag Masih,0.64997398853302
c7b84eda-e959-4fe9-b1b9-2627287709ba,"Aplikasi nya kenapa lemot banget ya,padahal paket banyak lho...padahal harga nya murah2..tapi memperlambat pekerjaan ini bukan mempermudah karna lelet banget .. mohon di perbaiki yaa pihak Indomaret aplikasi nya biar gak lelet banget",1,Tolong Aplikasi Tidak,0.8363723158836365,0,Di Ada Toko,0.8089639544487,3,Banget Lambat Susah,0.799663782119751
eb428b38-bb4c-4abe-84b7-1cef90a61d09,Aplikasinya lemot banget. Perbaiki server/hosting/software nya.,3,Banget Lambat Susah,0.8030070066452026,1,Tolong Aplikasi Tidak,0.7790148258209229,21,Keranjang Muncul Super,0.7496291399002075
9c7de855-437d-473b-a93e-198c42274403,Kolom pencarianya tolong di perbaiki gak cuman harga barang yg selalu di perbarui.,1,Tolong Aplikasi Tidak,0.7163676619529724,5,Barang Stok Toko,0.7185124158859253,21,Keranjang Muncul Super,0.6866089105606079
30e0a1af-4e2c-49a1-ae6e-67c3f1def848,Untuk masalah scen barcode pada aplikasi tolong ditingkatkan banyak yg tak terbaca da ntidak bisa mengecek harga,1,Tolong Aplikasi Tidak,0.7767945528030396,6,Pembayaran Bisa Tidak,0.7598649263381958,9,Bisa Tidak Dibuka,0.7448999881744385
762d0919-252b-4476-a825-e49b8dadedf9,"Baru kali ini pakai klik harga di klik sama toko beda,, di klik promo tapi di toko harga normal,, padahal awal2 dulu selalu sama antara harga klik dan toko,, sampai kemaren eyel2lan ma kasir,, saran aja kalau bisa untuk harga di klik sama toko disamain aja,, kalau di klik promo ya di toko juga promo, lucunya lagi kemaren jawaban staff gini "" Oohh kalau di klik itu promo non member "" Lah kalau harganya lebih murah non member mending gak jadi member kan,,",0,Di Ada Toko,0.8246265053749084,2,Tebus Murah Aplikasi,0.7883516550064087,4,Jam Sampai Pengiriman,0.7468119263648987
647ee79a-1e94-4924-822f-7eeb13097a50,Bagus sih aplnya tapi lemotnya gak kuat banget debh,3,Banget Lambat Susah,0.8369459509849548,1,Tolong Aplikasi Tidak,0.779630184173584,13,Update Dikit Mulu,0.7430319786071777
d0f3feab-f704-4d88-9233-1c5bd6dc89ad,Ok,7,Bagus Lumayan Mantap,0.8221504092216492,10,Lambat Instagram Lebih,0.7442516088485718,27,Jaya Selalu Bermasalah,0.6844007968902588
edb62da3-c754-4ad8-89a4-e5c0d7279e71,Mantap,7,Bagus Lumayan Mantap,0.8606609106063843,10,Lambat Instagram Lebih,0.7415858507156372,12,Lelet Banget Lambat,0.729191243648529
26d9b7eb-8b04-44cc-9561-6825dd78b367,"Kenapa sangat lelet. Baik di android maupun di browser laptop sangat lambat bahkan saat pengisian alamat, apalagi belanja belum bisa",1,Tolong Aplikasi Tidak,0.7817085981369019,9,Bisa Tidak Dibuka,0.7913116216659546,21,Keranjang Muncul Super,0.7835589647293091
