reviewId,content,topic_id,topic_name,main_topic_prob,alt_topic_1,alt_topic_1_name,alt_topic_1_prob,alt_topic_2,alt_topic_2_name,alt_topic_2_prob
346668a3-00be-4e31-88e0-129802b6cd72,"Mau kasih saran . Buat di apk nomor wa toko , karna sistem pengiriman masih belum akurat . Minta estimasi 1 jam setelah pembayaran datangnya 3 jam. Kenapa minta di tambah wa toko karna kalau ada keterlambatan pengiriman mereka bisa memberi tau kami sebagai customer . Bukan cuman diem aja dan buat menunggu.",0,Jam Yang Pengiriman,0.896327018737793,1,Belanja Di Tidak,0.8078507781028748,10,Metode Pembayaran Membatalkan,0.8067800998687744
20afc540-afae-4901-a171-a810bc00091d,Sekarang malah gak bisa buka aplikasinya,2,Kenapa Bisa Buka,0.8062251806259155,11,Bisa Buka Tidak,0.8133185505867004,3,Sudah Bisa Aplikasi,0.7842977643013
de96988e-de51-499d-b743-c657ec7da247,"Aplikasinya minta di update tpi udah di update tetap gabisa dibuka, kenapa ya?",2,Kenapa Bisa Buka,0.8925269842147827,3,Sudah Bisa Aplikasi,0.8646277189254761,7,Bintang Kasih Update,0.7997888922691345
d99b0208-c170-4674-91b1-ad2cea8d40ed,"Kenapa voucher yg telah dipakai ditransaksi yg dibatalkan gak dikembalikan lagi,, kan voucher nya blm dipakai",1,Belanja Di Tidak,0.7353543043136597,6,Top Up Struk,0.766078531742096,10,Metode Pembayaran Membatalkan,0.7472754120826721
00bf3d1c-3028-4162-92f9-0a65c7a2e38d,"Baru juga Dua hari make apk ini udah eror aja alias bermasalah mau belanja tp keranjangnya TDK bisa di buka, malah ada tulisan kaya gini ""sepertinya apk sedang bermasalah. Kan gak jelas..",3,Sudah Bisa Aplikasi,0.8709808588027954,1,Belanja Di Tidak,0.8259965777397156,4,Kosong Gambar Produk,0.8244901895523071
d87b0cc5-b4f7-4393-bc47-3d17231452b6,Good,5,Ok Bagus Good,0.8620597124099731,27,Berat Aplikasi Secrol,0.6191372871398926,16,Lambat Mudah Sangat,0.6113147139549255
3c73e39c-0f9b-4261-b9d8-17550d89897f,Perbaharui aza terus sampe kapan...tetep ga bisa dbuka aplikasinya....selalu muncul perbaharui tiap mau dpakai..,2,Kenapa Bisa Buka,0.7300354242324829,26,Gagal Selalu Pembayaran,0.7761912941932678,3,Sudah Bisa Aplikasi,0.7478488683700562
5a3e3fd5-16cc-4c62-8545-dd981e915c1a,Sangat puas,17,Sangat Berbelanja Untuk,0.6596410274505615,5,Ok Bagus Good,0.7852435111999512,16,Lambat Mudah Sangat,0.68907630443573
a984e7ff-0612-4c5e-bd71-821bd7bac111,alfamart tropodo krian gak enak playanannya masak pakai member kok gak masuk alfagift,1,Belanja Di Tidak,0.7797269225120544,18,Rokok Beli Bisa,0.7499738335609436,6,Top Up Struk,0.7488244771957397
66de3586-3581-4c41-bd47-caa9f540ab08,Kenapa otp nya gak masuk terus berulang kali dicoba......,2,Kenapa Bisa Buka,0.7663779854774475,26,Gagal Selalu Pembayaran,0.7496114373207092,6,Top Up Struk,0.7406201362609863
b1c70de4-12bb-4437-be77-1625e1619c75,Sementara 3 dlu klo ok kedepanya baru bisa ditambah🙏,7,Bintang Kasih Update,0.6911597847938538,25,Dulu Mencoba Redeem,0.6576281189918518,24,Ngelag Bagus Cuma,0.643181562423706
8bfaf805-b9a3-4661-a510-ddaab945ddf6,Kalo belanja nya lebih dari 300-500 ribu kok gak ada nota nya terus ya padahal kasir selalu bilang di kirim k alfagift😅,1,Belanja Di Tidak,0.8508781790733337,6,Top Up Struk,0.8069577217102051,0,Jam Yang Pengiriman,0.7997523546218872
44f51ec9-d505-4e0f-87d7-d88c8e23a5a4,Aplikasi sering error,12,Sering Error Kebuka,0.8942655920982361,27,Berat Aplikasi Secrol,0.7993950843811035,11,Bisa Buka Tidak,0.7735723257064819
998f2a36-43d4-42db-b4ef-8d07b14b5990,Aplikasi nya suka keluar sendiri terus suka lemot dan susah dibuka pas mau co malah susah pas pembayaran,7,Bintang Kasih Update,0.7752918004989624,3,Sudah Bisa Aplikasi,0.8114100098609924,8,Banget Download Lambat,0.7627288103103638
d3c2e65a-a517-44ca-8f7c-cad4b59556f1,"Kenapa saya ngga bisa masuk ke aku saya?,, Apa yang terjadi?.. Responnya ""HTTP 502"" mulu.. Kirim email ke sahabat alfa juga responnya Unknow error.. Pusing bgt dah,, kalo si alfa udah tantrum gini..",3,Sudah Bisa Aplikasi,0.8347793817520142,2,Kenapa Bisa Buka,0.7909409999847412,1,Belanja Di Tidak,0.7848629951477051
a01a8c1b-2722-4b28-9f51-23cfb794a31d,Lama loading buat daftar selalu eror terus padahal jaringan normal saja,3,Sudah Bisa Aplikasi,0.830208420753479,2,Kenapa Bisa Buka,0.8051984310150146,8,Banget Download Lambat,0.7953733205795288
51212d7f-8c59-43d0-84c4-decdc081f64e,sekarang klaim poin gak bisa terus 😔😔,1,Belanja Di Tidak,0.6692599654197693,14,Bayar Mau Kok,0.7095608115196228,18,Rokok Beli Bisa,0.7012559175491333
0b9d0867-74d7-44d3-b89b-345ef084f885,Kok lama2 struk tidak masuk aplikasi lg..poin juga tidak menambah?? Baiknya ditingkatkn lg sistem alfagiftnya.,1,Belanja Di Tidak,0.8118858337402344,6,Top Up Struk,0.8414809703826904,3,Sudah Bisa Aplikasi,0.819861888885498
c2412ad6-b263-49cc-9ca5-fce28df1a755,"Ambil ditempat voucher cashback gak segera masuk aplikasi, sudah 2 hari",1,Belanja Di Tidak,0.7679989337921143,10,Metode Pembayaran Membatalkan,0.7909775972366333,6,Top Up Struk,0.7360384464263916
99fcd6e3-efc0-491a-b5b0-1cf28029d652,Vocer banyak yg g bisa digunakan. Apalagi pesen dari alfagift cashback kupon g masuk. Pdhl kalo ke toko lngsung stlh pmbyrn dapet vocernya lngsung🤧,1,Belanja Di Tidak,0.8688497543334961,6,Top Up Struk,0.818422257900238,4,Kosong Gambar Produk,0.8115168809890747
6c94012b-67e3-4c68-aa5b-0aceee34bdca,Sebenernya enak belanja dialfa tapi tolong diperbaiki lagi SISTEM KERJANYA dan karyawannya yg males2 ya Masa saya pesen air galon dari pagi belum dikirim2 juga sampe malem 😏 minta dibatalin juga banyak alesannya ampun deh apalagi Alfamart pura demak bali ya Allah tolong diperbaiki sistem deliverynya ya jangan buat kecewa pelanggan,0,Jam Yang Pengiriman,0.8441895246505737,1,Belanja Di Tidak,0.82552570104599,4,Kosong Gambar Produk,0.7902492880821228
8a159514-d5b4-4367-af47-5582bcf99f82,"Masih mencari cara lihat struk belanjaan ya dimna ya. Ko cari riwayat GK ada hasil struk belanjaannya . Cuma riwayat poin doang,ngapain yg penting itukan struk belanjaannya,biar tau bner gak harga nya",1,Belanja Di Tidak,0.8164570331573486,6,Top Up Struk,0.802386462688446,0,Jam Yang Pengiriman,0.7824409008026123
ab9751d9-227e-4632-b6ed-6d44e665d021,sudah seminggu aplikasi tidak bisa digunakan untuk order,11,Bisa Buka Tidak,0.7784712314605713,2,Kenapa Bisa Buka,0.7161315679550171,12,Sering Error Kebuka,0.7006891965866089
c280edec-7a65-40e6-941a-a367e87274b7,Susah di download,8,Banget Download Lambat,0.7710208296775818,11,Bisa Buka Tidak,0.7515273094177246,16,Lambat Mudah Sangat,0.7512307167053223
d4a224c9-0c4a-4aca-8e2c-b1f1c728db15,"Kenapa aplikasi alfagift selalu force stop ,kalau ada instal aplikasi vpn.",2,Kenapa Bisa Buka,0.7964537143707275,3,Sudah Bisa Aplikasi,0.7417862415313721,12,Sering Error Kebuka,0.7392006516456604
b44169fb-49cb-428a-9002-334bcce3dcf5,"Adain ulasan untuk tokonya doang,, sebel bgt klo beda harga di rak sama pas di kasir, dan masukin member alfagift tapi E-receipt nya ga muncul..",1,Belanja Di Tidak,0.8425180912017822,4,Kosong Gambar Produk,0.787895679473877,6,Top Up Struk,0.78658127784729
67a40dd4-2ae3-4670-a5d8-108eeac943de,Udah hampir sminggu mo co lewat Alfa gift Dgn 3 akun gak bisa semua..tak coba g bisa terus selalu macet di pilihan pembayaran..saya pakai vocer pula..hangus semua...krna gagal..gimana si ...tlong dong,3,Sudah Bisa Aplikasi,0.8518224954605103,1,Belanja Di Tidak,0.8267823457717896,0,Jam Yang Pengiriman,0.8122875690460205
556cf715-87d1-43b6-8673-0f35b1c1885d,"Saya pesan barang estimasi 1 hari, tp smpai skr belum di antar barangnya..saya stuck ga bs kmn² krn nungguin kawatir kurir datang. Tp mengecewakan sekali..telpon ga di angkat, chat ga di balas",0,Jam Yang Pengiriman,0.8776613473892212,15,Delivery Tercover Lokasi,0.8067800402641296,1,Belanja Di Tidak,0.7789226770401001
1c22817f-4031-43e8-9ded-4c200623cd8b,"Agak kecewa skr sm pelayanannya ..kurirnya sih ramah"" cuma pengirimannya kadang lewat bgt dr jam estimasinya..misal lg perlu bgt susu anak abis nunggu"" ga dtg"" .trs kadang ada barang yg kurang mau ditanyain juga ga enak kalo udh sekali dua kali tanyain masih ga dibawain karena kurirnya kan beda"" .tolong diperbaiki lagi kasihan juga kurirnya kalo pengiriman banyak mungkin jadi numpuk.semoga ada solusinya .",0,Jam Yang Pengiriman,0.8668192028999329,1,Belanja Di Tidak,0.7956199645996094,3,Sudah Bisa Aplikasi,0.7692404985427856
8e9821c6-6aa5-4f10-b7f3-28b85f1abff4,Ok,5,Ok Bagus Good,0.9026138782501221,27,Berat Aplikasi Secrol,0.6874635219573975,16,Lambat Mudah Sangat,0.6214265823364258
e53387df-cd86-4f06-b0e1-45836f92098a,"Tolong di perbaiki lagi sistem nya, bill/struk yang masuk ke aplikasi lama sekali masuk nya jadi tidak bisa langsung cek bill dan update voucher tersedia juga tolong di perhatikan lagi, masa voucher yg sudah terpakai masih ada di dlm voucher tersedia. Saya pelanggan setia Alfamart tolong di perbaiki lagi sistem alfagift nya.",1,Belanja Di Tidak,0.8203376531600952,6,Top Up Struk,0.8173433542251587,20,Akun Saya Email,0.811394453048706
5f6e22d3-2138-45bc-861a-41f95384e0de,"Coba hitung deh, cb 25% tiap blanja 60k tp cb nya trnyata cuma 10k Wkwkwkwk lawak min.. min.. Mana 25%nya???? Bisa itung""an ga sih 🤣🤣🤣🤣 Ya emng butuh sih tips marketing biat laris, tp ngga nipu juga kali 🤣",3,Sudah Bisa Aplikasi,0.6641205549240112,1,Belanja Di Tidak,0.6984630823135376,7,Bintang Kasih Update,0.6843684911727905
d7eff265-eee3-4924-b8a5-2a8319856b70,"Lama kali loadin di halaman depannya kadangpun gak terbuka, di update pun sama aja",9,Pengiriman Lama Banget,0.6659612059593201,7,Bintang Kasih Update,0.8024367094039917,3,Sudah Bisa Aplikasi,0.7958307266235352
e9300b1c-22f8-4789-bfa9-a5beb16a5506,"Barang yang dikirim tidak sesuai pesanan, dan ada beberapa yang barang yang aku beli tidak di kirim. Nomor telepon ga pernah di balas. Apa yang harus dilakukan",0,Jam Yang Pengiriman,0.8180959820747375,4,Kosong Gambar Produk,0.7500507831573486,15,Delivery Tercover Lokasi,0.7473882436752319
e7f54d35-3484-48df-a809-3eb0c022880b,kok selalu tidak masuk alfagift ya struknya? rugi dong belanja banyak g dapat poin seharusnya dapat😌,1,Belanja Di Tidak,0.8418517112731934,6,Top Up Struk,0.807671308517456,4,Kosong Gambar Produk,0.7863832712173462
c52cdd3b-4929-4b5c-b9dc-0038bee691f9,"Saran aja, untuk lacak pengiriman beneran di track kurir yg ngirimnya. Supaya kita tau dan bisa siap-siap jika kurir sudah dekat. Jangan lupa room chat juga perlu",0,Jam Yang Pengiriman,0.7779878377914429,15,Delivery Tercover Lokasi,0.7119306325912476,13,Qris Pembayaran Tambahkan,0.7000153064727783
11d5a017-0203-49d9-81d6-2c17aff991b9,"Menurut ku apknya udah ok banget, tapi sayangnya masalahnya dari dulu selalu masalah dengan pengiriman, diiklan tidak lama tapi kenyataannya lama banget, nomor toko ngga ada yang bisa dihubungi ngga ada konfirmasi dari toko juga, lelet, lambat, kurang respon. KECEWA BERAT",5,Ok Bagus Good,0.3882736563682556,0,Jam Yang Pengiriman,0.8657508492469788,3,Sudah Bisa Aplikasi,0.8258062601089478
b0350ab7-edcd-41f8-b235-c1ca0e491b69,"Sangat menunjang, bagus 👍",5,Ok Bagus Good,0.800324559211731,16,Lambat Mudah Sangat,0.7274043560028076,19,Membantu Sangat Langsung,0.6724526286125183
b95b32f9-47c4-4120-ab3d-2cdbec6be789,"Pin terkunci, sms gak masuk, pilihan lahin ga bisa diklik. chat cs tidak tersedia padahal pas jam operasional. telpon cs juga dua kali gak diangkat. hhhh",0,Jam Yang Pengiriman,0.7965173721313477,3,Sudah Bisa Aplikasi,0.8159725666046143,6,Top Up Struk,0.7826590538024902
07dfda6d-5ac1-45d9-b0d0-986adcbe6bd3,Lambat,16,Lambat Mudah Sangat,0.8051562309265137,5,Ok Bagus Good,0.844025731086731,27,Berat Aplikasi Secrol,0.7306948900222778
f7f094b3-c89a-48ec-b141-2c60da88ec82,"Pengiriman tidak tepat waktu dg alasan antrian panjang, mungkin bisa disesuaikan jam nya biar pelanggan ndak nunggu lama. Dibatasi jumalah pengiriman jika jamnya sudah penuh.. seperti aplikasi sebelah",0,Jam Yang Pengiriman,0.8156907558441162,10,Metode Pembayaran Membatalkan,0.7917375564575195,13,Qris Pembayaran Tambahkan,0.7285141944885254
e1f11e13-c48e-499b-8bb1-b37188eb1ad9,"Nanti kalo udah diperbaiki,aku kasih full lagi, Ini kenapa ya gak bisa potong koin di Shopeepay, Biasanya bisa kok,udah 2 kali belanja kok gak bisa potong koin di Shopeepay,malah langsung kebayar aja, Tolonglah ,kan mubazir koin yg di shopeepay kalo gak digunakan Sedangkan ada masa berlakunya tuh koin, Kan lumayan buat potongan di Alfa, biasanya loh bisa",1,Belanja Di Tidak,0.8398078680038452,0,Jam Yang Pengiriman,0.7871816158294678,3,Sudah Bisa Aplikasi,0.775012195110321
833101ae-aa20-4a12-a725-046cd91a6743,"Kacau!! Setelah update versi terbaru gak bisa motong koin shopee pay, lebih baik pake versi lama alfagift !! Cuman ya gak bisa",1,Belanja Di Tidak,0.8293970823287964,7,Bintang Kasih Update,0.8268603086471558,3,Sudah Bisa Aplikasi,0.8246177434921265
9cadb5fe-d326-49c2-a87a-60d93681a083,"Kenapa aplikasi ponta Indonesia TDK di temukan ya , mau ganti nomer hp lame ke yg baru , nomor nya sudah ilang ga aktif , bs di bantu ga di kartu member Alfamart saya jadi ga bs upgrade ke alfagift karna minta verifikasi nya ke nomor hp lama tolong jawaban yg valid q mks 🙏🏻",2,Kenapa Bisa Buka,0.8450809717178345,20,Akun Saya Email,0.8608669638633728,3,Sudah Bisa Aplikasi,0.828154444694519
cc2494c3-9593-464f-8ae6-b132ff243e91,Sangat amat lemot,16,Lambat Mudah Sangat,0.8273011445999146,5,Ok Bagus Good,0.6878157258033752,27,Berat Aplikasi Secrol,0.6529784798622131
975871e6-5e5f-4704-9e5c-1403ffafed49,Knapa aplikasi nya ga bisa d buka ya. Slalu kmbali dan kmbali lagi tiap d buka.,2,Kenapa Bisa Buka,0.8606740832328796,3,Sudah Bisa Aplikasi,0.8310728669166565,26,Gagal Selalu Pembayaran,0.8060575723648071
3c3d9ca6-6ea2-412d-a210-3e26ae150b92,"Udah 2 kali belanja lewat aplikasi kok selalu diarahkan ke toko yang diluar alamat dari pemesannya, padahal dulu baik2 aja, apa sekarang Alfagift gak bisa baca alamat konsumen untuk diarahkan ke alamat toko yang terdekat ya? Tolong untuk diperbaiki dong, saya jadi kurang nyaman untuk belanja lagi lewat aplikasi padahal langsung dibayar lewat e-wallet lho",1,Belanja Di Tidak,0.8516525030136108,0,Jam Yang Pengiriman,0.8448522686958313,3,Sudah Bisa Aplikasi,0.813787579536438
80c62321-02bf-4c0f-8727-2358ce759d07,"Tiba-tiba aja aplikasi nya gak bsa d buka. Tulisannya d perbaharui tp gak bsa jg d buka. Poin saya lumayan byk, rugi dong klo gk bsa d pake. Sdh 1mggu lbh lo....d uninstall trs d install ulang lg tetep aja gak bisa. Kecewa sekali💔😡",3,Sudah Bisa Aplikasi,0.8520170450210571,2,Kenapa Bisa Buka,0.8100327253341675,20,Akun Saya Email,0.7754794955253601
eacff3d0-863e-47c8-87e9-c52dd2fbdbfc,"Baru kali ini kecewa sama Alfa masa mau terker stamp udh cukup di bilang blm cukup , . Di app sama di sistem nya bisa beda aneh .",1,Belanja Di Tidak,0.7946045994758606,3,Sudah Bisa Aplikasi,0.813382625579834,7,Bintang Kasih Update,0.7903074622154236
7715cb1f-f177-4c5f-ae2e-5bb34061151c,apa pengiriman maksimal 1 jam setelah pembayaran itu cuma formalitas ? hari ini tadi siang pesen susu bayi sampe udh sore belum juga dikirim padahal sudah dibutuhkan banget itu susu . kemarinpun barang stock kosong gak di info sama sekali . rugi di konsumen dong begini caranya,0,Jam Yang Pengiriman,0.8763697147369385,1,Belanja Di Tidak,0.8062124252319336,4,Kosong Gambar Produk,0.7934773564338684
5187ba58-79b0-4a61-8ddf-85878229fdc5,Kipa Ilakes👍👍👍,5,Ok Bagus Good,0.6855540871620178,27,Berat Aplikasi Secrol,0.5965045094490051,16,Lambat Mudah Sangat,0.5422172546386719
af678927-4229-4785-af91-23c550719181,Perbaiki lag pelayanan saya minta maksimal 1 jam ini hampir 3 jam blm sampai barang nya,0,Jam Yang Pengiriman,0.8230102062225342,15,Delivery Tercover Lokasi,0.7650432586669922,9,Pengiriman Lama Banget,0.7554585933685303
9294f457-b42a-4cb1-9208-dfaa29f9df66,Ok,5,Ok Bagus Good,0.9026138782501221,27,Berat Aplikasi Secrol,0.6874635219573975,16,Lambat Mudah Sangat,0.6214265823364258
abca30ed-f1c5-4879-b6be-e7815e01af7f,Tolong metode pembayaran shopee leter aktifkan lagi,13,Qris Pembayaran Tambahkan,0.8032827377319336,10,Metode Pembayaran Membatalkan,0.7258466482162476,6,Top Up Struk,0.6857509613037109
8768715c-28a1-4b5c-980e-eb143529a309,"Saran dong developer, tambahin fitur bisa ngechat si kurir dari apk, bukan harus lewat wa Terus tambahin rating sama komentarnya juga, biar alfa bisa tau gimana pendapat pelanggan tentang pelayanan dari alfa gift. (Sebagai pelanggan biasanya pesan alfa gift agak kek gimna apalgi pesannya nggak tau nyampenya kapan kalau nggak bisa ngechat sih penjual atau lacak, walaupun ada fitur telpon, but semua pelanggan belum tentu punya paket telponkan ujung'nya modalin internet doang) .",0,Jam Yang Pengiriman,0.8190552592277527,1,Belanja Di Tidak,0.7933553457260132,3,Sudah Bisa Aplikasi,0.7631688714027405
65f60956-7acb-4d61-831e-2b5b30798b08,"Saya itu butuh Struk Belanja, Kenapa Lama sekali masuk di Aplikasi ?? Saya Belanja siang, sampai pagi hari besokNya ya belum muncul di Riwayat Pembelian Aplikasi.... HarusNya setelah beli, itu beberapa menit langsung masuk Struk RiwayatNya di Aplikasi.... Bisa Langsung di Lihat.... Saya sangat sering belanja banyak, dan perlu Struk PembelianNya.... Oleh Kasir selalu di Info, Struk masuk di Alfagift.",1,Belanja Di Tidak,0.8472990393638611,0,Jam Yang Pengiriman,0.8307403326034546,6,Top Up Struk,0.8009567260742188
4875c535-dc6f-44da-a6c0-50935b1153f4,"Pelayanan msing2 toko beda² ada yg buruk ada yg bagus kirain mau jauh mau Deket Alfamart tetep ngasih pelayanan ke pelanggan ,ini cuma jauhnya cuma 3km aja ga mau nganterin alasanya terlalu jauh ,padahal aplikasinya yg ngatur toko pengirimnya",5,Ok Bagus Good,0.4178086519241333,0,Jam Yang Pengiriman,0.8266523480415344,1,Belanja Di Tidak,0.7859838008880615
37d64031-e7e5-4c71-bca1-e3217d69e965,"Membantu sih sebenarnya, hanya proses pengiriman lama banget, order jam 15:06 menit status update berubah sedang diantar, sekarang pukul 17:19 belum sampai, alangkah baiknya ditingkatkan kembali, terutama deng Costumer Service 24jam",0,Jam Yang Pengiriman,0.8593329787254333,10,Metode Pembayaran Membatalkan,0.7553806304931641,15,Delivery Tercover Lokasi,0.7455153465270996
1af6b6a6-b77a-448c-a739-9794c5b95702,Sekarang alfagift resit belanja nya kok gk singkron y.. Tolong dong di perbaiki,2,Kenapa Bisa Buka,0.8138984441757202,6,Top Up Struk,0.8132232427597046,1,Belanja Di Tidak,0.7899508476257324
4fc7e928-0285-4645-8199-561f2297926a,"Mengecewakan,,,parahh kaga bisa dibuka apk nya malah suruh perbaharui tapi malah bukan perbarui malah buka unsinstal ulang 😡😡",3,Sudah Bisa Aplikasi,0.8269085884094238,2,Kenapa Bisa Buka,0.7980362176895142,7,Bintang Kasih Update,0.7731430530548096
accd4a88-f13f-4fbf-826a-47eb2156a895,"Dari segi pelayanan dan aplikasi udah oke, cuma live chatnya ngajak ribut, sebenernya admin live chatnya tuh kerja atau enggak? Atau setan yang pegang live chatnya? Masa iya nunggu antrian lebih dari 24 jam, tiap mau ke live chat untuk pengaduan boro"" di tanggepin, nunggu antriannya aja bisa dari pagi ketemu pagi lagi wkwkwk, apus aja mending fitur live chatnya🤣",2,Kenapa Bisa Buka,0.6322299242019653,0,Jam Yang Pengiriman,0.7844176292419434,3,Sudah Bisa Aplikasi,0.7321693897247314
37870760-f5da-43e1-837b-68ab327e36f6,"Aplikasi nya bagus sangat membantu, cuma saya mau kasih masukan tolong dikasih brefing lg untuk cara klaim hadiah , vocer saya sering angus krna masih ada karyawan yg tidak tau cara di sistem dia untuk klaim hadiah.. pdhal lumayan hadiah saya boleh tuker star, dan tuker poin.. dan untuk karyawannya di kasih arahan lagi, untuk pengambilan hadiah juga tetap harus ramah, krna kan hadiah pun, boleh didapat dr belanja😃 saya belanja loh bukan minta😁 btw saya udah member royal yah.",1,Belanja Di Tidak,0.81443190574646,0,Jam Yang Pengiriman,0.8055872917175293,19,Membantu Sangat Langsung,0.7596434950828552
1dd7f866-1920-46f9-b0be-5b40304d9b57,"Tolong di perbaiki, saya pindah kota dan mau ganti lokasi, knp titik lokasi tidak tercover trus,,,",15,Delivery Tercover Lokasi,0.8172338604927063,2,Kenapa Bisa Buka,0.7801361083984375,3,Sudah Bisa Aplikasi,0.7348330020904541
d04fff79-7ce4-41cf-94ed-fab332b53b1a,Sangat disayangkan aplikasi alfagift belum nge-link ke aplikasi virgo. Semoga segera diperbaiki untuk bisa disingkronisasikan antara kedua aplikasi tersebut untuk pembayaran belanja di Alfamart. Terimakasih.,0,Jam Yang Pengiriman,0.6841442584991455,1,Belanja Di Tidak,0.7262951731681824,13,Qris Pembayaran Tambahkan,0.7246576547622681
240175c5-bd1d-417a-b56a-35faf9c4a1de,"Pengiriman kurir lama, padahal sudah di klik pada waktu pengiriman maksimal 1 jam. Kmaren juga saya belanja krn ada beberpa barang tidak ada, di chat sama pelayan toko kalau sudah di batalkan dan saya di suruh ke cek out lagi. Saya tunggu poin saya kembali sampe sekarang gak juga kembali 😠",0,Jam Yang Pengiriman,0.9050644040107727,1,Belanja Di Tidak,0.8294593095779419,10,Metode Pembayaran Membatalkan,0.8037171363830566
218769bf-1060-4ca9-87c1-ad88a7d8a749,"Agak kecewa belanja 300rb tapi ga dapet stamp, padahal lagi kumpulin stamp, kemaren belanja 100rb dapet stamp 2, tapi stamp ny ga masuk2 d aplikasi, padahal tulisan nya stamp telah di perbarui, kecewa banget aq😌",6,Top Up Struk,0.7746322154998779,1,Belanja Di Tidak,0.7949917316436768,3,Sudah Bisa Aplikasi,0.7711924314498901
63196bdc-494b-4904-b920-5fb81419dd70,"Mau kasi bintang berapa ini,, soalnya barang yang si cari tidak ada di etalase, semua kosong terutama makanan beku, naget, fiesta, dsbnya, jadi bingung mau kasi bintang berapa,, maaf saya kasi 3_ bintang dulu ya,, kalau nanti di etalase sudah bisa di lengkapi,, saya janji akan kasi tambah bintangnya, saya kasi 3 bintang ini karena saya suda 2x pesan disini dan itu respon bagus dan pelayanan juga bagu, terutama pengantarnya juga ramah, udah bagus semuanya, cuman kekuaranganya stok di etalase kson",7,Bintang Kasih Update,0.733867347240448,0,Jam Yang Pengiriman,0.8342522382736206,1,Belanja Di Tidak,0.7872480154037476
94d855ac-3540-45d8-8c11-3a99783c1f8e,"cara batal pesanan bagaimana saya salah tulis alamat pengiriman, gak ada tombol batal pesanan atau alihkan alamat pengirimana pesanan?",0,Jam Yang Pengiriman,0.7293868064880371,10,Metode Pembayaran Membatalkan,0.7520978450775146,13,Qris Pembayaran Tambahkan,0.7205931544303894
513e3754-5e73-4572-a10b-3d60179da2a4,Kenapa apliksi tidak bisa di buka pdhal sudah di upgrade tapi malah tidak bisa masuk,2,Kenapa Bisa Buka,0.8765298128128052,3,Sudah Bisa Aplikasi,0.82333904504776,6,Top Up Struk,0.7766811847686768
f3875ad0-10de-4949-ab8b-a0305cfd1edc,Seminggu ini aplikasi alfagift gk bisa digunakan. Setiap dibuka selalu muncul tulisan perbarui. Setelah di klik diperbarui diplaystore malah gk muncul menu perbarui (cuma muncul menu buka dan uninstall). Tak coba uninstall terus tak install kembali. Ternyata tetep gk bisa. Tetep muncul menu perbarui. 😓😓😓,3,Sudah Bisa Aplikasi,0.7723049521446228,2,Kenapa Bisa Buka,0.7239897847175598,20,Akun Saya Email,0.7003741264343262
332c4e70-2b29-4a8a-86d9-6b7640e455f4,Ga bisa daftar tu knp ya? Tulisanya pas itu katanya ada aktifitas mencurigakan di handpone anda. Terus pas hubungi sahabat alfa sama aja g bisa,3,Sudah Bisa Aplikasi,0.8131446838378906,2,Kenapa Bisa Buka,0.8064925074577332,20,Akun Saya Email,0.8008413314819336
6f44cdc8-1f9d-4f3a-9e93-2e9602a65749,Kenapa sekarang buat belanja gak bisa bayar COD ya ?,14,Bayar Mau Kok,0.83098304271698,1,Belanja Di Tidak,0.7977356314659119,18,Rokok Beli Bisa,0.7958997488021851
f18bc057-43e4-4d88-8e12-a45ba0c863f3,Lambat banget loadingnya pas masuk menu pembayaran,8,Banget Download Lambat,0.8161492943763733,14,Bayar Mau Kok,0.7392728924751282,12,Sering Error Kebuka,0.7386839389801025
2ac65222-00ec-4a2c-b14d-b87a38e4c1e5,2 egefe⁴er 23r ee⁴3r 3éy 222 5,-1,23R 222 Egefe⁴Er,0.0,27,Berat Aplikasi Secrol,0.4674813151359558,5,Ok Bagus Good,0.4634804129600525
57616820-6bb2-4176-9d3b-30eb325d35cd,"Pesannya jm stengah 8 malam udah ditunggu smpe jam 10 blm di antar juga pas cek di aplikasi statusnya sudah diantar penerima paketnya dikasih gambar hitam semua. Pas chat ke nomor toko responnya lama, dibalas nanti setengah 12 malam baru kurirnya nanya mau diantar kemana padahal udah ada alamatnya di aplikasi. Barang tidak diterima tapi gak bisa pengajuan pengembalian dana.",0,Jam Yang Pengiriman,0.8953320980072021,1,Belanja Di Tidak,0.7866576910018921,15,Delivery Tercover Lokasi,0.7705677151679993
64c647dc-0572-437c-9749-ab8d8ecc58cf,"Pengantarannya lama banget padahal aku selalu beli menggunakan alfagift. namun selalu lama dalam mengantar, saya hampir menunggu setengah jam lebih",0,Jam Yang Pengiriman,0.7739067077636719,1,Belanja Di Tidak,0.7332379817962646,15,Delivery Tercover Lokasi,0.7150306105613708
8a35f0e8-4178-4a4b-adc3-0bebd334cac3,"Bagus, cuman Pegawainya tolong diajari Etika, saya gak suka cara mereka mengeluh saat mengantar pesanan, Sekiranya cuma bikin Konsumen sakit hati, mending resign aja. Jujur saya Pake Alfagift karena membantu saat saya lagi sakit susah ke mana-mana, tapi untuk Pegawainya saya kecewa",0,Jam Yang Pengiriman,0.7989648580551147,1,Belanja Di Tidak,0.7579681873321533,19,Membantu Sangat Langsung,0.7518730163574219
9e678660-06ab-4711-9794-ad4691958e6a,Kak ini kenapa ya saya login di lain hp tidak bisa padahal baru instal..device sudah terhubung,2,Kenapa Bisa Buka,0.8798664808273315,3,Sudah Bisa Aplikasi,0.8516457080841064,20,Akun Saya Email,0.7929666638374329
303675ef-da86-4230-9f3d-1c78428e9091,"di daerah sy klo pesan lewat alfagift suka lama & sy kesitu blum disiapin., ada jg yg pegawai nya judes banget🤦",1,Belanja Di Tidak,0.8097704648971558,0,Jam Yang Pengiriman,0.8019964694976807,15,Delivery Tercover Lokasi,0.7734849452972412
70720ca5-4180-417d-945a-15b053b073f3,"Min, ini udah ga bisa potong koin shopee?",1,Belanja Di Tidak,0.7484626770019531,14,Bayar Mau Kok,0.7721658945083618,6,Top Up Struk,0.7384880185127258
