reviewId,content,topic_id,topic_name,main_topic_prob,alt_topic_1,alt_topic_1_name,alt_topic_1_prob,alt_topic_2,alt_topic_2_name,alt_topic_2_prob
c106cccf-7fd5-4eb3-adb8-ec4d719db445,"Padahal aplikasi sangat membantu kemageran saya... Tapi kok lambat banget. Keterlambatan saya maklumi, karena pasti orderan bukan dari saya saja. Tapi kalo terlambat 1x24 jam itu gimana.. padahal saya udah chat admin nya respon nya tetap lama, khususnya daerah bandar lampung",0,Jam Yang Pengiriman,0.8810083866119385,15,Delivery Tercover Lokasi,0.8113659620285034,3,Sudah Bisa Aplikasi,0.8089011907577515
2a6dfef9-6c6c-4830-bbd5-91c90ae219c2,saya harap kedepannya bisa pembayaran menggunakan emoney,0,Jam Yang Pengiriman,0.6077069044113159,13,Qris Pembayaran Tambahkan,0.7551695108413696,10,Metode Pembayaran Membatalkan,0.6981093883514404
74841e09-3632-4168-bbf1-14265d931c38,apk di hp saya tidak bisa di buka suruh baca sarat ketentuan tapi gak muncul muncul tollong di oerbaikk,11,Bisa Buka Tidak,0.7951092720031738,2,Kenapa Bisa Buka,0.8726918697357178,3,Sudah Bisa Aplikasi,0.8488801717758179
a64e5c0b-c071-4df8-bc69-a1e35822a4fd,Masalah yg ada disini yaitu PIN nya tidak mau tersimpan,0,Jam Yang Pengiriman,0.6148446798324585,2,Kenapa Bisa Buka,0.7331018447875977,6,Top Up Struk,0.7152512073516846
9a245505-225b-4dc6-bfcf-44cd58500d50,Kenapa yah beli lewat Alfagift lama banget penganteran nya bisa lebih dari 1 jam an padahal toko cuman berjarak 700 meter doang dari rumah,0,Jam Yang Pengiriman,0.7356700897216797,1,Belanja Di Tidak,0.7648833990097046,4,Kosong Gambar Produk,0.7277590036392212
d986ef81-ae99-431a-b149-593276486b08,"Tolong bgt ini mah kenapa setiap verifikasi login ganti device itu susah bgt bgt bgt,bikin jengkel Padahal aplikasi ini cukup membantu Semoga bisa buat bahan perbaikan",3,Sudah Bisa Aplikasi,0.8079174757003784,2,Kenapa Bisa Buka,0.7802761793136597,8,Banget Download Lambat,0.758438229560852
b01bbb30-4418-4a12-a12f-9e67396a8e17,Min ini bagus pesenan saya dateng cuma.ko poin ga bertambah ya sama status di belanjaan klo udh dikirim ada tulisan pengembalian dana dan batal ya kenapa ya,0,Jam Yang Pengiriman,0.8598508834838867,1,Belanja Di Tidak,0.8654362559318542,6,Top Up Struk,0.8376045227050781
7ea86ed7-9f37-4963-bf6e-38f6d65e64c0,Gak jelas kalo mau top up lewat sini kadang ada kadang gak ada nominal nya pul gak jelas pula kada 10rb doang buset yng bener dikit lah masa gak pastii,6,Top Up Struk,0.7017408013343811,1,Belanja Di Tidak,0.7320584654808044,7,Bintang Kasih Update,0.7079550623893738
fe1040b1-35ab-4f51-85b8-e1261772d532,"Mau beli le mineral di alfagift biar di anter karena ga ada motor tapi di alfagift nya tidak ada, padahal Alfamart di depan jalan BANYAK le mineral galonnya, ini ga semua Alfamart terhubung ke alfagift kah??",1,Belanja Di Tidak,0.7935688495635986,4,Kosong Gambar Produk,0.749630331993103,6,Top Up Struk,0.739132285118103
afa0b779-d6ea-4e83-ba34-75bf56e76174,"Kenapa ya Udah beberapa kali belanja langsung tp kok resi nya GK masuk aplikasi, poinnya jg gak bertambah Pdhal dulu aman2 aja , tp berapa bulan belakangan ini kok resi nya gk ada di aplikasi",1,Belanja Di Tidak,0.8392844200134277,3,Sudah Bisa Aplikasi,0.819408655166626,6,Top Up Struk,0.8141500353813171
8c5942e9-1327-40ee-8484-733afe80ba1a,"Dimana struk nya woyy 😭😭, katanya masuk aplikasi",1,Belanja Di Tidak,0.7135022878646851,6,Top Up Struk,0.7587266564369202,8,Banget Download Lambat,0.7443423271179199
117eb2b0-de86-47fa-8fcc-d85cd1fe76c7,"Kenapa sekarang tidak bisa di buka aplikasinya, mohon dikasih solusi dan diperbaiki",2,Kenapa Bisa Buka,0.8693006634712219,28,Android Pixel Pro,0.8082287311553955,3,Sudah Bisa Aplikasi,0.7851791977882385
4ec9b431-93a6-4f2e-b8f7-7da7f0c04fa2,App nya bagus cuman kalau chat suka ga ke kriim alias gagal mulu,7,Bintang Kasih Update,0.860120415687561,3,Sudah Bisa Aplikasi,0.8384381532669067,8,Banget Download Lambat,0.8229334354400635
4bca6f0f-75b3-4945-a529-d9fb15d4dab3,"Saya pelanggan alfagift. Awalnya setiap mau pengiriman, konfirmasinya lewat wa dan itu memudahkan. Tapi semenjak di update, konfirmasi pesanannya sekarang lewat aplikasi alfagift. Itu menyulitkan banget. Jadi misalkan kurir nyariin rumah, chatnya lewat aplikasi. Dan notifikasi itu kadang gak muncul. Bikin emosi kadang",1,Belanja Di Tidak,0.8136795163154602,0,Jam Yang Pengiriman,0.8396254181861877,3,Sudah Bisa Aplikasi,0.7879061102867126
853c947b-299a-453a-9574-139ab9e8a5f6,Tolong pelayanan kurirnya di perhatikan lebih lagi kasian.... Saya pesan untuk jam 12 siang datangnya jam 5 sore😩,0,Jam Yang Pengiriman,0.8010645508766174,15,Delivery Tercover Lokasi,0.7578805685043335,13,Qris Pembayaran Tambahkan,0.7500544786453247
2bd2aa32-fc3f-46f0-aadd-8f76ff56c911,Susah banget batalin pesanan. Kemaren saya sala isi alamat trus dari kita gabisa batalin padahal udh bayar pake gopay. Dan toko nya susah bgt dihubungi nya. Chat di aplikasi ga respon. Pas udh di acc pembatalan pengembalian dana nya lama . Huft tolong di upgrade dong,0,Jam Yang Pengiriman,0.8869353532791138,3,Sudah Bisa Aplikasi,0.8696896433830261,1,Belanja Di Tidak,0.8539713621139526
ac9a50aa-356a-4f60-98ed-092073ceb46d,Memberikan wadah belanja yg nyaman,17,Sangat Berbelanja Untuk,0.6728911399841309,21,Produk Gambar Sesuai,0.5990554094314575,22,Kurang Satset Responsif,0.5421427488327026
4119c38c-3480-41e5-8e8c-caa4b19bc220,"Udah jadi member Alfa dari yang kartu,kartunya hilang baru bikin yang apl. Tadi ini beli detergen attack cair di rak harga 23rb LG diskon,ko di kasir jadi 47rb katanya itu salah harga,udah kasih no member biasanya ada potongan. Kecewa sih ini pengalaman 2x , Kecewa kecewa",1,Belanja Di Tidak,0.8484451770782471,0,Jam Yang Pengiriman,0.7947641611099243,4,Kosong Gambar Produk,0.7840223908424377
ffe8e3d0-f858-479e-91be-cb7f1084f917,"Knp ada syarat dan ketentuan segala sih ??informasi data pribadi bisa d ambil kapan saja secara otomatis,haduuuhh knp harus begini ???mau belanja jd males,harus menyetujui semua",4,Kosong Gambar Produk,0.741218626499176,1,Belanja Di Tidak,0.76634681224823,3,Sudah Bisa Aplikasi,0.7401653528213501
db79d436-db60-40a8-8d6d-53b155722148,Kok gk bisa di buka ini. Padahal biasanya bisa dibuka.,2,Kenapa Bisa Buka,0.8486170768737793,11,Bisa Buka Tidak,0.8114879131317139,3,Sudah Bisa Aplikasi,0.7780027389526367
7c280e86-e9b4-4c23-92f4-2207423edb4d,Baru mau nyoba,25,Dulu Mencoba Redeem,0.835759162902832,5,Ok Bagus Good,0.6604989767074585,16,Lambat Mudah Sangat,0.6580582857131958
bcff32f4-f029-44f0-a74f-e08f136fe2e7,"Pengiriman lama, saya sudah menunggu berjam-jam pesanan saya blm saja datang, pesanan bisa dilacak udah diproses atau blm akan tetapi kita tidak mengetahui lokasi pesanan udah dimana dan tidak ada konfirmasi dari toko terkait. Saya harap APK-Nya ditingkatkan",0,Jam Yang Pengiriman,0.8497021794319153,10,Metode Pembayaran Membatalkan,0.7606704235076904,15,Delivery Tercover Lokasi,0.7598690986633301
692c87cc-cda7-47b9-8e19-16a9b82740ea,"Alfagift cukup membantu jika ada yg berhalangan datang ke toko secara langsung, tetapi tinggi misscom dikarenakan tdk chat by personal seperti dulu (jika menghubungi skrg hanya bs lewat aplikasi saja), mungkin bisa dijadikan pertimbangan untuk kedepannya",0,Jam Yang Pengiriman,0.7756073474884033,1,Belanja Di Tidak,0.759390652179718,19,Membantu Sangat Langsung,0.7573234438896179
3d0569f1-db91-499e-ae9b-3671515721b6,Kenapa harga Virgo ya yang bisa dihubungkan ke Alfagift sedangkan DANA atau Gopay tidak?,2,Kenapa Bisa Buka,0.6206193566322327,1,Belanja Di Tidak,0.6631429195404053,18,Rokok Beli Bisa,0.6609996557235718
81bd1e86-d27b-4873-9012-369880ff6361,"Aplikasi eror, Aplikasi sudah bagus, tapi mohon d tambah untuk pesanan diterima. Poin suka gak masuk. Karna status pesanan belum selesai atau status dalam proses terus",0,Jam Yang Pengiriman,0.809131383895874,10,Metode Pembayaran Membatalkan,0.7966851592063904,3,Sudah Bisa Aplikasi,0.7887408137321472
5901ea8c-fd2c-4b7a-bdc1-ab12861ee783,"Percuma ada pilihan COD sampe bisa pilih nominal brp uang yg kita bayar... Pegawai nya ngga bawa kembalian, malah katanya ngga muncul di apk nya...",0,Jam Yang Pengiriman,0.8325304388999939,1,Belanja Di Tidak,0.830372154712677,3,Sudah Bisa Aplikasi,0.8068292140960693
bb018558-bc1c-4a8e-82d1-7415d7be8ea2,"Notif tlfon/chat dari kurir tidak muncul saat keluar apk, menghambat pengiriman kasian kurirnya",0,Jam Yang Pengiriman,0.706689715385437,10,Metode Pembayaran Membatalkan,0.7177634239196777,6,Top Up Struk,0.7117918133735657
ea6fdce3-aa8c-4b49-9e12-9f561f577f05,"Akun saya ko hilang ya, nomor/email tidak terdaftar di aplikasi sedangkan di toko alfa nya nomor saya masih bisa terdeteksi setiap habis belanja dan juga bukti email bahwa email saya telah terdaftar sebagai akun alfagift masih ada, tp kenapa akun saya tidak ada di aplikasi",20,Akun Saya Email,0.8914360404014587,6,Top Up Struk,0.8240926861763,2,Kenapa Bisa Buka,0.8211489319801331
87e4ab07-7143-4660-8ffa-a62d12486dcb,dapet stamp tp g pernah masuk ke aplikasi,1,Belanja Di Tidak,0.6919349431991577,11,Bisa Buka Tidak,0.7745498418807983,6,Top Up Struk,0.7659827470779419
db231d9b-1227-4878-9c34-161c462396fb,NGGAK BISA COD,11,Bisa Buka Tidak,0.7298058867454529,9,Pengiriman Lama Banget,0.710263729095459,10,Metode Pembayaran Membatalkan,0.6873992085456848
757a00bc-bebd-4380-b818-1837466f178c,"buat dev nya, tolong dong aturan untuk pembayaran cod (cash on delivery) di ubah, masa harus 50k baru bisa pakai cod",13,Qris Pembayaran Tambahkan,0.8469110727310181,1,Belanja Di Tidak,0.7842317223548889,0,Jam Yang Pengiriman,0.7740330696105957
53196515-2e41-4b53-9509-05efdb55b553,Fitur cod sering hilang,12,Sering Error Kebuka,0.8161780834197998,22,Kurang Satset Responsif,0.7486854791641235,21,Produk Gambar Sesuai,0.7443466186523438
d6afa563-ed49-40ea-a10f-093d5827ab4a,"Pengantaran lama, estimasi 1 jam tapi sudah 2 jam pesanan belum juga datang.",0,Jam Yang Pengiriman,0.7659828662872314,9,Pengiriman Lama Banget,0.7134362459182739,10,Metode Pembayaran Membatalkan,0.6961445212364197
7f70a6c0-b879-478e-833f-d2fda167dfb2,"tiga aja dulu, tolong diperbaiki ada masalah setelah berbelanja, struk diaplikasi tidak muncul, bahkan setelah 2x berbelanja. mohon solusinya. dan tidak bs membuka syarat dan ketentuan setelah update aplikasi...",0,Jam Yang Pengiriman,0.7892880439758301,6,Top Up Struk,0.8228232860565186,10,Metode Pembayaran Membatalkan,0.8002747893333435
424dc695-e5f0-4b17-941e-3875636dcd7f,aplikasinya bagus banyak diskon juga cuman kenapa kadang suka ngleag? terus juga susah buat buka aplikasinya,7,Bintang Kasih Update,0.8417253494262695,8,Banget Download Lambat,0.8170356154441833,3,Sudah Bisa Aplikasi,0.8123955726623535
62cddb94-4374-47d7-b1e2-6a164d66f074,Mau ganti nomor hp knp gk bisa?,2,Kenapa Bisa Buka,0.8187267780303955,11,Bisa Buka Tidak,0.7625330686569214,14,Bayar Mau Kok,0.7575119733810425
f7a63d0c-7456-4260-a178-89b6dd976065,Halo tolong ini kenapa gk bisa chek out pas klik pilih metode pembayaran?????,1,Belanja Di Tidak,0.7472165822982788,10,Metode Pembayaran Membatalkan,0.8127461671829224,13,Qris Pembayaran Tambahkan,0.7905641198158264
a02bce80-c65e-48d0-a1c3-e5d712ad474c,Dulu aku pakai ponta Dan no ponta saya masih aktif klo belanja poin bertambah terus. Tapi kan aplikasinya udah ga ada ponta. Gimana solusinya apa bisa poin saya masuk ke Alfa gift bila daftar dengan no yg sama dengan ponta.,2,Kenapa Bisa Buka,0.8105213642120361,1,Belanja Di Tidak,0.8377548456192017,6,Top Up Struk,0.820610523223877
3cce5459-11c6-49b0-9e23-b0ca70652bce,"Lumayan membantu dari pada belanja di toko langsung, perbedaan harga di alfagift dan di toko apalagi waktu proses pembayaran sungguh berbeda.",1,Belanja Di Tidak,0.752497673034668,10,Metode Pembayaran Membatalkan,0.7100528478622437,0,Jam Yang Pengiriman,0.7096978425979614
198aacce-052a-4dc9-8c02-db29536bac37,Cara buat belanja di aplikasi yang langsung dianter ke rumah caranya gimana y kok cuma bisa diambil di toko,1,Belanja Di Tidak,0.7842838764190674,4,Kosong Gambar Produk,0.7470682859420776,14,Bayar Mau Kok,0.7443094253540039
4e95087b-bf82-400e-b0ae-646e55720b7b,Point nya lambat sekali masuknya. Kadang gak masuk point nya!!,8,Banget Download Lambat,0.7877604365348816,7,Bintang Kasih Update,0.7674291133880615,3,Sudah Bisa Aplikasi,0.7521754503250122
c9396e14-1e70-4596-8aa1-469919d77243,Tolong Fitur chat pesanan di alfagift tolong diperbaiki ya soalnya suka salah ngelampirkan foto aturnya ada fitur hapus foto supanya pihak konsumen klw salah lampirkan foto bisa dihapus Kukasih rating 3 dulu nantu klw da diperbaiki kasih bintang⭐⭐⭐⭐⭐,7,Bintang Kasih Update,0.8019983768463135,0,Jam Yang Pengiriman,0.8085885047912598,1,Belanja Di Tidak,0.7936792373657227
9ef5dbb8-074f-4d6c-b839-16ffc1d6d91b,"Pengantaran lama. Pesen jam setengah 8 sampe hampir mau jam 10 orang udah tidur, ga bisa disambungkan langsung ke kurir. Dia nunggu di depan lama, kasian kasih akses buat chat customer nya lah, kayak gofood shopeefood gitu",0,Jam Yang Pengiriman,0.8483834266662598,1,Belanja Di Tidak,0.7641836404800415,15,Delivery Tercover Lokasi,0.7299103736877441
f093593f-7659-4a5a-b606-0ee5a249cd49,good,5,Ok Bagus Good,0.8620597124099731,27,Berat Aplikasi Secrol,0.6191372871398926,16,Lambat Mudah Sangat,0.6113147139549255
97f4adca-1ffe-46f6-af89-30964dc828a8,aplikasi yg sangat unik ..bisa belanja di antr sampai rumah dengan gratis ongkir..dan ad juga vocer potongan harga...walaupun vocernya cuman brp puluh ribu lumyan membantu🤭😁,1,Belanja Di Tidak,0.7509195804595947,19,Membantu Sangat Langsung,0.7282876968383789,17,Sangat Berbelanja Untuk,0.7153515815734863
82b72a92-22ca-4631-85c9-abd54112f0da,"ini kenapa tidak bisa masukin barang di keranjang belanja, jadi mau orde tidak bisa mohon segera perbaiki kak terimakasih",4,Kosong Gambar Produk,0.7904233932495117,6,Top Up Struk,0.7888916730880737,1,Belanja Di Tidak,0.7780478000640869
034fbe71-8b98-4ec0-9d78-4abf6d512125,"Untuk update struk yang masuk ke Alfagift nya delay, telat, contoh sekarang udah tanggal 6, yang masuk dan terdata baru yang tanggal 2, padahal saya mau liat voucher nya",1,Belanja Di Tidak,0.8410722613334656,6,Top Up Struk,0.8266182541847229,0,Jam Yang Pengiriman,0.8014971017837524
321e6664-3bd0-4c9e-8c06-d4e40150dbd8,"Setelah di update malah ke log out akun member nya !! Sedangkan mau log in lagi lupa pasword dan nomer hp yg di member hilang.. Jadi saya gabisa log in lagi, pdhl level member sudah royal, gara2 apk di update ke log out sndri !",3,Sudah Bisa Aplikasi,0.8449885845184326,2,Kenapa Bisa Buka,0.7905699610710144,20,Akun Saya Email,0.7836995720863342
80da6634-ec14-4079-a81e-3c563674fd16,Opsi max 1 jam stelah pembayaran tp dtgnya bisa lebih dari 6 jam bahkan tengah malam. Tolong di perbaiki deliverynya karena org pesan online butuh cepat.,0,Jam Yang Pengiriman,0.8456084728240967,15,Delivery Tercover Lokasi,0.7981985807418823,10,Metode Pembayaran Membatalkan,0.7892152667045593
8426e3c6-d2bc-438c-89f6-2590149015ba,"Beberapa kali pesanan saya salah dan kurang, tolong periksa lagi biar ga bulak balik atau membuat pembeli kecewa. Saya sudah WA Alfamart, mengajukan keluhan. Alhamdulillah di respon dengan baik. Barang saya yang kurang sudah digantikan. Semoga ke depannya bisa lebih baik lagi.",0,Jam Yang Pengiriman,0.8316982984542847,15,Delivery Tercover Lokasi,0.765522837638855,19,Membantu Sangat Langsung,0.7524152994155884
269dc139-12f1-4baf-8ff3-476893a63f7a,"Min, kok Nita pembelian gak masuk di Alfagift ya? Dari tanggal 1 Nove 2024 lhoh gak ada yang masuk sampe sekarang",1,Belanja Di Tidak,0.771136999130249,6,Top Up Struk,0.7757214307785034,4,Kosong Gambar Produk,0.7399985790252686
8935302c-ab59-4188-af6f-4d8ad88df2b1,"Berkali kali buat login gak bisa lagi dengan perangkat baru. Dapat link verifikasi buat login dengan perangkat baru tidak tersambung terus bahkan linknya tidak terbuka, padahal sinyal ok dan lancar. Solusinya gimana nih. Capek mau login, link verifikasi gak kebuka saat di klik",3,Sudah Bisa Aplikasi,0.8593186140060425,2,Kenapa Bisa Buka,0.819762647151947,20,Akun Saya Email,0.7888267636299133
0f657816-68f9-474c-bd13-ec673a816ca2,"Tolong lah perbaiki sistem, masa setiap mbuka harus masukan sandi baru, pas di buka g bisa terus",2,Kenapa Bisa Buka,0.8313920497894287,3,Sudah Bisa Aplikasi,0.8261042833328247,26,Gagal Selalu Pembayaran,0.7759193181991577
df6d5132-221e-48e4-8fee-3dab1ab7bfd3,"1 hari banyak belanja di Alfamart setempat, diminta nomor membernya tapi bukti belanja tidak masuk di Alfa Gift, bobrok banget Aplikasinya, Poin ndak nambah.",1,Belanja Di Tidak,0.8435187339782715,6,Top Up Struk,0.77782142162323,4,Kosong Gambar Produk,0.7489652633666992
9ea757ec-9a8f-4901-ae9d-f0722a6fd240,"Struknya kok telat masuk ya, belanja siang, udah berganti hari masih belum masuk. Mau ngecek harga jd gak bs,",1,Belanja Di Tidak,0.8236105442047119,0,Jam Yang Pengiriman,0.82087242603302,4,Kosong Gambar Produk,0.8064939975738525
ea05e3b5-a6ad-4817-9a5b-553006060e6b,"I'm not mean people, tapi menurutku ada beberapa hal yg keterlaluan. Apps wise, aplikasi alfagift baik dan tidak terlalu kompleks untuk digunakan. Yang saya ingin keluhkan itu mengenai pengantaran barang, saya pernah pesan jam 5 sore diantar jam 9.30 malam, hari ini saya pesan 10.46 dan belum sampai pesanan nya sampai sekarang (15.02). Saya sayangkan ada fitur pesan dan telpon, namun toko tidak pernah membalas, apa bila memang ada kendala mohon di konfirmasikan. Tolong diperbaiki 🙏",0,Jam Yang Pengiriman,0.8681495189666748,1,Belanja Di Tidak,0.7689177393913269,15,Delivery Tercover Lokasi,0.7672044038772583
e2fb6817-c810-4e15-95e3-69bfb867dfd8,"Sekarang alfamart tidak ada deliveri di tempatku,,, sayang sekali!!!",1,Belanja Di Tidak,0.7050542831420898,15,Delivery Tercover Lokasi,0.7308977246284485,18,Rokok Beli Bisa,0.7221145629882812
4411ec00-144b-48cd-a788-165cf641be22,"Pesen dari alfagif udah sering banget. Ini kurir yg anter bukan yg biasanya. Eh ada barang yg gak kebawa, di konfirmasi katanya madu dikirim, ditungguin sejam pertama belum dianter. Ditanya kapan dikirim, baru ngasih tau kalo produknya ditarik karna exp, ditawarin mau ganti varian lain. Terus disuruh nunggu.. Ini nunggu setengah jam dari konfirm ganti varian belum sampe2 juga... Tolong dong sebelum anter pesenan dicek dulu barangnya udah lengkap belum.",0,Jam Yang Pengiriman,0.8739040493965149,1,Belanja Di Tidak,0.7898551225662231,4,Kosong Gambar Produk,0.7438166737556458
7056ffdc-9bbf-4666-80bf-0bda69fc781d,"suka belanja disini, tapi kenapa tiba tiba pembayaran nya gak bisa di klik, udh di refresh tetep gak bisa, padahal harganya cocok, ya udh pada akhirnya saya beli di toko sebelah😞",3,Sudah Bisa Aplikasi,0.8356702327728271,1,Belanja Di Tidak,0.8478739857673645,4,Kosong Gambar Produk,0.835430920124054
404c9437-7cf9-4502-a412-eeca7246afce,"Gagal terus pas pembayaran. ,,gatau kenapa gabisa diceklist 1 pun pilihan pembayarannya",1,Belanja Di Tidak,0.7530491352081299,10,Metode Pembayaran Membatalkan,0.7465165853500366,3,Sudah Bisa Aplikasi,0.7455072402954102
4245cfaf-cb3c-4c9f-ae88-d9a888a5e3e8,Apakah ada masalah.. Tidak bisa memilih metode pembayaran.. Sudah 3x berbelanja mentok di metode pembayaran..,10,Metode Pembayaran Membatalkan,0.8217942118644714,6,Top Up Struk,0.754409670829773,1,Belanja Di Tidak,0.7434785962104797
12a1fd2a-ee83-4f4a-ae2d-ca32690af6a4,"Setelah update, metode pembayaran eror tidak bisa check out",10,Metode Pembayaran Membatalkan,0.8613758683204651,6,Top Up Struk,0.7727590799331665,13,Qris Pembayaran Tambahkan,0.7542803287506104
63767e7e-48ec-4efe-9991-2ef1791b8ce1,"Ada apa hari ini ya min, kenapa gk bisa diklik metode pembayaran",1,Belanja Di Tidak,0.7464421391487122,6,Top Up Struk,0.760810375213623,10,Metode Pembayaran Membatalkan,0.753765344619751
5929abf8-ad1c-412b-ac60-16a98c29b7b4,"Ko aku gk kebuka ya alfa gift nya , malah langsung masuk ke halaman syarat dan ketentuan loading dan kebuka",12,Sering Error Kebuka,0.6841777563095093,2,Kenapa Bisa Buka,0.7842313051223755,3,Sudah Bisa Aplikasi,0.7816705107688904
3b36d357-1093-4036-afe1-00c95b8f9023,Prosesnya cukup lama,9,Pengiriman Lama Banget,0.7094467282295227,16,Lambat Mudah Sangat,0.7267646789550781,5,Ok Bagus Good,0.6420847177505493
c030326a-0bb1-414c-96e6-bfdd5a931d6f,"aplikasi yg membingungkan manusia, liat riwayat pembelian aja pusing gatau sebelah mana, udah gitu ga langsung update padahal abis transaksi di alfa pakai member",6,Top Up Struk,0.7741891145706177,1,Belanja Di Tidak,0.819204568862915,3,Sudah Bisa Aplikasi,0.8031169772148132
1f99466a-bcdd-4451-9c91-a985f59a9ed5,Tolong ada kan metode penambahan apa yg mau dibeli atau ga pembatalan pembelian.,13,Qris Pembayaran Tambahkan,0.7882266044616699,14,Bayar Mau Kok,0.684443473815918,4,Kosong Gambar Produk,0.6842381358146667
59036643-add6-4b44-9b4d-790b70fdf6a4,aplikasi nya bagus tapi kenapa belakangan dipaksa nerima iklan dan data pribadi untuk iklan?,2,Kenapa Bisa Buka,0.7900815010070801,7,Bintang Kasih Update,0.8070300221443176,3,Sudah Bisa Aplikasi,0.7738550901412964
a1b748ce-d7d7-4efe-96b3-8dbaa5270db5,"Aplikasi nya bagus, belanja bulanan di alfamart, tolong perbaiki aplikasi nya lagi, struk nya masuk di aplikasi nya telat banget😞",2,Kenapa Bisa Buka,0.7817143797874451,1,Belanja Di Tidak,0.8292122483253479,6,Top Up Struk,0.8050525784492493
1aa0e253-c045-4522-b677-5b775fdf1889,"Hi kak, cuma mau ngasih saran ., kalau setiap ada yg beli trus pakai member, usahain itu struk di print ya .. jangan mentang"" udh masuk di aplikasi tapi struknya ga diprint.. Krna kejadian saya Pribadi, belanja di Alfa (bukan didaerah Jakarta), bilang struk masuk aplikasi dan saya ragu . Ko saya pesen sdikit tapi harganya mahal .. trnyata salah satu pesenan saya quantity nya dimasukan 2 pcs .. Biasakan double ya , print juga n masuk aplikasi juga .. biar costumer cek lagi di struk pesenanya ..",6,Top Up Struk,0.8129550218582153,1,Belanja Di Tidak,0.8580873012542725,0,Jam Yang Pengiriman,0.8476871848106384
3457540b-3625-4f53-a81d-5143d8616bb1,"Saya kasih 3 dulu baru donlod, apa ada mode gelap ? Soalnya terang banget sakit mata, apalagi mau liat menu barcode terang sekali",3,Sudah Bisa Aplikasi,0.7791767120361328,7,Bintang Kasih Update,0.7758055329322815,4,Kosong Gambar Produk,0.7489697933197021
9a9c55eb-5309-4a4d-8ac4-9c04c6d206df,Pengaturan titik lokasi tdk berfungsi. Cuma berlaku di daerah tertentu saja. Struk pembelanjaan terakhir di toko tdk langsung otomatis terbaca di aplikasi. Kadang di toko jg tdk memberikan struk fisiknya. Harus transaksi dulu baru bs terbaca struk pembelanjaan sebelumnya dan yg transaksi terbaru bs dibaca lagi kalau sdh melakukan transaksi lagi... Mohon perbaikannya🙏🏼,0,Jam Yang Pengiriman,0.7936498522758484,6,Top Up Struk,0.8088324666023254,1,Belanja Di Tidak,0.7931835651397705
1c43ae17-185a-4e20-b0a3-b4dc33f6a3f9,"Dear alfagift semoga kedepannya bisa lebih baik lagi, struk belanja nya bisa langsung masuk alfagift tanpa harus nungguin 24jam Apknya udah cukup membantu",19,Membantu Sangat Langsung,0.7652205228805542,1,Belanja Di Tidak,0.7580928206443787,17,Sangat Berbelanja Untuk,0.7444216012954712
188581a1-01c6-4040-8688-3c55ed07d328,PJadi y T,5,Ok Bagus Good,0.6865297555923462,16,Lambat Mudah Sangat,0.5946637392044067,27,Berat Aplikasi Secrol,0.5795849561691284
7cb85ff0-27c8-48df-ac22-e49caabc2068,"Apa sih alfagift skrang struk lewat apk tp lama bgt gk muncul struk nya d dftar pesanan biasa nya cepet, knpa skrang jdi lambat bgt gk bisa cek lgsung klo gtu, coba tolong segera solusi nya",6,Top Up Struk,0.8380593061447144,0,Jam Yang Pengiriman,0.862809419631958,3,Sudah Bisa Aplikasi,0.8547123670578003
0cf66428-45cd-4ae6-9154-d8eebcdc7ef8,"Alfamart kenapa ya sekarang ini tiap jam 1 siang hingga jam 4 sore tidak melakukan pembayaran tagihan, padahal dulu yang tidak bisa itu diatas jam 10 malam deh.... payah klau sama kompetitor",0,Jam Yang Pengiriman,0.7674343585968018,1,Belanja Di Tidak,0.7803313732147217,4,Kosong Gambar Produk,0.7220519781112671
bfd738e7-2a00-4bb1-842a-0ed055f9313e,Banyak stock kosong,9,Pengiriman Lama Banget,0.7373490333557129,21,Produk Gambar Sesuai,0.7070949673652649,16,Lambat Mudah Sangat,0.6926583051681519
3a35ff52-2c53-4500-b6f0-1fc3b744de16,"Min kalau sering telat gitu kirim barang, fitur buat maksimal pengiriman 1 jam setelah pembayaran buat apa. Saya pesan barang dari jam 18.55 ampe jam 23.02 belum ada🙏🏼",0,Jam Yang Pengiriman,0.8504217863082886,1,Belanja Di Tidak,0.7775673866271973,10,Metode Pembayaran Membatalkan,0.771808385848999
24dc0158-4700-45de-bc42-5b0f75c80587,"Tolong dong, pengirimannya diupgrade, status pengiriman smpe dikirim ke alamat tujuan lamanya minta ampun, dan ga jelas, saya nunggu berjam2, selalu cek pesan siapa tau si abangnya sudah di depan, dan satu lagi, tolong bilang ke kurirnya juga klo sudha di depan panggil, jngan diem aja, tau2 chat klau sudah beralih ke alamat pelanggan lain",0,Jam Yang Pengiriman,0.8626980781555176,15,Delivery Tercover Lokasi,0.7759487628936768,1,Belanja Di Tidak,0.7684145569801331
2d7adf70-9ea3-4086-be8c-814a7e7bb53b,"Hallo Admin masukan Alfamart ini kerjasama dengan bank walet ovo dana dll tapi macam tak niat aja ibaratnya setengah hati. Masak gara"" ceng sif aja mau tarik tunai katanya g ada uang emang sebelum ceng sif apa uangnya habis kerjasama kok gitu takut g dibayar sama ovo/dana ya menyusahkan pelanggan aja ni Alfa satu lagi poin transaksi itu berlaku berapa lama kl ada sistem hangus rugi dong??🤦‍♂️🤦‍♂️🤦‍♂️",0,Jam Yang Pengiriman,0.7830716371536255,1,Belanja Di Tidak,0.787312388420105,3,Sudah Bisa Aplikasi,0.7232353687286377
4556cb9a-b60c-4b2c-9e6f-15e0370241c1,"Bagus, cuma sayangnya ga bisa cepet aja. Jd klo urgent better aplikasi lain",7,Bintang Kasih Update,0.8040350675582886,3,Sudah Bisa Aplikasi,0.7597296237945557,24,Ngelag Bagus Cuma,0.7452832460403442
