reviewId,content,topic_id,topic_name,main_topic_prob,alt_topic_1,alt_topic_1_name,alt_topic_1_prob,alt_topic_2,alt_topic_2_name,alt_topic_2_prob
644d0179-4d0e-4c36-9c0b-782f70096b49,Jangan pakai apk ini kalo gak mau duitmu tertahan di HALODOC,5,Saldo Halodoc Transaksi,0.6628255844116211,29,Enak Brobat Ribet,0.6268763542175293,24,Halodoc Tb2 Upgrade,0.6054864525794983
94162d57-960b-4a8d-88b4-309783a97e6b,Apk in sangat tidak berguna. Lagi darurat mau tanya dokter. Sudah pembayaran buat chat dokternya juga malah ketrangan dokternya sibuk. Uangnya udah ke tarik lagi.,6,Sibuk Dokternya Kepotong,0.8344767689704895,27,Gara Tanggung Penipu,0.8867408633232117,107,Chatnya Bayar Chat,0.8840070962905884
4ab49858-dc81-490f-8dab-20993ff22769,"Sudah konsul kata nya mau di beri resep sampai waktu abis tapi resep tidak dikirim, sudah lapor admin halodoc sampai ke email juga tidak dapat resep nya. 24jam nunggu hangus sudah uang konsul ku tapi resep obat tidak dapat🥲",62,24Jam Apotik Kerjasama,0.8136262893676758,20,Telp Email Jam,0.8819390535354614,73,Lenyap Gosennya Sampai,0.8554960489273071
f709a579-d349-43f1-9bbe-a17744fb7450,"Ga jelas, alamat tidak sesuai dan tidak ada tertera. Padahal lagi genting malam"" butuh obat",95,Malam Pesenan Minggu,0.7871402502059937,9,Sekali Respon Bayar,0.77166748046875,117,Karawang Alamatnya Bekasi,0.771428108215332
32684176-2112-44ac-91ea-56124bc84d83,Terlalu mahal harganya untuk chat konsultasi,101,Harganya Jual 5Rb,0.6786423921585083,66,Mahal Harga Meninggal,0.6982017755508423,113,Berbayar Cacad Batas,0.6961418986320496
50d05006-8e9a-4fdf-a4f6-13d02ed4a215,semua orng butuh solusi jika tidak ad uang ataupun lg skt tdk bsa kmn2 klo iklas bantu ya bantu ya jngn ber tarif,7,Psikolog Siah Memang,0.7377616167068481,87,Ojek Efektif Depok,0.6859663128852844,119,Diubah Sehari Ha,0.6748911142349243
51c21b1c-ea2e-41d5-b2c6-77f04ae3af68,"Ada kendala aplikasi tapi ga ada solusi,",35,Force Bug Close,0.7997229695320129,1,Otp Login Kalender,0.7584925293922424,100,Lwat Juni Janji,0.7402068376541138
5a176cfd-b08f-4ae8-b87d-4bd0bc32af0c,"tolong dong, aplikasi kesehatan tapi utk pembayarannumya ribeeet minta ampun, gojek susah ngelink, ga semua org punya dana dan linkaja, apasalahnya bisa transfer bank/ m banking..",8,Metode Pembayaran Transfer,0.8425643444061279,50,Nomer Orang Susah,0.8197053670883179,36,Doktr Kartu Kok,0.8185603618621826
625bc9cd-b3f5-4cb4-96a6-b20a167f2614,"Dokternya lambat respon, kacau",3,Waktu Kurang Buru,0.8034543991088867,32,Balas Slow Respon,0.7688908576965332,47,Pengantaran Alur Bermitra,0.7383713722229004
4620e19a-4c4f-4845-9d3d-fdb6effc8d40,"Ampun deh, masa abis transaksi bayar sekian buat konsul dokter gabisa buat chat rugi saya dong udah bayar gabisa konsul apalagi chat, malah suruh transaksi lagi kalau mau chat dokter gimana deh ya Allah. Tlong di maintenance dong walaupun dokter yg dipilih sibuk diupayakan ganti lain yg setara tp gabayar lagi saya udah jadi pengguna lama loh sama halodoc tp saat ini bikin kecewa",113,Berbayar Cacad Batas,0.7695341110229492,21,Konsulnya Puas Sih,0.90135657787323,7,Psikolog Siah Memang,0.8955492973327637
da773e79-2ef2-4c59-9686-6c28b68b226e,"Obat saya sudah dibayar lunas sampai hari ini 10 hari belum sampai, secara sepihak pihak jasa kirim melakukan retur, gak ngerti saya apa maunya .. CS juga slow respon, mintak alamat berkali kali tapi gak kasih kabar perkembangan paket obat saya sudah sampe mana...",31,Kurir Diterima Pesanan,0.9205238819122314,73,Lenyap Gosennya Sampai,0.9105831980705261,45,Admin Very Menerus,0.889533281326294
f0d83ddf-5d6b-463b-94e8-62e5158dc7ca,"Obat sering tidak ada di apotek, harga obat selalu ada selisih. Dan selalu nombokin",25,Tersedia Diresepkan Antibiotik,0.7531805038452148,54,Resep Tulis Apotekernya,0.7252099514007568,101,Harganya Jual 5Rb,0.7119657397270203
526ef323-4981-4298-9789-a1713761ebd6,Sorry ya disini saya bayar tapi sistem nya bikin dongkol lola sedangkan dokter nya gercep tapi nyampe kesini nya lama dan BANYAK CHAT YANG TIDAK MASUK KE SAYA UNTUNG DOKTER NYA SCREENSOOT JADI SAYA TAU YANG SALAH APLIKASINYA !!,0,Saya Sesi Selesai,0.8643711805343628,107,Chatnya Bayar Chat,0.8687163591384888,61,Tiba Koneksi Ulang,0.8418961763381958
79d82df8-d995-4adc-bde4-b4a243fc4900,Lama prosesnya,40,Ruwet Ribet Ngelag,0.7892388105392456,18,Hilda Errorrrrrrrrr Pehhh,0.7184768319129944,2,Bad Artis Buruk,0.7016637325286865
b311730c-4dbb-46c9-b998-aaa225c00506,"Aplikasi sampah mbayar 50,aja di tambah 1ribu",94,Ktp 50 Dikasih,0.6685142517089844,103,Ribet Ribu Stanby,0.6779003143310547,42,Macam Tolol Aplikasi,0.672785222530365
06887a3f-82e5-4256-baa9-1e2f4bf9d2c0,"dibanding minta maaf lebih baik berkilah ""kalau nanti ada kejadian seperti ini lagi"" blablablablabla. Kenapa ga pihak halodocnya aja yang evaluasi sistem?, kenapa harus pasien yang evaluasi juga?. bukannya egois gamau ya, saya sampe rendah hati mikir ""mungkin salah saya kurang teliti"", saya lunasin tuh tagihan yang bukan kesalahan saya karna kesalahan profile katanya. malah kaya begitu responnya.",7,Psikolog Siah Memang,0.8662859201431274,84,Kalian Md Annissa,0.8636623024940491,74,Bilang Mereka Gelarnya,0.8539415597915649
8338a0cb-96f4-4c07-8773-126f2d891da3,JANGAN PERNAH DONLOD APK INI.. PENIPUAN,29,Enak Brobat Ribet,0.6825597882270813,35,Force Bug Close,0.6014201045036316,59,Iklan Tipu Promo,0.5772771835327148
2c67863f-5ab6-4d19-8e68-d045bb6e0160,"Bikin hape gua rusak, ngelag melulu.",92,Versi Terbaru Handphone,0.7677026391029358,53,Kagak Doang Cerita,0.7566897869110107,19,Error Mulu Apalah,0.6936733722686768
de1d714e-889c-43fd-8a8e-6e5a2102b3c8,"apaan dah, dokternya slow respon padahal kan itu make waktu ya, buang2 uang aja baru 11 menit dri 30 menit dokternya udh hilang, tidak menyelesaikan masalah malah ngegantung",38,Sia Dpet Pemyakit,0.8931179046630859,60,Balesnya Kebuang Obgyn,0.8718441128730774,21,Konsulnya Puas Sih,0.8695563077926636
e116d42c-78fd-4760-9376-6d09fa802b36,Sangat tidak membantu hanya konsultasi saja harus bayar,99,Jerawat Bekas Kulit,0.8643796443939209,3,Waktu Kurang Buru,0.7627960443496704,22,Responsif Platform Segel,0.7540445327758789
5a611b2f-c99e-4c0a-bb19-1fb6f6b6bd76,Tidak solutif tdk bs kirim foto susah jdna untuk konsultasi aplikasi rusak,34,Buang Janji Doang,0.7751328945159912,88,Cat Riwayat Top,0.8107425570487976,119,Diubah Sehari Ha,0.8079546689987183
89149b8c-3120-4b8f-a4af-95f9b6c8c070,"apotik udah tutup dikasih orderan, tim survei lapangan nya ga update. masa nunggu report dari pembeli",115,Pick Status Lapor,0.84142005443573,70,Customer Box Informasi,0.7852151393890381,14,Jasa Pengiriman Jam,0.7666549682617188
a4fc838a-9716-4b89-8c95-a23f917249d0,Untuk metode pembayaran pilihannya sgt sedikit gaada metode tf bank. Gaada juga pikihan top up saldo kayak dulu. Tolong untuk diupdate lagi aplikasinya,8,Metode Pembayaran Transfer,0.8342887759208679,44,Hp Ngeblank Pembaruan,0.7337332963943481,36,Doktr Kartu Kok,0.7264273166656494
285ef73b-c2c1-4330-b2f5-9be1e1f6c7f3,Pembayaran untuk konsultasi jdi doube,113,Berbayar Cacad Batas,0.7641221284866333,103,Ribet Ribu Stanby,0.6670534610748291,72,Berbayar Bayarrr Ansuransi,0.6585677862167358
ef2ef1c9-35ff-43c8-8c56-f0bfd9e6d308,"paket salep order dri tanggal 5 smpai sekrang gak ada kejelasan, di email katanya mau di tindak lanjuti smpai skrng gak ada kejelasan😏tipe pengiriman reguler dengan estimasi paket sampai 9 januari. tali di email katanya 19 januari sejak kapan reguler berubah jdi ekonomi🫤",26,Tanggal Paket Reguler,0.8648995161056519,31,Kurir Diterima Pesanan,0.8120134472846985,14,Jasa Pengiriman Jam,0.7988544702529907
f0249c2d-138d-4fec-81b2-84bd14717947,beberapa ada dokter yang menjawab seadanya saja tidak mendengarkan lebih dalam keluhan pasien sudah dua kali spt ini.. pertama dokter psikolog yg kedua dokter spesialis,82,Sebelah Sesi Client,0.8106182813644409,109,Tht Spesialis Berapa,0.7712644338607788,118,Google Anak Jawabannya,0.7449507117271423
d1d6c678-1533-492a-b2f4-5a954f916dbe,Sering bug,2,Bad Artis Buruk,0.8258849382400513,18,Hilda Errorrrrrrrrr Pehhh,0.7879109382629395,12,Mantap Bagus Memuaskan,0.7170203328132629
43d400d5-5919-42a1-a715-aabb5a57663b,HaIodoc: D,2,Bad Artis Buruk,0.7525300979614258,18,Hilda Errorrrrrrrrr Pehhh,0.6309316158294678,12,Mantap Bagus Memuaskan,0.5932011008262634
5a743fb3-b5db-40ea-866b-6a38bb63a1ac,Udah bayar dokter tapi nga bisa konsul. Gimana tuh tolong dong aplikasinya rugiin orang lain aja,58,Sibuk Bayar Dibatalkan,0.8410026431083679,90,Bidan Aneh Penyakit,0.8451057076454163,7,Psikolog Siah Memang,0.8279008865356445
11767c12-e1be-4cf2-b7a5-ff46dd075b44,"siang Dok,ni sy mau konsultasi dgn Dok,ibu sy telat haid,ada obat buat mencarkan kembali haid nya ga ya,Trims",4,Saya Paket Pesan,0.730454683303833,96,Cht Tolong Sruh,0.7177298665046692,17,Surat Periksa Cek,0.7169194221496582
80b52ff4-f2a3-4164-86a6-94b208339e3b,"kecewa sama dokter yang kaya robot, ngasih respon chat hanya pakai pesan otomatis, seharusnya kasih kesempatan tanya jawab.",16,Gua Gimik Kayak,0.8035304546356201,90,Bidan Aneh Penyakit,0.7858962416648865,32,Balas Slow Respon,0.7784987688064575
78009a6e-997e-41bb-9d0a-75961faaef1b,"Udah bayar, tp ga bisa terhubung sama doker yg di tuju alesanya sibuk, pas cari dokter lain ga bisa jg alesanya pd sibuk semua, tau tau keluar room sendiri, pas mau nyari dokter lg malah suruh bayar lagi, anjir penipuan",58,Sibuk Bayar Dibatalkan,0.8357445001602173,116,Ganti Disuru Sibuk,0.8482401371002197,48,Lain Dokternyaa Cari,0.8392511606216431
2086a293-9d7f-4ab6-b075-063f63ea1687,"Kecewaaaa konsul cuman sebentar nggk sampe 15 menit juga padahal hrusnya 45menit,itupun di kasih jawabannya yg di copy aja tinggl kirim kecewa pokonya.",60,Balesnya Kebuang Obgyn,0.8744333982467651,21,Konsulnya Puas Sih,0.831692099571228,38,Sia Dpet Pemyakit,0.8239873051643372
e90dcca6-cb41-4ea0-a90f-9256db382ae5,"ini beneran gak sih kecewa banget, udah pesen obat udah bayar malah servernya hilang.",85,Kapok Muntah Banget,0.928035318851471,95,Malam Pesenan Minggu,0.8507363796234131,51,Dibatalin Drivernya Dihapus,0.8472974896430969
8b2523a6-983f-455b-8566-69e143db4a4d,Aplikasi sering error tolong di benahi... Hampir setiap mau cekout obat tiba-tiba hang/error,11,Hp Hang Error,0.8777859210968018,10,Device Loading Berat,0.8170311450958252,1,Otp Login Kalender,0.8159136772155762
e8e20636-5630-40a5-b3b1-8c1af13c487d,"Kalau buat apk yg jujur dong, di iklannya murah banget cat dokternya, saya tertarik karena saya lihat murah la di kantong pelajar, saya mau konsultasi tentang kesehatan mental saya, eh gak jadi mahal banget saya gak mampu apalagi saya yang masih minta uang ke ortu, sebenarnya biasa aja sih mintanya cuma saya ragu kalau bicara ke ortu, intinya ini apk beda sama iklannya di iklan murah banget tapi di apk 😔🙏🏻🙂",7,Psikolog Siah Memang,0.8954801559448242,74,Bilang Mereka Gelarnya,0.8885959982872009,56,Kasih Kupon Mata,0.852039635181427
40946de4-a8c3-467f-a780-d8684a33dbff,"Saya pakai ini, tapi baru kali ini kecewa karena obatnya ga tersedia di kota saya. Untuk dokter bisa tolong merekomendasikan obat sesuai ketersediaan obat di lokasi pasien. Sudah sakit obat tidak tersedia kan kesal. Mana klo Konsul lagi bayar lagi. Hmmm..",25,Tersedia Diresepkan Antibiotik,0.9063079357147217,52,Produk Toko Dibeli,0.8740121126174927,62,24Jam Apotik Kerjasama,0.8703011274337769
924118f0-e03d-476a-99fc-9e5c8144f639,"Kenapa sekarang setiap buka aplikasi halodoc HP jadi hang? Bukan cuma nggak bisa pake aplikasinya, HP jadi freeze dan nggak ada jalan lain kecuali harus di restart.",11,Hp Hang Error,0.854830265045166,10,Device Loading Berat,0.8391062617301941,1,Otp Login Kalender,0.8243194818496704
42eea108-9e9e-4dd5-9ef6-e609b82516a9,"Makin lama malah semakin nggak jelas... Dana sudah kepotong namun obat nggak kunjung dikirim,sudah komplain kesana kemari...namun obat nggak aku dapatkan,uang jg nggak kembali...kemana LG aku harus mengadu...",30,Berhari2 Segala Tebus,0.7463960647583008,98,Pengembalian Dana Jalan,0.7810224294662476,73,Lenyap Gosennya Sampai,0.7789645195007324
caaa3270-6c37-443c-baa3-e3e73da554a4,Fitur chat dokter udah bayar dan masuk ke roomchat buat konsultasi keluhan tapi g ada balasan dan jawaban dari dokternya sedangkan udah bayar itu gimana admin?,107,Chatnya Bayar Chat,0.8867517113685608,61,Tiba Koneksi Ulang,0.8431071043014526,20,Telp Email Jam,0.8294416666030884
f709eba1-a81c-42cf-ba41-9d3cc238b9f8,Masa saya mau tebus obat pakai resep halodoc di shopee tp penjualnya gak mau proses krn mesti lewat platform ini. Masalahnya sy lokasinya jauh ada di pulau. Yagimana mau beli obat ini.. hadeh,22,Responsif Platform Segel,0.806255578994751,13,Lokasi Apotek Kota,0.8435388803482056,83,Hati Cepat Beli,0.8400558233261108
1ae423d9-7c8e-4f03-acc0-fed60e19f6ed,gk jelas gk bisa buat janji,34,Buang Janji Doang,0.6662582159042358,78,Buang2 Duit Responnya,0.7217990159988403,37,Log Menyambungkan Dipakai,0.7054632306098938
cbf70bfc-1adf-4fb6-8af2-41f52f609025,"Udah di bayar, malah dokternya gk bisa konsultasi, halodog",6,Sibuk Dokternya Kepotong,0.8594656586647034,17,Surat Periksa Cek,0.8539476990699768,65,Offline Online Ulang,0.8503265976905823
fada5e8b-19b5-49f3-b4ef-459ee3251056,"Ngabisin uang aja, konsultasi bentar doang kyk gk konsultasi",16,Gua Gimik Kayak,0.771589994430542,38,Sia Dpet Pemyakit,0.7621557712554932,53,Kagak Doang Cerita,0.7597154378890991
3bfd088a-fd9b-4259-a888-4def3c27f3e4,"Revisi ulasan yang keempat : Eh buset pesan obat harus nunggu 13 hari, pengiriman dr Bandung dg tujuan Majalengka. Ekspedisinya pakai sice***",111,Ekspedisinya Sice Majalengka,0.8900444507598877,15,Instan Pengiriman Hari,0.795857846736908,108,Instan Pengiriman Apotek,0.7945652008056641
a5867515-1c09-4f2a-a45e-52e7cc7fe0c9,"Aduhh gg yak ni halodoc cacat, saya mau konsultasi malah rugi saldo dana kepotong tapi ga bisa konsultasi, mana ga dikembaliin lagi hehe. Padahal salah dokternya yak kalo sibuk mah semua juga sibuk, keterangan nya disitu dokter sibuk silahkan chat dokter lain, gimana mau chat dokter lain dah kalo bayar lagi, rugi saya, mamam tu bintang satu.",7,Psikolog Siah Memang,0.9150956869125366,21,Konsulnya Puas Sih,0.8931214809417725,74,Bilang Mereka Gelarnya,0.8920029997825623
ca13ef38-3ecf-4e2f-904f-baa1d009708f,lama dan ribet,40,Ruwet Ribet Ngelag,0.8740347623825073,18,Hilda Errorrrrrrrrr Pehhh,0.7270851731300354,12,Mantap Bagus Memuaskan,0.7086004018783569
6d9f4705-ae82-4388-8487-e0ef9d4e7098,Masa saya sudah bayar terus dikasih tau nya tidak bisa karna dokter sibuk. Lah pas saya belum bayar katanya ga sibuk gmna sih ini halodok. Saya mau uang saya dikembalikan!!!!! Saya laporkan nanti,58,Sibuk Bayar Dibatalkan,0.9162227511405945,116,Ganti Disuru Sibuk,0.9122621417045593,0,Saya Sesi Selesai,0.8721341490745544
dbfa0118-40f1-4532-8c79-e2f111fb965d,Pehhh,18,Hilda Errorrrrrrrrr Pehhh,0.8436869978904724,2,Bad Artis Buruk,0.7466735243797302,40,Ruwet Ribet Ngelag,0.6494277715682983
3466ee02-95d3-4181-bf5a-4a53e6aff433,Ngga bisa menggunakan kartu asuransi di halodoc dan ngga ada sla penyelesaian permasalahan diatas,36,Doktr Kartu Kok,0.6640306711196899,5,Saldo Halodoc Transaksi,0.689332127571106,8,Metode Pembayaran Transfer,0.6303507089614868
6d71cb68-bab9-4ee0-9b95-7a5aa2df7b4f,"Saya pesen obat udh 3 jam gk dtg2, pdhl pake yg instan... di btalin jugaa gk bs, mau komplain ribet bgt....",22,Responsif Platform Segel,0.8932964205741882,95,Malam Pesenan Minggu,0.8707897663116455,30,Berhari2 Segala Tebus,0.8625591993331909
ef89aa9e-1000-4327-b762-155ce030fc56,"saldo terpotong, dokter sibuk, da belum dikembalikan",6,Sibuk Dokternya Kepotong,0.7697974443435669,43,Refund Aneh Giliran,0.7356010675430298,72,Berbayar Bayarrr Ansuransi,0.7225388288497925
661aa402-dba1-4179-b9b1-50ad53f82107,"Kecewa sih, padahal saya search dokter sp.Gk tapi dokter Sp.A juga ikut muncul di list. Akhirnya saya salah pilih dokter dan ngga bisa konsul,melayang gitu aja uang saya😭😭😭😭",97,Sapa Kecantikan Kadang,0.8818296194076538,0,Saya Sesi Selesai,0.82723069190979,17,Surat Periksa Cek,0.8190407752990723
1edf2549-432a-41d4-95b1-3ae01d94869a,"Apakah memang ada batasan waktu ya pas konsultasi? Tadi saya tinggal chatnya ga sampe satu jam belum saya bales balik, tapi sm dokternya udh dianggap selesai, uang saya sia sia.",0,Saya Sesi Selesai,0.8692156076431274,60,Balesnya Kebuang Obgyn,0.8614784479141235,58,Sibuk Bayar Dibatalkan,0.8593672513961792
141fb4d3-6891-40ab-b0d5-af9f552bfc00,"nyesel pesan obat dari aplikasi halodoc, ternyata lama banget pengirimannya. aku kira bakal direkomendasikan apotek terdekat, gak tahunya malah dari luar pulau. kalau daerah Kalimantan Selatan perkiraan aku bakal dikirim dari Banjarmasin, ternyata malah dari Surabaya. obat sudah ditunggu, sampai hari ini belum sampai juga.",46,Oktober Paket Pengiriman,0.8812931180000305,108,Instan Pengiriman Apotek,0.8460832834243774,14,Jasa Pengiriman Jam,0.8161070942878723
e14ad2a7-af91-4a0a-8055-254dedd0b6ee,"gua ngerelain duit makan gua buat konsul ke psikolog biar gua tenang, tapi malah dicuekin. lu makan noh duit haram",16,Gua Gimik Kayak,0.7634895443916321,53,Kagak Doang Cerita,0.7245302200317383,6,Sibuk Dokternya Kepotong,0.6700296998023987
3cdcc19f-27f8-467d-a04b-d2fc8d84a120,Aplikasinya tidak responsif. Lemot,22,Responsif Platform Segel,0.5904519557952881,12,Mantap Bagus Memuaskan,0.7401952743530273,40,Ruwet Ribet Ngelag,0.7140744924545288
c8a915b4-93e1-4fe0-ae73-a3c83cd8ceb6,Setelah di update malah error pada saat klik pembayaran beli obat.. Sudah dua kali ganti dokter dengan resep sama saja error. Buang waktu dan mengurangi platform assuransi.,22,Responsif Platform Segel,0.8485203981399536,27,Gara Tanggung Penipu,0.8203149437904358,65,Offline Online Ulang,0.8134293556213379
1abce395-705a-4c28-9ad9-89268c91df99,"Semenjak tidak ada driver borzo di apotik halomedika jadi lelet pengiriman, borzo driver terbaik",77,Nebus Borzo Cxl,0.7823468446731567,54,Resep Tulis Apotekernya,0.7156174182891846,22,Responsif Platform Segel,0.7154240608215332
d2996927-326e-4e42-8035-9cc477d79262,"Mohon dong pihak halodoc untuk pemesanan obat instan saya, atas nama milly dikirim sesuai waktu yg di perkirakan, KALO GA BISA YAA KEMBALIIN UANG SAYA!!! JGN ASAL HUBUNGI CS LO PIKIR TUH UANG DAUN PELAYANAN BURUK!",55,Min Kosong Konsumen,0.8799046874046326,14,Jasa Pengiriman Jam,0.8254777789115906,83,Hati Cepat Beli,0.8190392255783081
3b7b62ec-8ea8-459a-b07c-2820f84663aa,"Setiap mau beli obat tiba tiba halaman nya gabisa di pencet , aneh banget nih aplikasi",10,Device Loading Berat,0.7897824048995972,29,Enak Brobat Ribet,0.7484859824180603,11,Hp Hang Error,0.7466732263565063
cf4a6abf-2aa7-4784-b53d-642e73981201,Aplikasi aneh masa batalin pesanan Dana baliknya nyampe 14 hari gila bener Aplikasi macam apa ini,42,Macam Tolol Aplikasi,0.8344380855560303,29,Enak Brobat Ribet,0.7790598273277283,5,Saldo Halodoc Transaksi,0.7491550445556641
0a770c14-0db6-4d50-a317-1546f9d09d22,"Tidak bisa melakukan pembelian obat, aplikasi hanya loading di laman pembayaran, aneh banget ya",107,Chatnya Bayar Chat,0.7990308403968811,29,Enak Brobat Ribet,0.8280881643295288,5,Saldo Halodoc Transaksi,0.8126692175865173
d816f1f9-9ce7-49ab-93be-ad76dfdf6f44,Buruk.. pengiriman terlalu lamaaaa.. app lain sehari bisa sampai. Disuruh jangan stress appnya bikin orang stress,119,Diubah Sehari Ha,0.8445994853973389,42,Macam Tolol Aplikasi,0.798180103302002,50,Nomer Orang Susah,0.7729774713516235
4f84f1ff-a73f-4bcc-9fa3-58758fa3f960,"sangat tidak membantu. saya konsul spesialis kulit 3x bukannya jerawat sembuh malah tambah parah dan banyak. haduh, saya bayar ini bukan gratis",99,Jerawat Bekas Kulit,0.8765711784362793,97,Sapa Kecantikan Kadang,0.796825647354126,34,Buang Janji Doang,0.7734363675117493
63e17deb-e97a-4b9b-b661-f90d1714dece,Di upgrade aplikasi bukannya makin bagus makin lemot mau pembayaran aja loading mulu sampe gak bisa bayar,10,Device Loading Berat,0.8675704002380371,119,Diubah Sehari Ha,0.8321754932403564,92,Versi Terbaru Handphone,0.8264447450637817
e332f76f-5f13-404e-808f-fed7a275a902,"Apk sampah., lelet , cs tolol, buat yg baru download apk ini susah, saya malah udh verifikasi data , awas data saya di salah gunakan ya. 3 hari ngulik2 pusat bantuan pun gak guna . Di email balasan nya gak nyambung. 👎👎👎👎👎👎👎👎👎",68,Manual Alamat Secara,0.8304693102836609,10,Device Loading Berat,0.8494346141815186,119,Diubah Sehari Ha,0.8378607034683228
956928bb-8706-4602-beb7-2579ce4512b3,"Aplikasi tidak cocok dengan tipe handphone saya. Bikin hp error. Niatnya nyari solusi malah jadi emosi gara2 aplikasi. Mohon diperbaiki, sakit saya keburu basi kalau error mulu gini",92,Versi Terbaru Handphone,0.8613709807395935,10,Device Loading Berat,0.8429775238037109,11,Hp Hang Error,0.8416756391525269
83bc9b5e-1261-49d0-abcd-5faa835e5c11,"Mau beli obat lagi butuh banget pas mau checkout malah loading terus, sinyal aman, hp anti lelet, mungkin aplikasinya?",10,Device Loading Berat,0.8659179210662842,50,Nomer Orang Susah,0.8368507623672485,119,Diubah Sehari Ha,0.8308466672897339
1a0acf3c-bc34-4586-98ec-6ad94d0b83f7,Tipu tipu lah... Dapat voucher khusus mitra tapi ga bisa di pakai. 👎,59,Iklan Tipu Promo,0.8394030332565308,79,Promo Voucher Berlaku,0.762144148349762,103,Ribet Ribu Stanby,0.7411898970603943
389626d8-b8cb-41bf-a8f2-91c9bf97d8c9,"Psikolognya lebih mahal drpd aplikasi sebelah. Pun jg solusi kurang membantu kyk curhat sm temen :"")",82,Sebelah Sesi Client,0.782596230506897,66,Mahal Harga Meninggal,0.7752663493156433,29,Enak Brobat Ribet,0.7619181871414185
149f6c8e-bab5-4acd-b84c-b181d5373f81,NOT RECOMENDED . Pertama kali nya download aplikasi halodoc ini cuma untuk beli minyak telon murah pakai kupon .sampai rela rebutan kupon sama banyak org ternyata pesanan saya dibatalkan seenak jidat .nyesek banget njiiirrr,56,Kasih Kupon Mata,0.7927632331848145,24,Halodoc Tb2 Upgrade,0.7929983139038086,50,Nomer Orang Susah,0.7744413614273071
aad88f4a-5977-4fff-a90e-c92df6250b91,Aplikasi lelett bgtt error teruss pas konsultasi!! Padahal waktuny cm 30 menit buat loadinh doang nunggu jwban dah lebih dr 20menit! Belum lg dojternya lama jelasinya! Habisin duit mulu! Rempong bgt penbayarannya hrs konek apk lain. Ngisi saldo halodocny pun gbisa. Heran.,50,Nomer Orang Susah,0.8907994627952576,27,Gara Tanggung Penipu,0.8431108593940735,39,Berasa Lama Rembuestment,0.8272448778152466
647579bb-4d6a-47eb-822c-9bd95df54371,"Halo dok,tolong d perbaiki aplikasinya..cz kl mengiriman instan hrsnya bisa pilih apotik terdekatnya..jangan kejauhan dan hrs sesuai titik maps nya.thx",13,Lokasi Apotek Kota,0.8104753494262695,117,Karawang Alamatnya Bekasi,0.7795423269271851,96,Cht Tolong Sruh,0.7613915801048279
5d9b1edb-97f9-47cb-9503-888f757ac102,Tiap berobat selalu tidak ada obat yg lengkap. Akhirnya tebus sendiri ke apotek. Kesel kerja 2 kali.,30,Berhari2 Segala Tebus,0.8020588159561157,25,Tersedia Diresepkan Antibiotik,0.768553614616394,22,Responsif Platform Segel,0.7678447961807251
8f8d51f1-bfed-4ce3-874d-3aba68ef007e,"Ngga jelas banget tiba-tiba dibatalin,mana ngga ada alasan pembatalannya lagi.Kalo seumpama dibatalin karena stok kosong kan harusnya ngga usah ditampilin dietalase dari awal,lah ini tiba-tiba main dibatalin aja,padahal udah ada keterangan diambil kurir",51,Dibatalin Drivernya Dihapus,0.8453567028045654,57,Marah Reguler Ekspedisi,0.8107300996780396,23,Driver Gosend Korlap,0.7868526577949524
26a7b3d0-3a94-44ad-9a42-ae99d7a0e165,Mau pesen obat loading terus ga bisa bisa payment,10,Device Loading Berat,0.7315002679824829,1,Otp Login Kalender,0.7675644159317017,22,Responsif Platform Segel,0.7486890554428101
258a7102-982f-4747-bedd-26a801943c23,"Super duper lelet, saya pesan obat dari jam 9kurang sampek jam 12siang blm di antar, padahal pilih instan yg 1jam ongkir lebih mahal tp sama saja penanganan nya lelet . Tidak ada filter utk masalah tsb, di pukul rata pengiriman nya. Klinada bintang 0 sudah bintang 0 ajah !!!",14,Jasa Pengiriman Jam,0.8855029344558716,73,Lenyap Gosennya Sampai,0.8632218241691589,20,Telp Email Jam,0.855111837387085
210fe5a9-f49c-4973-b9f5-6e6a5df6c960,Perbaiki sistemnya lag terus,19,Error Mulu Apalah,0.800998330116272,40,Ruwet Ribet Ngelag,0.7166483402252197,110,Akurat Bosok Busuj,0.6690154075622559
2b6a6dc8-a408-4bdc-a31d-396deb9cecf9,Katanya gratis kok berbayar,33,Gratis Kira Iklan,0.8403045535087585,78,Buang2 Duit Responnya,0.7534045577049255,40,Ruwet Ribet Ngelag,0.7305423617362976
69663dd8-8542-4878-ba6c-2cf46a0ae8bd,Rzz itu tidak o,12,Mantap Bagus Memuaskan,0.7117571830749512,40,Ruwet Ribet Ngelag,0.6578938961029053,2,Bad Artis Buruk,0.6522516012191772
488965de-97ba-410b-b5cb-f5496afd1052,"Udah 2 kali konsuk disini ga dpt solusi sia sia , malah disuruh dtg lgs ke dokter dan tatap muka kalo kaya gitu mending dari awal ga usah ke halodoc",109,Tht Spesialis Berapa,0.8773200511932373,24,Halodoc Tb2 Upgrade,0.8384042978286743,30,Berhari2 Segala Tebus,0.8321277499198914
166d2126-2aa2-4eda-8f71-c19fb00a1af9,Kurang jelas jwaban yg di berikan meskipun SDH panjang lebar dan di sertai hasil agar bisa di jlskan malah dapat jwaban kurang jelas .. Apa yg harus di hindari Apa yg bole di konsumsi ternyta hnya 1 smpaai 5 Kata saja di balas,91,Like Dislike Jwaban,0.8199021220207214,0,Saya Sesi Selesai,0.6791592836380005,87,Ojek Efektif Depok,0.678899884223938
aaa353df-cc29-4c00-b737-2e19249a0ce7,"67,rpepo&&'_ j it⅚9u l6,k 33 ya p",2,Bad Artis Buruk,0.507205605506897,110,Akurat Bosok Busuj,0.5195883512496948,78,Buang2 Duit Responnya,0.48983234167099
