reviewId,content,topic_id,topic_name,main_topic_prob,alt_topic_1,alt_topic_1_name,alt_topic_1_prob,alt_topic_2,alt_topic_2_name,alt_topic_2_prob
b7072dd8-f17c-4766-920f-52b7f5e7e405,"PENIPUAN!! PESAN OBAT BUAT SI KECIL YANG LAGI SAKIT, SUDAH TUNGGU KURANG LEBIH 1 JAM DI KETERANGAN SEDANG DI ANTAR KE TUJUAN DAN KETIKA DILIHAT KEMBALI STATUS PESANANNYA SUDAH SELESAI DAN TELAH DITERIMA PADAHAL DARI TADI NUNGGUIN PESANAN OBATNYA DAN TIDAK ADA YG MENGAMBIL PESANAN OBATNYA.",31,Kurir Diterima Pesanan,0.8956343531608582,4,Saya Paket Pesan,0.8548579812049866,73,Lenyap Gosennya Sampai,0.8521468639373779
a05c5fc6-1e12-4857-bbfa-b35c48a02537,pesan saya sangat lama diantar bahkan sampai saya sudah tidak tinggal di lokasi pengiriman,26,Tanggal Paket Reguler,0.8003631830215454,95,Malam Pesenan Minggu,0.7816034555435181,31,Kurir Diterima Pesanan,0.7598066926002502
adb93a63-5fce-45fc-b9d9-b6a7761adca5,Mau beli obat aja ribet!!!,94,Ktp 50 Dikasih,0.8066462278366089,103,Ribet Ribu Stanby,0.764248251914978,90,Bidan Aneh Penyakit,0.7323729395866394
c36b1517-dab4-4b93-97f7-8709bf2133df,aplikasi buruk,2,Bad Artis Buruk,0.8845421671867371,12,Mantap Bagus Memuaskan,0.7882016897201538,18,Hilda Errorrrrrrrrr Pehhh,0.7513418793678284
d942b7a0-c800-4723-b3c2-f71d894c8774,"duit haram dimakan! customer ga jadi make jasa dokter dana gabisa refund/reschedule! ga ikhlas sumpah, ditanyain cs malah gada respon bagus, sebelum pembayaran hanya tertera poin ""DANAMU AKAN DIKEMBALIKAN jika dokter membatalkan atau tidak hadir ke konsultasi mu"" gada tulisan danamu tidak bisa dikembalikan jika kamu telat. cs ngasih s&k yang ada tulisan dana tidak bisa dikembalikan..... tapi sebelum kita bayar gada tulisan begitu! salah ga kalau aku ngira walau aku yang telat tpi bisa reschedule",67,Enggak Tulisan Danamu,0.8970184326171875,7,Psikolog Siah Memang,0.8182998299598694,21,Konsulnya Puas Sih,0.8151392936706543
de6275d9-6fa5-4c54-b4a6-08820b4d2e7e,"sangat kecewa karena menirim obat salep anak tanpa segel ataupun segel. sangat"" kecewa !!!!!!!!",22,Responsif Platform Segel,0.7662053108215332,85,Kapok Muntah Banget,0.7223751544952393,83,Hati Cepat Beli,0.7206112146377563
03596c48-16c6-4484-95be-5d02a472aa85,Pengiriman kode otp gagal..... apa maksudnya itu woy niat mau cari konsultasi kulit buat jerawat malah disusahin dari sananya hadehh,1,Otp Login Kalender,0.704929769039154,16,Gua Gimik Kayak,0.7709565162658691,39,Berasa Lama Rembuestment,0.7670061588287354
588d8136-0093-4f66-be5e-4ecf4c0d3fd4,aplikasi busuj login aja kagabisa,110,Akurat Bosok Busuj,0.8675691485404968,35,Force Bug Close,0.7898008227348328,29,Enak Brobat Ribet,0.7406494617462158
e8f40498-887c-44df-b564-00d345baff56,"komplain udah lewat email udah lewat tlp tetep ga ada solusi penyelesaiyan nya. sistem kerja bermasalah, resep sekali pakai giliran stok obat di apt mitra gada malah ga ngasih solusi dikira bisa beli obat tanpa resep gitu. ngapain nyediain jasa konsultasi dokter",71,Solusi Toko Komplen,0.9015477299690247,20,Telp Email Jam,0.8493039608001709,67,Enggak Tulisan Danamu,0.8423852920532227
0a9e7cfc-7421-47e5-a77f-2632837833ad,"buruk bgt, ga rekomen. pesanan tb2 dibatalkan ama dokter nya 👎🏻👎🏻👎🏻",24,Halodoc Tb2 Upgrade,0.8160484433174133,32,Balas Slow Respon,0.8087673187255859,6,Sibuk Dokternya Kepotong,0.8066600561141968
38b98064-d8b1-4123-8da9-06ee9ea9d7f1,"PAKET LAMA BGTT DTNG NYA, UDH 2 MINGGU LEBIH TU PAKET G TAU KEMNA DI PERJALANAN MULU, DI GUNDUL KUYANG KALI YA🥺 WKWK. MAAF YA SEBELUMNYA SY JG G BERMAKSUD KASI bintang⭐ TP INI GIMNA DAH PELAYANAN PENGIRIMAN, MNA G BISA DI RETURN LG ASTAGFIRULLAH 33×. UDH HUBUNGIN CS JG RESPONNYA GITU"" MULU AELAH. MOHON YAA! PAKE BGT SI INI. BAGIAN PENGIRIMAN NYA TOLONG DI PERBAIKI KASIAN ORG (SAYA) YG BUTUH BGT OBATNYA SEGERA TP MALAH DISURUH NUNGGU. SY JG UDH BAYAR ONGKIR TP MALAH BEGINI ADUHH.💔",46,Oktober Paket Pengiriman,0.921183705329895,87,Ojek Efektif Depok,0.8837661743164062,73,Lenyap Gosennya Sampai,0.8802593946456909
88f9afbf-4876-4065-a99d-668c54c8acc7,aplikasi sampah. masak metode pembayaran satu akun cuma bisa pake satu akun gopay.,8,Metode Pembayaran Transfer,0.7210434079170227,29,Enak Brobat Ribet,0.6991177797317505,42,Macam Tolol Aplikasi,0.6943104863166809
c882f7ba-070c-4baf-ade6-687dfb560dc2,error terus gagal pembelian,19,Error Mulu Apalah,0.8546813726425171,40,Ruwet Ribet Ngelag,0.7081010341644287,35,Force Bug Close,0.6959750652313232
74c67575-4b3c-4c35-a07b-1ccc92edd206,"mau konsul ulang twpi dokternya s lalu offline, dan mau di jadwalin put tidak tersedia",25,Tersedia Diresepkan Antibiotik,0.7598192095756531,107,Chatnya Bayar Chat,0.799037516117096,43,Refund Aneh Giliran,0.7980389595031738
40233aad-af3c-4a3c-a659-c5effab8f5f4,"really bad now. chat sm dokter tiba² mati sendiri, gabisa tersambung ke asuransi, ga dapet resep, trus fungsinya apa (?)",6,Sibuk Dokternya Kepotong,0.7790919542312622,64,Bawa Astagfirullah Hangus,0.7559633851051331,90,Bidan Aneh Penyakit,0.7553665637969971
719dbb9e-44f3-4c4a-9988-900aba6052f3,"sangat sangat merugikan konsumen, saat akan beli vitamin dengan 2 merek yg berbeda harus menggunakan 2 kurir pengiriman nya?! DAN ONGKIRNYA MAHAL SEHARUSNYA BISA BELI DI TOKO YG SAMA Tanpa MENGUNAKAN 2 KURIR ! DASAR KAPITALIS Perusahaan YG DI BELI ASTRA CINA PASTI AKAN KAPITALIS !",114,Ongkirnya Kapitalis Tan,0.7450531125068665,52,Produk Toko Dibeli,0.7867257595062256,87,Ojek Efektif Depok,0.7570712566375732
8a5a8af8-e294-43ce-bdc6-a5a9d332884d,"waktu tahun 2019-2021 sy sering konsul psikologi di Halodoc dan top up saldo. saldo msh ad sisa 150rb, setelah itu sy ganti hp dan tdk download Halodoc. bln kmrin sy download sy cek saldo. kok saldo sy hilang? hilang kemana ini saldo sy? tolong penjelasannya. terimakasih",0,Saya Sesi Selesai,0.8338760733604431,4,Saya Paket Pesan,0.8415138721466064,75,Terpotong Saldo Transaksi,0.826840877532959
14630105-878a-426d-86a3-2b4ff814be94,"UI-nya jelek. ketika chat dgn dokter, keyboard menutupi jendela chat, jadi ga bisa melihat apa yg sedang diketik dan percakapan lainnya. belanja obat dari halodoc pengirimannya lambat, resi muncul tapi tidak bisa ditracking, expedisi menggunakan sh*pper.id resi tidak bisa ditracking.",14,Jasa Pengiriman Jam,0.8456507325172424,20,Telp Email Jam,0.8547753095626831,86,Asuransi Bot Diawal,0.8407149314880371
cfe8558d-19ba-4b1b-a5d4-48b6c20aa4cc,kirain layanan gratis.....,33,Gratis Kira Iklan,0.6203314065933228,2,Bad Artis Buruk,0.7927725315093994,12,Mantap Bagus Memuaskan,0.7283339500427246
9a501eb6-ad4d-44bf-8f39-66b5b3640367,"semakin kacau ya aplikasinya... awal saya menggunakan itu cukup bagus, tapi makin ke sini itu selalu membatalkan pesanan secara sepihak dengan alasan tidak jelas. Barang dalam perjalanan, tapi gagal di tengah jalan itu sangat amat aneh. Uang saya nyangkut menjadi saldo yg mubazir. Lalu saat ini lemot sekali",75,Terpotong Saldo Transaksi,0.8575570583343506,45,Admin Very Menerus,0.849593997001648,4,Saya Paket Pesan,0.8298050761222839
9ce9ee62-ba76-4c40-92fd-be105f281004,saya belum menerima paket saya tapi di riwayatnya sudah diterima bagaimana ini kak padahal uangnya hasil tabung jajan saya.. saya mohon tolongg kemana perginya paket saya,4,Saya Paket Pesan,0.8624008893966675,98,Pengembalian Dana Jalan,0.8294523358345032,31,Kurir Diterima Pesanan,0.8231450915336609
c5111f10-8b48-4f08-993e-b170e4880cf8,menyebalkan. pesen resep udah dibayar.malah dibatalkan begitu pesan ulang minta diresepkan antibiotik yang sama kepada dokter begitu minta jawaban dokternya pasien udah mengunakan berulang2 antibiotik.padahal kiriman batal belum nyampai.apa dokter disini begitu ya.usah jangan ada aplikasi ini.bukan malah.membantu pasien.malah bikin pasien.menderita..buruk sekali,25,Tersedia Diresepkan Antibiotik,0.8500842452049255,65,Offline Online Ulang,0.8367067575454712,116,Ganti Disuru Sibuk,0.8366154432296753
1314c573-b21f-4361-9bc6-7b3935778c1a,"aplikasinya tolong dibenarkan lahhhh, banyak banget bug nya",92,Versi Terbaru Handphone,0.8096824884414673,29,Enak Brobat Ribet,0.7823493480682373,11,Hp Hang Error,0.7718622088432312
a6b15d71-c3f5-4469-baab-0169e63800b4,"Emng tolol ga mikir apa cuman tanya doang bayar nya mahal bgt, cuman di Indonesia yg begini kesehatan aja berbayar, fasilitas di Indonesia 0 besar apa apa berbayar, bayangkan cuman tanya doang belum berobat nya loh ga punya hati apa sama aja Alodok atau apk apapun berbayar padahal cuman niat nanyak doang ( saya gak sakit cuman mencurahkan salah satu kelur kesah tinggal di indo yg minim)",7,Psikolog Siah Memang,0.8886857032775879,67,Enggak Tulisan Danamu,0.8299461007118225,74,Bilang Mereka Gelarnya,0.822725772857666
e99f9f1a-0ac9-4c80-bc73-e6ff3bd52f0c,"saya sudah melakukan pembayaran untuk konsultasi dengan dokter, dan pembayaran lewat shopeepay sudah berhasil. tapi mengapa di keterangan halodoc pembayaran gagal, padahal di saldo shopeepay saya sudah kepotong oleh halodoc. berasa kena tipuu lumayan 68ribu",5,Saldo Halodoc Transaksi,0.8609708547592163,75,Terpotong Saldo Transaksi,0.8480698466300964,27,Gara Tanggung Penipu,0.8285716772079468
d52fdf89-d694-4264-89ab-f4e169c0126c,"Sangat kecewa dgn aplikasi ini, saya tidak mendapatkan jawaban apapun. 😤👎🏻masa iyaa harus bayar berkali kali dulu baru bisa dapatkan jawaban.",106,Update 2X Fitur,0.8687393665313721,4,Saya Paket Pesan,0.7978885173797607,0,Saya Sesi Selesai,0.7884433269500732
576c5705-02fc-496b-b2f4-fb5333752fdf,"pesanan tidak sesuai alamat alias salah kirim, pesanan juga tidak sesuai dengan yg diresepkan dokter, harga obat yg diberikan jauh beda dengan yang diresepkan dokter, cukup sekian menggunakan halodoc",25,Tersedia Diresepkan Antibiotik,0.8185136914253235,52,Produk Toko Dibeli,0.7819479703903198,71,Solusi Toko Komplen,0.7522679567337036
4a4afc80-fe81-4aec-b3dc-936b68426689,"ngga ada fitur pengembalian dana, saya udah jadwalkan consul dengan salah satu dokter tapi karena waktu itu hanya ada jam malam akhirnya saya bayar untuk jam malam tersebut tapi saya ketiduran dan sesi konsulnya berakhir, uang saya sudah masuk tapi saya belum konsul harusnya ada fitur pengembalian jika pasien tidak mendapatkan konsultasi",0,Saya Sesi Selesai,0.891287088394165,58,Sibuk Bayar Dibatalkan,0.8376152515411377,17,Surat Periksa Cek,0.8327599167823792
d1aa1c5a-d57e-4fda-a0e4-db4cd5a82a7b,pesanan obat yang ingin dibatalkan tidak itu kenapa ya ? seharusnya bisa dong dibatalkan.,112,Dibatalin Tiba² Butuh,0.7941194176673889,57,Marah Reguler Ekspedisi,0.7681988477706909,15,Instan Pengiriman Hari,0.7594040632247925
1dcfa7c5-208f-4532-8a5e-90a2e80dd003,gk dapat notif waktu konsul kebuang waktu 15 menit,3,Waktu Kurang Buru,0.7569258213043213,104,Menit Sesi 30,0.6716697812080383,105,Sia2 Buang2 Sudahh,0.6689760684967041
489f2e9f-339e-439a-b6e1-38c10e46162b,"udah bayar mahal buat konsultasi, tapi malah dokternya show up di 8 menit terakhir. mana cukup buat konsultasi. mana ga bisa refund, buang buang duit. mending ketemu dokter langsung aja deh",60,Balesnya Kebuang Obgyn,0.889052152633667,21,Konsulnya Puas Sih,0.871870219707489,38,Sia Dpet Pemyakit,0.8634197115898132
2df3d27f-523a-406a-85b5-19e99edb81ae,TIDAK BERGUNA. TIDAK BISA BELI OBAT DENGAN ALASAN APOTIK TUTUP PADAHAL ADA APOTEK 24JAM SEKITAR SINI. BUAT APA KONSULTASI KE DOKTER DAN DIBERI RESEP DOKTER TAPI OBATNYA BARU DATANG BESOK! BUTUH SEKARANG DISURUH NUNGGU SAMPE BESOK!,62,24Jam Apotik Kerjasama,0.9075803756713867,116,Ganti Disuru Sibuk,0.8721767663955688,25,Tersedia Diresepkan Antibiotik,0.8672947883605957
4419f67b-8287-404b-b393-939cfd5ded74,"Proses menyambungkan asuransinya error engga jelas, selalu di suruh kontak heidy dan heidynya juga engga jelas, muter"" prosesnya",37,Log Menyambungkan Dipakai,0.6554898619651794,102,Asuransi Cover Ujung,0.8144834041595459,51,Dibatalin Drivernya Dihapus,0.7788158655166626
4fe4b56d-505e-491f-bd78-b6057bbc67c6,"Hati-hati dengan aplikasi ini, kasus terbaru saya chat dengan dokter semua dicover oleh asuransi tau-tau ada notif chat dokter tidak dicover dan muncul tagihan yang harus dibayar.. Ini sudah masuk ranah penipuan kepada pelanggan..!!!",0,Saya Sesi Selesai,0.8254257440567017,27,Gara Tanggung Penipu,0.8285889029502869,107,Chatnya Bayar Chat,0.8065903782844543
62ac3d49-091b-4c5e-8ea0-388e11b1ecfa,"saya uda bayar untuk konsultasi tpi gada dokter yg menghubungi, dan pas saya cek riwayatnya saya suda melakukan percakapan dengan dokternya pdhl ga sama sekali, dan harus bayar ulang, merugikan. ini orang lagi sakit malah dirugiin",17,Surat Periksa Cek,0.9027683734893799,9,Sekali Respon Bayar,0.8755307197570801,0,Saya Sesi Selesai,0.8662652969360352
338b335f-a0de-4d2d-bffe-14de063c43cd,pesan obat lama banget pengiriman yg katanya 1 jam malah jadi 2 jam lebih,15,Instan Pengiriman Hari,0.8512636423110962,95,Malam Pesenan Minggu,0.8216642141342163,93,Berkali Asma Stuck,0.8180598616600037
ee9cb009-ee26-484c-90fb-53f167fdf7ac,"respon dokter lama, waktu sudah berakhir baru muncul notif, ga guna buangw uang",3,Waktu Kurang Buru,0.8166415095329285,105,Sia2 Buang2 Sudahh,0.7822201251983643,32,Balas Slow Respon,0.7545260787010193
202f6adc-2d09-42e8-a628-1f945f45711b,"dokternya ga bales bales chat sampe waktu saya habis, padahal online.",32,Balas Slow Respon,0.8334780335426331,9,Sekali Respon Bayar,0.832072913646698,107,Chatnya Bayar Chat,0.8190464973449707
61ae0b05-a85e-4df8-be9b-4ac16320f068,"Parah banget saldo terpotong, pesanan ga di terima, toko tutup.. ga niat banget kayanya bikin aplikasi, apa pake anak magang aplikasinya?",42,Macam Tolol Aplikasi,0.8811500072479248,27,Gara Tanggung Penipu,0.8409771919250488,119,Diubah Sehari Ha,0.83625328540802
22f526cc-80c4-4794-a206-2ccd9da979eb,"tolong kalau memang dokternya tidak online, jangan di cantumkan ke dalam online, sudah kejadian 2x saya mau konsultasi sampe nunggu lama hanya karna tulisannya dokter online kenyataan nya nunggu lama bahkan ada yang di chat tapi sampai tidak membalas",0,Saya Sesi Selesai,0.8883559703826904,20,Telp Email Jam,0.8672941327095032,17,Surat Periksa Cek,0.8586786389350891
c9cc8fd8-e759-4434-9504-e36c7cf95601,tanggal lahir Desember kok cuma sampai tanggal 30 tanggal 31 DESEMBER tidak ada tidak bisa bikin AKUN valid,81,Malaysia Akun Negara,0.8219630122184753,36,Doktr Kartu Kok,0.7545562982559204,68,Manual Alamat Secara,0.7241764068603516
dd2c3c7d-215a-4d8d-aa5e-ac65b78ca1d4,"sistem sangat merugikan jika salah satu dari obat yang diresepkan tidak tersedia, mohon ditambahkan fitur multiple apotik jika stock tidak lengkap di apotik lainnya, dan lucunya dokter meresepkan 5 strip obat, tapi cuman bisa masukin ke keranjang maximal 2, jadi karena antibiotik saya terpaksa memesan 2 + 2 + 1, dengan biaya grab 4x orderan untuk 1 resep",25,Tersedia Diresepkan Antibiotik,0.8544660806655884,52,Produk Toko Dibeli,0.8248224258422852,62,24Jam Apotik Kerjasama,0.7883083820343018
2545573a-0a75-4d79-9dc6-fbff9f964503,"kalo malem gak selalu stand by dokternya padahal profilnya online.. udah 2 kali kayagini. Alhasil cancel, tapi refund dananya lama banget. padahal urgent.",60,Balesnya Kebuang Obgyn,0.8327852487564087,65,Offline Online Ulang,0.8642452359199524,43,Refund Aneh Giliran,0.8442704081535339
355e9a88-ce43-401a-a440-345ca6bbc0b8,"Server eror terus, payah masa cekout obat ga bisa, trus buat apa??",29,Enak Brobat Ribet,0.7704290151596069,119,Diubah Sehari Ha,0.78128981590271,50,Nomer Orang Susah,0.7768887877464294
9f7678d4-a28f-4b9c-b586-653fbe39d820,"user interfacenya terasa tidak nyaman, ketika layanan dimulai, jendela room chat tidak menyesuaikan dengan tampilan keyboard, sehingga apa yg diketik tidak terlihat di hp saya, namun bisa dilihat jika tampilan keyboard harus ditutup dahulu.",44,Hp Ngeblank Pembaruan,0.7053393721580505,88,Cat Riwayat Top,0.7313519716262817,1,Otp Login Kalender,0.727601170539856
27828771-033e-4357-886c-2d0f9b2c896b,mau bayar lewat dana susah amat,8,Metode Pembayaran Transfer,0.740308403968811,103,Ribet Ribu Stanby,0.7787889838218689,94,Ktp 50 Dikasih,0.749943733215332
79d4b576-3fa8-4c2e-8ac9-acbf57db0b77,drivernya gabisa jaga privasi 🙂,51,Dibatalin Drivernya Dihapus,0.6919394731521606,110,Akurat Bosok Busuj,0.7609549760818481,47,Pengantaran Alur Bermitra,0.7271935939788818
b23ac92d-9936-4cdb-8627-1bf3cbb7cd83,edit profil lama bgt,68,Manual Alamat Secara,0.614169716835022,19,Error Mulu Apalah,0.750802755355835,40,Ruwet Ribet Ngelag,0.7403428554534912
34895587-2f62-4708-9035-c06221620eeb,"Coba Konsul ke psikiater ternyata GK kompeten, respon nya juga lambat cuma. di jawab sekali saja sampai sesi habis. Dari CS nya juga kasih solusi masalahnya lamaa, itupun kompensasi nya cuman dapat voucher bukan full refund. DANN.... voucher nya tidak Full seharga sesi konsultasi nya melainkan hanya setengah Harga... dasar aplikasi scam GK worth it",104,Menit Sesi 30,0.8681591749191284,86,Asuransi Bot Diawal,0.8751043677330017,0,Saya Sesi Selesai,0.8734850883483887
fa7e1904-020d-40b0-832a-053a16c32a47,"pengiriman lambat tidak ada update di riwayat, bilang 4 hari sudah seminggu TDK di kirim. padahal sudah bayar lunas, FATAL sudah di email sudah di chat jg dibilang di tunggu sampai kapan kah...sebulan atau setahun kita harus menunggu, dibatalkan tidak bisa,,,miris sekali",20,Telp Email Jam,0.858439028263092,45,Admin Very Menerus,0.8650875091552734,73,Lenyap Gosennya Sampai,0.8592930436134338
93718fba-d4c5-44dc-a805-ae9cc8d96397,"Dokumen harus2 lengkap, cap basah dari dokter, nama dokter, resep obat, padahal periksa di klinik kampung, yang jelas cuman ada kwitansi dan stempel. Dan petugas pun diminta ya cuman dikasih itu, reimburstment lewat pihak ketiga cuman malah ribet/rugi.",21,Konsulnya Puas Sih,0.8096923828125,60,Balesnya Kebuang Obgyn,0.7974029779434204,102,Asuransi Cover Ujung,0.7887355089187622
453750a6-f128-4a92-8b89-e024cfe2c6aa,pesanan dikirim gak sesuai waktu ! pengiriman 3 jam tapi dari siang sampai malam gak sampai sampai. anak butuh obat tguin obatnya sampai malam berujung ga ad obat ga mnum obat ! mau chat driver jg gbsa ! apliksi jelek! pelayanan jelek!,89,Pelayanan Buruk Sebagai,0.7477452754974365,73,Lenyap Gosennya Sampai,0.8769611120223999,41,Produk Jam Keterangan,0.8710130453109741
2ce82219-6a6f-4c75-a8e8-dd3ff6f79a9c,"saya mau komplain pesanan saya dari toko kesehatan sampai sekarang ngak sampai sampai dan sudah melebihi estimasi sampainya. saya sudah hubungin cs via tlp halodoc ngak diangkat dengan alasan lagi pada sibuk,kalo susah dihubungin buat apa ada cs. customer jadi susah kalo mau komplain",73,Lenyap Gosennya Sampai,0.892076849937439,20,Telp Email Jam,0.8653098344802856,46,Oktober Paket Pengiriman,0.8513556122779846
128ef6ab-27a2-459f-9390-a7456f9a47d0,"Pembelian obat tidak bisa cod, alhasil pake saldo udh dipotong buat biaya pengiriman, setelah sampai malah ditagih uang dengan nominal pengiriman, payah 🫩 malah bayar dua kali",111,Ekspedisinya Sice Majalengka,0.8789283037185669,115,Pick Status Lapor,0.8128562569618225,15,Instan Pengiriman Hari,0.8001598119735718
37dd2bac-515c-4365-8136-430dea73096f,"Estimasi Paket saya sampainya tanggal 11 juli 2025, tapi ini udah tanggal 12 juli belum juga sampai paket obat saya. ketika saya email, belum direspon sama sekali.",26,Tanggal Paket Reguler,0.9041029214859009,41,Produk Jam Keterangan,0.83539217710495,31,Kurir Diterima Pesanan,0.8295662999153137
e2a16066-4674-4308-ae0a-12583147a9c9,"hapus aja apk ini, mau uang aja, susah untuk konsultasi",103,Ribet Ribu Stanby,0.8091778755187988,29,Enak Brobat Ribet,0.7703870534896851,42,Macam Tolol Aplikasi,0.7454296350479126
fc7ca58c-27ca-457b-ba54-97a8b447aa01,"Produk yang dikirim beda, hubungi cs maksimal 3x24jam. Setelah 5 hari diinfo produk sesuai, cek link ehh foto produk sudah diganti. Hmmm menyeramkan hal hal seperti ini. Uninstall langsung.",41,Produk Jam Keterangan,0.7855718731880188,14,Jasa Pengiriman Jam,0.768973171710968,76,Gambar Sesuai Barang,0.7659727334976196
d677b5b5-498d-420b-92ff-2589160c43e6,aplikasi buruk,2,Bad Artis Buruk,0.8845421671867371,12,Mantap Bagus Memuaskan,0.7882016897201538,18,Hilda Errorrrrrrrrr Pehhh,0.7513418793678284
9961ec9b-0c0a-4643-bcc0-045d1b48825d,cerita doang. dikasih resep kaga,53,Kagak Doang Cerita,0.8616150617599487,16,Gua Gimik Kayak,0.7197683453559875,94,Ktp 50 Dikasih,0.68705153465271
1326ff3c-fd5a-4d68-8ed5-5975d4ac32df,"Tolong kembali seperti dulu lagi, ada banyak outlet dimana-mana , jangan seperti sekarang dimonopoli oleh segelintir orang saja, kasihan para driver dan customer harus menunggu lama utk 1 orderan.",23,Driver Gosend Korlap,0.7717690467834473,101,Harganya Jual 5Rb,0.7230755090713501,52,Produk Toko Dibeli,0.7065765261650085
7887fc88-c216-46fb-8075-e9eb12cf22ac,jelek banget sumpah aplikasi ny. kaya menguji kesabarn banget. apalagi pas di metode pembyarn. semuany udah di coba tpi gk bisa. sekali udah d top up eh metode pmbayrn yg tdi di isi jdi hilang. mna sesi ny cuma 30 mnit,44,Hp Ngeblank Pembaruan,0.8478025794029236,10,Device Loading Berat,0.824588418006897,27,Gara Tanggung Penipu,0.8059687614440918
5a837400-82a6-4ff4-b283-bc0ecfc1734c,"driver ny dibayar lebih murah dari yg di aplikasi, apa lg klo medex yg instan cuma dibayar 4800 dngn jarak yg ga sesuai antara aplikasi dan maps",15,Instan Pengiriman Hari,0.6521422863006592,13,Lokasi Apotek Kota,0.763542652130127,66,Mahal Harga Meninggal,0.7572789192199707
2315bdad-740b-41ac-91df-a50a7cfc4f43,low respon banget ihh,32,Balas Slow Respon,0.6964901685714722,47,Pengantaran Alur Bermitra,0.7566730380058289,40,Ruwet Ribet Ngelag,0.752995491027832
87158d4b-02b1-42bf-959e-bc6cbffc95e9,"Payah saya sudah melaporkan kendala saya dari hari Jumat, dipusat bantuan bilang klo menggunakan gopay uang otomatis langsung kembali dan saya kirim email tunggu 3 hari. masa iya selama itu kendala nya",4,Saya Paket Pesan,0.8854526877403259,75,Terpotong Saldo Transaksi,0.8535627126693726,31,Kurir Diterima Pesanan,0.8467975854873657
334a817e-374b-4556-ad45-d4ca97fa54c4,obat di kirim lama ketika di tanya ke aplikasi jawabannya bertele tele,22,Responsif Platform Segel,0.7923005223274231,15,Instan Pengiriman Hari,0.781846284866333,83,Hati Cepat Beli,0.7666274905204773
ba487242-1419-4f2f-aebb-5757351d526e,"Udah bayar tapi malah katanya ""kemungkinan dokter lagi sibuk"" lah sia² duitku bayarnya",6,Sibuk Dokternya Kepotong,0.8418870568275452,48,Lain Dokternyaa Cari,0.8008632063865662,38,Sia Dpet Pemyakit,0.7684855461120605
0b40c3a1-3dc5-4027-b8f7-4a325fd5f56f,"maaf, nyari obat lewat hp saya tapi tertera stok habis. ketika teman nyari di hp nya ada.. kok bisa ya..apakah ini ada kaitannya dengan perbedaan domisili atau jenis hp?",44,Hp Ngeblank Pembaruan,0.7501494884490967,117,Karawang Alamatnya Bekasi,0.7709587216377258,25,Tersedia Diresepkan Antibiotik,0.7661160230636597
2384b1f8-f96b-4084-9188-a3f798fa2347,"utk daerah yg tdk sepadat apoteknya sprti jabodetabek , online tdk berfungsi,banyak obat kosong ,ttp hrs offline",25,Tersedia Diresepkan Antibiotik,0.7734639048576355,62,24Jam Apotik Kerjasama,0.760328471660614,13,Lokasi Apotek Kota,0.7527238130569458
3711cec6-73c5-4694-82e4-2040a51b50b0,"dokternya baru ngerespon 8 menit sebelum sesi berakhir wkwkwk, saat notif dari halodoc muncul sesinya udah berakhir.",32,Balas Slow Respon,0.6750141382217407,104,Menit Sesi 30,0.6895660161972046,61,Tiba Koneksi Ulang,0.6861587762832642
228b1ef3-0213-406f-8437-b2f27f02c296,"slow respon banget sekarang,",47,Pengantaran Alur Bermitra,0.8154687285423279,40,Ruwet Ribet Ngelag,0.71025550365448,32,Balas Slow Respon,0.7064995169639587
daa8d68d-d88f-467c-8dd0-fce0097aa136,"Saya merasa sangat kecewa. Dengan biaya Rp115.000, saya berharap bisa mendapatkan arahan yang lebih spesifik dan aplikatif sesuai kondisi saya yang sedang berat secara mental dan finansial. Namun, yang saya dapat hanya saran yg sangat umum seperti 'dicoba sedikit-sedikit' dan 'jangan buru-buru'. Saya sudah menjelaskan latar belakang dan harapan saya dengan cukup rinci, tapi tidak ditanggapi dengan kedalaman atau empati yang saya harapkan.",0,Saya Sesi Selesai,0.7462076544761658,91,Like Dislike Jwaban,0.7665117979049683,82,Sebelah Sesi Client,0.7041852474212646
4571d4ca-67fd-4958-b213-2cd7f4caa4ee,harus bngt ribet mau konsul,103,Ribet Ribu Stanby,0.7934980988502502,40,Ruwet Ribet Ngelag,0.7523005604743958,94,Ktp 50 Dikasih,0.7297362685203552
cc1e7e79-2ae0-47fc-a35b-3fe385f04703,untuk pemesanan obat di kendari Sulawesi Tenggara masih banyak yang tidak tersedia. apotik rekanan halodocnya masih sedikit. di resepkan 5 obat oleh dokter yang tersedia cuman 1 obat,25,Tersedia Diresepkan Antibiotik,0.8255712985992432,52,Produk Toko Dibeli,0.7850838899612427,101,Harganya Jual 5Rb,0.7836583256721497
821ddb4a-fb56-42b1-a4ed-ad2b32b31d38,"saya belum selesai konsultasi tapi sudah habis saja waktunya, jadi dokternya sedikit kesulitan untuk mendiagnosis sakit yg saya derita apa?. saran, Tolong untuk timer Waktunya, agak di perpanjang Lebih dari (30 menit) menurut saya untuk konsultasi tentang kejiwaan itu terlalu cepat🙏🏻(apalagi ini konsultasinya via online bukan langsung). karena problem dan kejadian yg di derita setiap pasien itu berbeda-beda. kadang ada pasien yg ketika di timer itu jadi Tidak fokus menjelaskan.sprti tergupuh",0,Saya Sesi Selesai,0.8805825710296631,82,Sebelah Sesi Client,0.8687312602996826,74,Bilang Mereka Gelarnya,0.8387835025787354
ae73389d-b050-477c-be2c-8729287cce56,"konsul dr. sp. N, sudah bayar, chat panjang lebar tapi ga dibalas.. kecewa",97,Sapa Kecantikan Kadang,0.8096491694450378,34,Buang Janji Doang,0.7638931274414062,86,Asuransi Bot Diawal,0.7600191831588745
4e6f7e9c-1e39-4d01-8de2-5360ead6f8ba,"bikin 2 order. 1. obat dikirim ke next day, padahal pakai instan. 2. obat ada, tp gak dapet driver. hedeh...",95,Malam Pesenan Minggu,0.827509880065918,15,Instan Pengiriman Hari,0.855126678943634,41,Produk Jam Keterangan,0.8401988744735718
